"","ID","Timestamp","Trial","counterbalance","phase","description_stop","paired_vid","onset","offset","description_content","importance","time","tag","vidpath","Datastring","test_trial"
"649","1155",1712152579291,"8","1","practice","1","2",12,33,"cow 1 threw a rock at cow 2 with a thought bubble claiming the object in the water was a crocodile. Cow 2 disagreed and had a thought bubble that it was a log. Cow 1 poked the object with a stick, so cow 2 had a thought bubble that it was a log again. Cow 1 jumped onto the object.",5,5,"prac_segB_desc","/static/video/Prac/wildebeest_part2.mp4","{""phase"": ""description"", ""counterbalance"": 1, ""vidpath"": ""/static/video/Prac/wildebeest_part2.mp4"", ""descstop"": 1, ""vidpair"": 2, ""offset"": ""33"", ""content"": ""cow 1 threw a rock at cow 2 with a thought bubble claiming the object in the water was a crocodile. Cow 2 disagreed and had a thought bubble that it was a log. Cow 1 poked the object with a stick, so cow 2 had a thought bubble that it was a log again. Cow 1 jumped onto the object."", ""importance"": ""5"", ""time"": 94456, ""tag"": ""prac_segB_desc""}","description"
"654","1156",1711992248091,"8","8","practice","1","2",12,33,"The two wildebeests are still arguing about whether or not the object in the water is a log or a crocodile. The one believing it's a croc splashes water on it in an attempt to convince the other of the truth. The object doesn't move. It then jumps onto the back of the object.",6,6,"prac_segB_desc","/static/video/Prac/wildebeest_part2.mp4","{""phase"": ""description"", ""counterbalance"": 8, ""vidpath"": ""/static/video/Prac/wildebeest_part2.mp4"", ""descstop"": 1, ""vidpair"": 2, ""offset"": ""33"", ""content"": ""The two wildebeests are still arguing about whether or not the object in the water is a log or a crocodile. The one believing it's a croc splashes water on it in an attempt to convince the other of the truth. The object doesn't move. It then jumps onto the back of the object."", ""importance"": ""6"", ""time"": 93049, ""tag"": ""prac_segB_desc""}","description"
"658","1157",1712070199842,"12","1","practice","1","2",12,33,"The 2 antelopes on the side of the water were discussing what was in the water. One side it was a crocodile and the other disagreed. The curious one on the left poked the object with a stick before jumping onto it..",5,5,"prac_segB_desc","/static/video/Prac/wildebeest_part2.mp4","{""phase"": ""description"", ""counterbalance"": 1, ""vidpath"": ""/static/video/Prac/wildebeest_part2.mp4"", ""descstop"": 1, ""vidpair"": 2, ""offset"": ""33"", ""content"": ""The 2 antelopes on the side of the water were discussing what was in the water. One side it was a crocodile and the other disagreed. The curious one on the left poked the object with a stick before jumping onto it.."", ""importance"": ""5"", ""time"": 51244, ""tag"": ""prac_segB_desc""}","description"
"663","1158",1712070122513,"8","2","practice","1","2",12,33,"There are two wildebeest near a river.  There is something floating in the river and the two wildebeest are trying to decide if it is a log or a crocodile.  They poke it with a stick and finally one of the wildebeest steps on it, probably thinking it is a log. ",6,6,"prac_segB_desc","/static/video/Prac/wildebeest_part2.mp4","{""phase"": ""description"", ""counterbalance"": 2, ""vidpath"": ""/static/video/Prac/wildebeest_part2.mp4"", ""descstop"": 1, ""vidpair"": 2, ""offset"": ""33"", ""content"": ""There are two wildebeest near a river.  There is something floating in the river and the two wildebeest are trying to decide if it is a log or a crocodile.  They poke it with a stick and finally one of the wildebeest steps on it, probably thinking it is a log. "", ""importance"": ""6"", ""time"": 68452, ""tag"": ""prac_segB_desc""}","description"
"668","1159",1702480361475,"8","1","practice","1","2",12,33,"The cow after throwing stone and a log of wood on the crocodile, decides to jump on its back as the crocodile did not move.",5,5,"prac_segB_desc","/static/video/Prac/wildebeest_part2.mp4","{""phase"": ""description"", ""counterbalance"": 1, ""vidpath"": ""/static/video/Prac/wildebeest_part2.mp4"", ""descstop"": 1, ""vidpair"": 2, ""offset"": ""33"", ""content"": ""The cow after throwing stone and a log of wood on the crocodile, decides to jump on its back as the crocodile did not move."", ""importance"": ""5"", ""time"": 72879, ""tag"": ""prac_segB_desc""}","description"
"673","1162",1712772931947,"8","4","practice","1","2",12,33,"The two bison were still arguing about whether or not the thing in the water was a log or a crocodile. The bison on the right jumped on the thing.",6,6,"prac_segB_desc","/static/video/Prac/wildebeest_part2.mp4","{""phase"": ""description"", ""counterbalance"": 4, ""vidpath"": ""/static/video/Prac/wildebeest_part2.mp4"", ""descstop"": 1, ""vidpair"": 2, ""offset"": ""33"", ""content"": ""The two bison were still arguing about whether or not the thing in the water was a log or a crocodile. The bison on the right jumped on the thing."", ""importance"": ""6"", ""time"": 52236, ""tag"": ""prac_segB_desc""}","description"
"678","1163",1714406148713,"8","0","practice","1","2",12,33,"Two buffalo stand at the edge of a bank, they are arguing about something that is currently floating in the water.  One believes it to be a alligator, one beliefs it to be a floating log.  The one that believes it's an alligator tests the floating object by poking it, throwing rocks at it, and standing on it.  ",7,7,"prac_segB_desc","/static/video/Prac/wildebeest_part2.mp4","{""phase"": ""description"", ""counterbalance"": 0, ""vidpath"": ""/static/video/Prac/wildebeest_part2.mp4"", ""descstop"": 1, ""vidpair"": 2, ""offset"": ""33"", ""content"": ""Two buffalo stand at the edge of a bank, they are arguing about something that is currently floating in the water.  One believes it to be a alligator, one beliefs it to be a floating log.  The one that believes it's an alligator tests the floating object by poking it, throwing rocks at it, and standing on it.  "", ""importance"": ""7"", ""time"": 70631, ""tag"": ""prac_segB_desc""}","description"
"683","1164",1713371386899,"8","7","practice","1","2",12,33,"The two cows were trying to cross the river but there was something that looked oddly like a crocodile, or a log of wood. One threw a stone at it to see if it were a crocdile, then it poked it with a stick and then it splashed water on it",6,6,"prac_segB_desc","/static/video/Prac/wildebeest_part2.mp4","{""phase"": ""description"", ""counterbalance"": 7, ""vidpath"": ""/static/video/Prac/wildebeest_part2.mp4"", ""descstop"": 1, ""vidpair"": 2, ""offset"": ""33"", ""content"": ""The two cows were trying to cross the river but there was something that looked oddly like a crocodile, or a log of wood. One threw a stone at it to see if it were a crocdile, then it poked it with a stick and then it splashed water on it"", ""importance"": ""6"", ""time"": 126798, ""tag"": ""prac_segB_desc""}","description"
"688","1166",1712073789213,"8","8","practice","1","2",12,33,"Two oxen have an argument about whether something floating in the water is a crocodile or a log. The one who think it's a crocodile throws a ball at it, then pokes it, then splashes water on it.",6,6,"prac_segB_desc","/static/video/Prac/wildebeest_part2.mp4","{""phase"": ""description"", ""counterbalance"": 8, ""vidpath"": ""/static/video/Prac/wildebeest_part2.mp4"", ""descstop"": 1, ""vidpair"": 2, ""offset"": ""33"", ""content"": ""Two oxen have an argument about whether something floating in the water is a crocodile or a log. The one who think it's a crocodile throws a ball at it, then pokes it, then splashes water on it."", ""importance"": ""6"", ""time"": 80098, ""tag"": ""prac_segB_desc""}","description"
"692","1167",1712070002302,"8","0","practice","1","2",12,33,"Two buffalo are at a water bank. They are debating rather or not an object in the water is an alligator or log. One of them throws a pebble and uses a stick to hit the object. After it doesn't move, one of the buffalos jumps on top of the object.",4,4,"prac_segB_desc","/static/video/Prac/wildebeest_part2.mp4","{""phase"": ""description"", ""counterbalance"": 0, ""vidpath"": ""/static/video/Prac/wildebeest_part2.mp4"", ""descstop"": 1, ""vidpair"": 2, ""offset"": ""33"", ""content"": ""Two buffalo are at a water bank. They are debating rather or not an object in the water is an alligator or log. One of them throws a pebble and uses a stick to hit the object. After it doesn't move, one of the buffalos jumps on top of the object."", ""importance"": ""4"", ""time"": 117099, ""tag"": ""prac_segB_desc""}","description"
"697","1168",1712073798249,"8","4","practice","1","2",12,33,"2 ox's are at the side of the creek. They look into the water and see what appears to be a log or an alligator. They're debating on what it could be and one decides to pick up a rock and throw it at the log/alligator. The other  ox jumps onto it.  ",5,5,"prac_segB_desc","/static/video/Prac/wildebeest_part2.mp4","{""phase"": ""description"", ""counterbalance"": 4, ""vidpath"": ""/static/video/Prac/wildebeest_part2.mp4"", ""descstop"": 1, ""vidpair"": 2, ""offset"": ""33"", ""content"": ""2 ox's are at the side of the creek. They look into the water and see what appears to be a log or an alligator. They're debating on what it could be and one decides to pick up a rock and throw it at the log/alligator. The other  ox jumps onto it.  "", ""importance"": ""5"", ""time"": 172989, ""tag"": ""prac_segB_desc""}","description"
"702","1169",1712070605166,"8","2","practice","1","2",12,33,"The two wilderbeasts continued to disagree over whether the object in the water is a crocodile or a log. The wilderbeast that believes its a crocodile threw a stone at the object and then poked it with a stick.",6,6,"prac_segB_desc","/static/video/Prac/wildebeest_part2.mp4","{""phase"": ""description"", ""counterbalance"": 2, ""vidpath"": ""/static/video/Prac/wildebeest_part2.mp4"", ""descstop"": 1, ""vidpair"": 2, ""offset"": ""33"", ""content"": ""The two wilderbeasts continued to disagree over whether the object in the water is a crocodile or a log. The wilderbeast that believes its a crocodile threw a stone at the object and then poked it with a stick."", ""importance"": ""6"", ""time"": 83461, ""tag"": ""prac_segB_desc""}","description"
"707","1170",1712152601066,"8","6","practice","1","2",12,33,"The two bulls are still arguing over whether the half-shown object in the water is an alligator or log. The one that thinks it's an alligator pokes it with a stick and then jumps on it to make the final determination.",2,2,"prac_segB_desc","/static/video/Prac/wildebeest_part2.mp4","{""phase"": ""description"", ""counterbalance"": 6, ""vidpath"": ""/static/video/Prac/wildebeest_part2.mp4"", ""descstop"": 1, ""vidpair"": 2, ""offset"": ""33"", ""content"": ""The two bulls are still arguing over whether the half-shown object in the water is an alligator or log. The one that thinks it's an alligator pokes it with a stick and then jumps on it to make the final determination."", ""importance"": ""2"", ""time"": 46573, ""tag"": ""prac_segB_desc""}","description"
"712","1171",1714401031572,"8","3","practice","1","2",12,33,"The two bulls between them either thought it was a log or a crocodile. One bull then throws stones to see if it moves which it does not. Then the bull that flung the stone stepped on to the rock.",2,2,"prac_segB_desc","/static/video/Prac/wildebeest_part2.mp4","{""phase"": ""description"", ""counterbalance"": 3, ""vidpath"": ""/static/video/Prac/wildebeest_part2.mp4"", ""descstop"": 1, ""vidpair"": 2, ""offset"": ""33"", ""content"": ""The two bulls between them either thought it was a log or a crocodile. One bull then throws stones to see if it moves which it does not. Then the bull that flung the stone stepped on to the rock."", ""importance"": ""2"", ""time"": 76633, ""tag"": ""prac_segB_desc""}","description"
"717","1173",1713371180962,"8","7","practice","1","2",12,33,"Two wildebeests are standing at the edge of the water. There is something in the water. One of them says it's an alligator. The other says it's a stone. The first one throws a rock and nothing happens. They argue again. It then pokes it with a stick. Nothing happens. They argue a third time and the first one jumps on the object.",6,6,"prac_segB_desc","/static/video/Prac/wildebeest_part2.mp4","{""phase"": ""description"", ""counterbalance"": 7, ""vidpath"": ""/static/video/Prac/wildebeest_part2.mp4"", ""descstop"": 1, ""vidpair"": 2, ""offset"": ""33"", ""content"": ""Two wildebeests are standing at the edge of the water. There is something in the water. One of them says it's an alligator. The other says it's a stone. The first one throws a rock and nothing happens. They argue again. It then pokes it with a stick. Nothing happens. They argue a third time and the first one jumps on the object."", ""importance"": ""6"", ""time"": 64617, ""tag"": ""prac_segB_desc""}","description"
"722","1174",1712769652887,"8","0","practice","1","2",12,33,"There are two steers that are standing at the edge of a riverbank and looking into the water. Bubbles appear over each steer indicating what they think an object in the water is; one thinks it's an alligator, while the other thinks it's a log. One of the steers pokes a stick at the object, but the object doesn't move.",5,5,"prac_segB_desc","/static/video/Prac/wildebeest_part2.mp4","{""phase"": ""description"", ""counterbalance"": 0, ""vidpath"": ""/static/video/Prac/wildebeest_part2.mp4"", ""descstop"": 1, ""vidpair"": 2, ""offset"": ""33"", ""content"": ""There are two steers that are standing at the edge of a riverbank and looking into the water. Bubbles appear over each steer indicating what they think an object in the water is; one thinks it's an alligator, while the other thinks it's a log. One of the steers pokes a stick at the object, but the object doesn't move."", ""importance"": ""5"", ""time"": 87113, ""tag"": ""prac_segB_desc""}","description"
"727","1175",1712672346848,"8","8","practice","1","2",12,33,"The first buffalo insists that it is a crocodile, but the other buffalo disagres. The first buffalo then pokes the crocodile/log with a stick before jumping on top of it.",7,7,"prac_segB_desc","/static/video/Prac/wildebeest_part2.mp4","{""phase"": ""description"", ""counterbalance"": 8, ""vidpath"": ""/static/video/Prac/wildebeest_part2.mp4"", ""descstop"": 1, ""vidpair"": 2, ""offset"": ""33"", ""content"": ""The first buffalo insists that it is a crocodile, but the other buffalo disagres. The first buffalo then pokes the crocodile/log with a stick before jumping on top of it."", ""importance"": ""7"", ""time"": 44538, ""tag"": ""prac_segB_desc""}","description"
"731","1177",1712070401484,"8","6","practice","1","2",12,33,"The one moose decides to poke the reptile or log that is in the water. Nothing happens, so the one moose decides to stand on the park sticking up from the water. ",5,5,"prac_segB_desc","/static/video/Prac/wildebeest_part2.mp4","{""phase"": ""description"", ""counterbalance"": 6, ""vidpath"": ""/static/video/Prac/wildebeest_part2.mp4"", ""descstop"": 1, ""vidpair"": 2, ""offset"": ""33"", ""content"": ""The one moose decides to poke the reptile or log that is in the water. Nothing happens, so the one moose decides to stand on the park sticking up from the water. "", ""importance"": ""5"", ""time"": 97569, ""tag"": ""prac_segB_desc""}","description"
"736","1178",1698251921669,"8","5","practice","1","2",12,33,"Two cartoon water buffalo were standing at the side of a stream looking at an object in the water. They were debating with one another whether the item in the water was a crocodile or a log. This was done in buffalo language- you new what they were saying because the mooing noises they were making were accompanied by pictures. They tried throwing a stone at the object and poking it with a stick but didn't agree on what the object was. ",6,6,"prac_segB_desc","/static/video/Prac/wildebeest_part2.mp4","{""phase"": ""description"", ""counterbalance"": 5, ""vidpath"": ""/static/video/Prac/wildebeest_part2.mp4"", ""descstop"": 1, ""vidpair"": 2, ""offset"": ""33"", ""content"": ""Two cartoon water buffalo were standing at the side of a stream looking at an object in the water. They were debating with one another whether the item in the water was a crocodile or a log. This was done in buffalo language- you new what they were saying because the mooing noises they were making were accompanied by pictures. They tried throwing a stone at the object and poking it with a stick but didn't agree on what the object was. "", ""importance"": ""6"", ""time"": 193960, ""tag"": ""prac_segB_desc""}","description"
"741","1179",1702749044038,"8","1","practice","1","2",12,33,"The two moose's were arguing over the thing in the water being a log or crocodile. One moose then threw a rock at it and poked it with a stick. The moose is about to step on it.  ",5,5,"prac_segB_desc","/static/video/Prac/wildebeest_part2.mp4","{""phase"": ""description"", ""counterbalance"": 1, ""vidpath"": ""/static/video/Prac/wildebeest_part2.mp4"", ""descstop"": 1, ""vidpair"": 2, ""offset"": ""33"", ""content"": ""The two moose's were arguing over the thing in the water being a log or crocodile. One moose then threw a rock at it and poked it with a stick. The moose is about to step on it.  "", ""importance"": ""5"", ""time"": 55684, ""tag"": ""prac_segB_desc""}","description"
"746","1181",1698251542356,"8","1","practice","1","2",12,33,"Two bulls are standing at the edge of a body of water, looking over a brown-green object that seems to be floating in the water. The bulls make sounds that convey a discussion. One of the bulls seems to think the object is a log, while the other bull thinks it's a crocodile. To find out, the bull that thinks it's a crocodile throws a stone to the object, but the object doesn't move. Then, the bull pokes it with a stick, but there's also no movement. Finally, the bull steps on the object.",5,5,"prac_segB_desc","/static/video/Prac/wildebeest_part2.mp4","{""phase"": ""description"", ""counterbalance"": 1, ""vidpath"": ""/static/video/Prac/wildebeest_part2.mp4"", ""descstop"": 1, ""vidpair"": 2, ""offset"": ""33"", ""content"": ""Two bulls are standing at the edge of a body of water, looking over a brown-green object that seems to be floating in the water. The bulls make sounds that convey a discussion. One of the bulls seems to think the object is a log, while the other bull thinks it's a crocodile. To find out, the bull that thinks it's a crocodile throws a stone to the object, but the object doesn't move. Then, the bull pokes it with a stick, but there's also no movement. Finally, the bull steps on the object."", ""importance"": ""5"", ""time"": 227455, ""tag"": ""prac_segB_desc""}","description"
"751","1182",1712070163390,"8","1","practice","1","2",12,33,"The bulls are debating whether the object in the river is a log or a alligator.   One of the bulls is testing to see what it is by poking it with a stick and splashing it with water.",3,3,"prac_segB_desc","/static/video/Prac/wildebeest_part2.mp4","{""phase"": ""description"", ""counterbalance"": 1, ""vidpath"": ""/static/video/Prac/wildebeest_part2.mp4"", ""descstop"": 1, ""vidpair"": 2, ""offset"": ""33"", ""content"": ""The bulls are debating whether the object in the river is a log or a alligator.   One of the bulls is testing to see what it is by poking it with a stick and splashing it with water."", ""importance"": ""3"", ""time"": 88279, ""tag"": ""prac_segB_desc""}","description"
"756","1183",1711992527206,"8","2","practice","1","2",12,33,"The two animals argued what was in the water. while one believed it was a crocodile, the other believed it was a log of wood. The first animal threw a stone at the object, poked it with a stick, splashed water on it. All this and the object remained in the same place. Finally, the animal climbed on top the stone",5,5,"prac_segB_desc","/static/video/Prac/wildebeest_part2.mp4","{""phase"": ""description"", ""counterbalance"": 2, ""vidpath"": ""/static/video/Prac/wildebeest_part2.mp4"", ""descstop"": 1, ""vidpair"": 2, ""offset"": ""33"", ""content"": ""The two animals argued what was in the water. while one believed it was a crocodile, the other believed it was a log of wood. The first animal threw a stone at the object, poked it with a stick, splashed water on it. All this and the object remained in the same place. Finally, the animal climbed on top the stone"", ""importance"": ""5"", ""time"": 132276, ""tag"": ""prac_segB_desc""}","description"
"761","1184",1711992340434,"8","3","practice","1","2",12,33,"Scene starts of full of fog and as it clears you see to wildebeest. They are at what looks like a water hole and they are discussing and object in the water. One thinks its a crocodile and the other thinks its a log. The one who thinks it s a croc is poking it, splashing it with water, and eventually put his hooves on it.  ",3,3,"prac_segB_desc","/static/video/Prac/wildebeest_part2.mp4","{""phase"": ""description"", ""counterbalance"": 3, ""vidpath"": ""/static/video/Prac/wildebeest_part2.mp4"", ""descstop"": 1, ""vidpair"": 2, ""offset"": ""33"", ""content"": ""Scene starts of full of fog and as it clears you see to wildebeest. They are at what looks like a water hole and they are discussing and object in the water. One thinks its a crocodile and the other thinks its a log. The one who thinks it s a croc is poking it, splashing it with water, and eventually put his hooves on it.  "", ""importance"": ""3"", ""time"": 263559, ""tag"": ""prac_segB_desc""}","description"
"766","1185",1712073615082,"8","1","practice","1","2",12,33,"one of the cows says the object is a log and the other thinks its a crocodile. the cow who thinks its a croc throws a stone at the object, pokes it with a stick and then kicks water over it. it think jumps on top of the object.",6,6,"prac_segB_desc","/static/video/Prac/wildebeest_part2.mp4","{""phase"": ""description"", ""counterbalance"": 1, ""vidpath"": ""/static/video/Prac/wildebeest_part2.mp4"", ""descstop"": 1, ""vidpair"": 2, ""offset"": ""33"", ""content"": ""one of the cows says the object is a log and the other thinks its a crocodile. the cow who thinks its a croc throws a stone at the object, pokes it with a stick and then kicks water over it. it think jumps on top of the object."", ""importance"": ""6"", ""time"": 85116, ""tag"": ""prac_segB_desc""}","description"
"771","1186",1712152707260,"8","7","practice","1","2",12,33,"The animal that thinks the object floating in the water is an alligator throws a rock at the object, then pokes it with a stick, then splashes it with water, before finally jumping onto the floating object.",7,7,"prac_segB_desc","/static/video/Prac/wildebeest_part2.mp4","{""phase"": ""description"", ""counterbalance"": 7, ""vidpath"": ""/static/video/Prac/wildebeest_part2.mp4"", ""descstop"": 1, ""vidpair"": 2, ""offset"": ""33"", ""content"": ""The animal that thinks the object floating in the water is an alligator throws a rock at the object, then pokes it with a stick, then splashes it with water, before finally jumping onto the floating object."", ""importance"": ""7"", ""time"": 84291, ""tag"": ""prac_segB_desc""}","description"
"776","1187",1712672287887,"8","1","practice","1","2",12,33,"The two animals continue their disagreement about whether the item in the water is a log or a crocodile, and so one of the animals hops onto the item after poking it with a stick.",3,3,"prac_segB_desc","/static/video/Prac/wildebeest_part2.mp4","{""phase"": ""description"", ""counterbalance"": 1, ""vidpath"": ""/static/video/Prac/wildebeest_part2.mp4"", ""descstop"": 1, ""vidpair"": 2, ""offset"": ""33"", ""content"": ""The two animals continue their disagreement about whether the item in the water is a log or a crocodile, and so one of the animals hops onto the item after poking it with a stick."", ""importance"": ""3"", ""time"": 45333, ""tag"": ""prac_segB_desc""}","description"
"781","1188",1712153662052,"8","2","practice","1","2",12,33,"The two bison still couldn't agree whether the object in the water was a crocodile or a log. The bison further away thought it was a crocodile whereas the bison nearest to us thought it was a log. The bison furthest away picked up a stick and prodded the object with it; the object did not move. It problem is still not resolved.",5,5,"prac_segB_desc","/static/video/Prac/wildebeest_part2.mp4","{""phase"": ""description"", ""counterbalance"": 2, ""vidpath"": ""/static/video/Prac/wildebeest_part2.mp4"", ""descstop"": 1, ""vidpair"": 2, ""offset"": ""33"", ""content"": ""The two bison still couldn't agree whether the object in the water was a crocodile or a log. The bison further away thought it was a crocodile whereas the bison nearest to us thought it was a log. The bison furthest away picked up a stick and prodded the object with it; the object did not move. It problem is still not resolved."", ""importance"": ""5"", ""time"": 199695, ""tag"": ""prac_segB_desc""}","description"
