"","ID","Timestamp","Trial","counterbalance","phase","description_stop","paired_vid","onset","offset","description_content","importance","time","tag","vidpath","Datastring","test_trial"
"1","1001",1701964208724,"8","8","practice","1","2",12,33,"The two water buffalo are trying to determine what the object in the water is. One insists its a crocodile while the other one, who appears to be less intelligent, thinks its a log. The one who thinks its a crocodile tries different things to prove which one is right, like poking it with a stick before finally climbing on top of the floating object.",5,5,"prac_segB_desc","/static/video/Prac/wildebeest_part2.mp4","{""phase"": ""description"", ""counterbalance"": 8, ""vidpath"": ""/static/video/Prac/wildebeest_part2.mp4"", ""descstop"": 1, ""vidpair"": 2, ""offset"": ""33"", ""content"": ""The two water buffalo are trying to determine what the object in the water is. One insists its a crocodile while the other one, who appears to be less intelligent, thinks its a log. The one who thinks its a crocodile tries different things to prove which one is right, like poking it with a stick before finally climbing on top of the floating object."", ""importance"": ""5"", ""time"": 104720, ""tag"": ""prac_segB_desc""}","description"
"5","1002",1701961485774,"8","3","practice","1","2",12,33,"There are two animals at the side of a lake or river. Not sure what the animals are, but they have horns and look a bit like fat zebra's but with horns.\nIn the lake there is something floating near the edge. The two animals each think it's something different, one thinks it's a log, whilst the other thinks it's a crocodile. The one that thinks it's a croc throws a stone, splashes it with water and eventually jumps onto it.",5,5,"prac_segB_desc","/static/video/Prac/wildebeest_part2.mp4","{""phase"": ""description"", ""counterbalance"": 3, ""vidpath"": ""/static/video/Prac/wildebeest_part2.mp4"", ""descstop"": 1, ""vidpair"": 2, ""offset"": ""33"", ""content"": ""There are two animals at the side of a lake or river. Not sure what the animals are, but they have horns and look a bit like fat zebra's but with horns.\nIn the lake there is something floating near the edge. The two animals each think it's something different, one thinks it's a log, whilst the other thinks it's a crocodile. The one that thinks it's a croc throws a stone, splashes it with water and eventually jumps onto it."", ""importance"": ""5"", ""time"": 133413, ""tag"": ""prac_segB_desc""}","description"
"10","1003",1701964523661,"12","8","practice","1","2",12,33,"There's a cartoon of some wildebeests or a kind of safari cow like animals. they're near a lake or river shore and they see something in the water. one of the mammals thinks the object in the water is a crocodile, another mammal just keeps saying it seems like a log. the skeptical mammal eventually hops on the thing in the water and it appears to be a log after all.",5,5,"prac_segB_desc","/static/video/Prac/wildebeest_part2.mp4","{""phase"": ""description"", ""counterbalance"": 8, ""vidpath"": ""/static/video/Prac/wildebeest_part2.mp4"", ""descstop"": 1, ""vidpair"": 2, ""offset"": ""33"", ""content"": ""There's a cartoon of some wildebeests or a kind of safari cow like animals. they're near a lake or river shore and they see something in the water. one of the mammals thinks the object in the water is a crocodile, another mammal just keeps saying it seems like a log. the skeptical mammal eventually hops on the thing in the water and it appears to be a log after all."", ""importance"": ""5"", ""time"": 165008, ""tag"": ""prac_segB_desc""}","description"
"14","1004",1698251403340,"8","4","practice","1","2",12,33,"The two animals are in disagreement about what is floating in the river. One thinks it is a safe log whilst the other thinks it's a dangerous aligator. To prove its point it throws a stone and then jumps on it to prove it's not a log.",5,5,"prac_segB_desc","/static/video/Prac/wildebeest_part2.mp4","{""phase"": ""description"", ""counterbalance"": 4, ""vidpath"": ""/static/video/Prac/wildebeest_part2.mp4"", ""descstop"": 1, ""vidpair"": 2, ""offset"": ""33"", ""content"": ""The two animals are in disagreement about what is floating in the river. One thinks it is a safe log whilst the other thinks it's a dangerous aligator. To prove its point it throws a stone and then jumps on it to prove it's not a log."", ""importance"": ""5"", ""time"": 52960, ""tag"": ""prac_segB_desc""}","description"
"19","1005",1712071473220,"8","5","practice","1","2",12,33,"As you know the two bulls had different perception of what the image in the river was, the one that thought it is a crocodile tried to prove it to his friend by throwing a stone first, then tried making waves in the river, after which the object did not move, he then jumped on the object to prove his point to his friend who strongly believed it is a log of wood.",5,5,"prac_segB_desc","/static/video/Prac/wildebeest_part2.mp4","{""phase"": ""description"", ""counterbalance"": 5, ""vidpath"": ""/static/video/Prac/wildebeest_part2.mp4"", ""descstop"": 1, ""vidpair"": 2, ""offset"": ""33"", ""content"": ""As you know the two bulls had different perception of what the image in the river was, the one that thought it is a crocodile tried to prove it to his friend by throwing a stone first, then tried making waves in the river, after which the object did not move, he then jumped on the object to prove his point to his friend who strongly believed it is a log of wood."", ""importance"": ""5"", ""time"": 211494, ""tag"": ""prac_segB_desc""}","description"
"24","1006",1711991892883,"8","3","practice","1","2",12,33,"There were two animals standing near a lake. There was something floating in the water in front of them, and they both were wondering if it was a crocodile or a log. The one on the left then started throwing a stone at the thing floating in the lake, and he eventually climbed on top of the crocodile/log thing. They hadn't figured out yet what it could be. ",6,6,"prac_segB_desc","/static/video/Prac/wildebeest_part2.mp4","{""phase"": ""description"", ""counterbalance"": 3, ""vidpath"": ""/static/video/Prac/wildebeest_part2.mp4"", ""descstop"": 1, ""vidpair"": 2, ""offset"": ""33"", ""content"": ""There were two animals standing near a lake. There was something floating in the water in front of them, and they both were wondering if it was a crocodile or a log. The one on the left then started throwing a stone at the thing floating in the lake, and he eventually climbed on top of the crocodile/log thing. They hadn't figured out yet what it could be. "", ""importance"": ""6"", ""time"": 205189, ""tag"": ""prac_segB_desc""}","description"
"29","1007",1712587098658,"8","1","practice","1","2",12,33,"The two characters are arguing whether the object in the water is a crocodile or or log of wood. The character that thinks it is a crocodile was convinced it was a log of wood by the second character and climbed on it to confirm.",7,7,"prac_segB_desc","/static/video/Prac/wildebeest_part2.mp4","{""phase"": ""description"", ""counterbalance"": 1, ""vidpath"": ""/static/video/Prac/wildebeest_part2.mp4"", ""descstop"": 1, ""vidpair"": 2, ""offset"": ""33"", ""content"": ""The two characters are arguing whether the object in the water is a crocodile or or log of wood. The character that thinks it is a crocodile was convinced it was a log of wood by the second character and climbed on it to confirm."", ""importance"": ""7"", ""time"": 97754, ""tag"": ""prac_segB_desc""}","description"
"34","1008",1698331720727,"8","6","practice","1","2",12,33,"The two wildebeest are debating whether the object in the water is a log or a crocodile. The one on the left throws a rock at the object, which remains unmoved. The two continue to disagree. The one on the left then pokes it with a stick, they argue again. The one on the left then jumps on the object, which remains unmoved. ",5,5,"prac_segB_desc","/static/video/Prac/wildebeest_part2.mp4","{""phase"": ""description"", ""counterbalance"": 6, ""vidpath"": ""/static/video/Prac/wildebeest_part2.mp4"", ""descstop"": 1, ""vidpair"": 2, ""offset"": ""33"", ""content"": ""The two wildebeest are debating whether the object in the water is a log or a crocodile. The one on the left throws a rock at the object, which remains unmoved. The two continue to disagree. The one on the left then pokes it with a stick, they argue again. The one on the left then jumps on the object, which remains unmoved. "", ""importance"": ""5"", ""time"": 128908, ""tag"": ""prac_segB_desc""}","description"
"39","1009",1701964142059,"8","6","practice","1","2",12,33,"Two water buffalo's were at the water bed drinking water. they notice a suspicious looking log in the water. they were discussing whether it was a wooden log or a crocodile. they chuck a rock at it and nothing happens and then one of them jumps on it and nothing still happens. ",5,5,"prac_segB_desc","/static/video/Prac/wildebeest_part2.mp4","{""phase"": ""description"", ""counterbalance"": 6, ""vidpath"": ""/static/video/Prac/wildebeest_part2.mp4"", ""descstop"": 1, ""vidpair"": 2, ""offset"": ""33"", ""content"": ""Two water buffalo's were at the water bed drinking water. they notice a suspicious looking log in the water. they were discussing whether it was a wooden log or a crocodile. they chuck a rock at it and nothing happens and then one of them jumps on it and nothing still happens. "", ""importance"": ""5"", ""time"": 69676, ""tag"": ""prac_segB_desc""}","description"
"44","1011",1698331684772,"8","8","practice","1","2",12,33,"The two bulls are wondering whether something in the water is a crocodile or a log. One of the bulls think it is a crocodile, whilst the other thinks it is a log. The crocodile who thinks it is a log throws a stone at the object, and makes a splash. It then prods the object with a stick. Finally, it steps from the land onto the object.",6,6,"prac_segB_desc","/static/video/Prac/wildebeest_part2.mp4","{""phase"": ""description"", ""counterbalance"": 8, ""vidpath"": ""/static/video/Prac/wildebeest_part2.mp4"", ""descstop"": 1, ""vidpair"": 2, ""offset"": ""33"", ""content"": ""The two bulls are wondering whether something in the water is a crocodile or a log. One of the bulls think it is a crocodile, whilst the other thinks it is a log. The crocodile who thinks it is a log throws a stone at the object, and makes a splash. It then prods the object with a stick. Finally, it steps from the land onto the object."", ""importance"": ""6"", ""time"": 141505, ""tag"": ""prac_segB_desc""}","description"
"48","1013",1712153293011,"8","8","practice","1","2",12,33,"Two bison are at the waters edge. One thinks that the thing in the water floating is an alligator. The other thinks it is a log. They poke, splash water and even climb on the thing to see if it is alive or not.",6,6,"prac_segB_desc","/static/video/Prac/wildebeest_part2.mp4","{""phase"": ""description"", ""counterbalance"": 8, ""vidpath"": ""/static/video/Prac/wildebeest_part2.mp4"", ""descstop"": 1, ""vidpair"": 2, ""offset"": ""33"", ""content"": ""Two bison are at the waters edge. One thinks that the thing in the water floating is an alligator. The other thinks it is a log. They poke, splash water and even climb on the thing to see if it is alive or not."", ""importance"": ""6"", ""time"": 88385, ""tag"": ""prac_segB_desc""}","description"
"52","1014",1712152812470,"8","4","practice","1","2",12,33,"There are two wildebeest and through communication of grunts and snorts are saying what they think an object in the water is through the use of speech bubbles. The one says that it is a crocodile and the other says it is a log. The one who says that it is a crocodile pokes it with a stick, splashes water at it and stands and jumps on it.",5,5,"prac_segB_desc","/static/video/Prac/wildebeest_part2.mp4","{""phase"": ""description"", ""counterbalance"": 4, ""vidpath"": ""/static/video/Prac/wildebeest_part2.mp4"", ""descstop"": 1, ""vidpair"": 2, ""offset"": ""33"", ""content"": ""There are two wildebeest and through communication of grunts and snorts are saying what they think an object in the water is through the use of speech bubbles. The one says that it is a crocodile and the other says it is a log. The one who says that it is a crocodile pokes it with a stick, splashes water at it and stands and jumps on it."", ""importance"": ""5"", ""time"": 136101, ""tag"": ""prac_segB_desc""}","description"
"57","1015",1703346093679,"8","7","practice","1","2",12,33,"Two bison, by amwatering hole trying to decide if a floating item is indeed a log, or a crodile, one bison, throws a stone says it is a log, then jumps on it, thinking it is a log, the other bison, still insists... Crocodile, quite humerous ..",6,6,"prac_segB_desc","/static/video/Prac/wildebeest_part2.mp4","{""phase"": ""description"", ""counterbalance"": 7, ""vidpath"": ""/static/video/Prac/wildebeest_part2.mp4"", ""descstop"": 1, ""vidpair"": 2, ""offset"": ""33"", ""content"": ""Two bison, by amwatering hole trying to decide if a floating item is indeed a log, or a crodile, one bison, throws a stone says it is a log, then jumps on it, thinking it is a log, the other bison, still insists... Crocodile, quite humerous .."", ""importance"": ""6"", ""time"": 142090, ""tag"": ""prac_segB_desc""}","description"
"62","1016",1702749060267,"8","2","practice","1","2",12,33,"The bulls continue to disagree about whether the object is a crocodile or a log. The bull who thinks it is a crocodile begins to throw rocks at it, poke it with a stick, and then eventually stands on it in an attempt to see what it is.",5,5,"prac_segB_desc","/static/video/Prac/wildebeest_part2.mp4","{""phase"": ""description"", ""counterbalance"": 2, ""vidpath"": ""/static/video/Prac/wildebeest_part2.mp4"", ""descstop"": 1, ""vidpair"": 2, ""offset"": ""33"", ""content"": ""The bulls continue to disagree about whether the object is a crocodile or a log. The bull who thinks it is a crocodile begins to throw rocks at it, poke it with a stick, and then eventually stands on it in an attempt to see what it is."", ""importance"": ""5"", ""time"": 58036, ""tag"": ""prac_segB_desc""}","description"
"67","1017",1702749149941,"8","1","practice","1","2",12,33,"The two buffalo were arguing over what was in the water. One thinks it is a log and the other thinks it is a crocodile. One buffalo the object a rock and then poked it with a stick. That buffalo then jumped onto the objects back to find out what it actually is.",6,6,"prac_segB_desc","/static/video/Prac/wildebeest_part2.mp4","{""phase"": ""description"", ""counterbalance"": 1, ""vidpath"": ""/static/video/Prac/wildebeest_part2.mp4"", ""descstop"": 1, ""vidpair"": 2, ""offset"": ""33"", ""content"": ""The two buffalo were arguing over what was in the water. One thinks it is a log and the other thinks it is a crocodile. One buffalo the object a rock and then poked it with a stick. That buffalo then jumped onto the objects back to find out what it actually is."", ""importance"": ""6"", ""time"": 105441, ""tag"": ""prac_segB_desc""}","description"
"72","1018",1703965138546,"8","1","practice","1","2",12,33,"The two buffalo standing on the edge of the water source debated the true nature of the object that sat floating before them, just along the shoreline. One Buffalo posited their belief was that the true nature of the object was the topside of a crocodile, while the second buffalo refuted that assertion and responded with his own belief that the object was the topside of a piece of driftwood. The buffalo of the crocodile belief attempted to further investigate the item by poking it with a stick, but failed to obtain any kind of response to prove his claim. His next attempt is to jump on the item. ",6,6,"prac_segB_desc","/static/video/Prac/wildebeest_part2.mp4","{""phase"": ""description"", ""counterbalance"": 1, ""vidpath"": ""/static/video/Prac/wildebeest_part2.mp4"", ""descstop"": 1, ""vidpair"": 2, ""offset"": ""33"", ""content"": ""The two buffalo standing on the edge of the water source debated the true nature of the object that sat floating before them, just along the shoreline. One Buffalo posited their belief was that the true nature of the object was the topside of a crocodile, while the second buffalo refuted that assertion and responded with his own belief that the object was the topside of a piece of driftwood. The buffalo of the crocodile belief attempted to further investigate the item by poking it with a stick, but failed to obtain any kind of response to prove his claim. His next attempt is to jump on the item. "", ""importance"": ""6"", ""time"": 286183, ""tag"": ""prac_segB_desc""}","description"
"77","1019",1701961434875,"8","0","practice","1","2",12,33,"Two buffalo are river side and are arguing about if the thing they see in the water is a crocodile or a log. One of them throws a stone at it but gets no response. He then puts him 2 front legs on it and keeps his rear legs on the ground.",6,6,"prac_segB_desc","/static/video/Prac/wildebeest_part2.mp4","{""phase"": ""description"", ""counterbalance"": 0, ""vidpath"": ""/static/video/Prac/wildebeest_part2.mp4"", ""descstop"": 1, ""vidpair"": 2, ""offset"": ""33"", ""content"": ""Two buffalo are river side and are arguing about if the thing they see in the water is a crocodile or a log. One of them throws a stone at it but gets no response. He then puts him 2 front legs on it and keeps his rear legs on the ground."", ""importance"": ""6"", ""time"": 94709, ""tag"": ""prac_segB_desc""}","description"
"82","1020",1698331755480,"8","0","practice","1","2",12,33,"Two sheep are standing just on the shore looking at something long poking out of the water. One of the sheep thinks it is a log, one thinks it is a crocodile and you see their thought bubbles. Then one of the sheep prods the object in the water with a stick and then he jumps on it, and also throws water on it. It doesn't move much and doesn't seem alive.",6,6,"prac_segB_desc","/static/video/Prac/wildebeest_part2.mp4","{""phase"": ""description"", ""counterbalance"": 0, ""vidpath"": ""/static/video/Prac/wildebeest_part2.mp4"", ""descstop"": 1, ""vidpair"": 2, ""offset"": ""33"", ""content"": ""Two sheep are standing just on the shore looking at something long poking out of the water. One of the sheep thinks it is a log, one thinks it is a crocodile and you see their thought bubbles. Then one of the sheep prods the object in the water with a stick and then he jumps on it, and also throws water on it. It doesn't move much and doesn't seem alive."", ""importance"": ""6"", ""time"": 140420, ""tag"": ""prac_segB_desc""}","description"
"87","1021",1701961669356,"8","8","practice","1","2",12,33,"The animal that suspects that the object is a crocodile throws a stone at the object to provoke it to move and therefore prove that it is a croc. The other animal still insists that the object is a large tree branch. The first animal then pokes the object with a stick. It does not move. The second animal again insists that it is a tree branch. The first animal splashes water on the object. It does not move. The second animal insists again that it is a tree branch. The first animal steps on to the object ",6,6,"prac_segB_desc","/static/video/Prac/wildebeest_part2.mp4","{""phase"": ""description"", ""counterbalance"": 8, ""vidpath"": ""/static/video/Prac/wildebeest_part2.mp4"", ""descstop"": 1, ""vidpair"": 2, ""offset"": ""33"", ""content"": ""The animal that suspects that the object is a crocodile throws a stone at the object to provoke it to move and therefore prove that it is a croc. The other animal still insists that the object is a large tree branch. The first animal then pokes the object with a stick. It does not move. The second animal again insists that it is a tree branch. The first animal splashes water on the object. It does not move. The second animal insists again that it is a tree branch. The first animal steps on to the object "", ""importance"": ""6"", ""time"": 212215, ""tag"": ""prac_segB_desc""}","description"
"91","1022",1701964319696,"8","0","practice","1","2",12,33,"the buffallo that thought it was a crocodile threw a rock at it but nothing happened. The two buffallo disagreed so the one that thought it was a crocodile poked it with a stick, splashed it with water and then climbed on top of it. Through all that they continued to disagree",5,5,"prac_segB_desc","/static/video/Prac/wildebeest_part2.mp4","{""phase"": ""description"", ""counterbalance"": 0, ""vidpath"": ""/static/video/Prac/wildebeest_part2.mp4"", ""descstop"": 1, ""vidpair"": 2, ""offset"": ""33"", ""content"": ""the buffallo that thought it was a crocodile threw a rock at it but nothing happened. The two buffallo disagreed so the one that thought it was a crocodile poked it with a stick, splashed it with water and then climbed on top of it. Through all that they continued to disagree"", ""importance"": ""5"", ""time"": 125224, ""tag"": ""prac_segB_desc""}","description"
"96","1023",1702749124791,"8","0","practice","1","2",12,33,"The first animal thinks the thing in the water is a crocodile, whilst the second thinks it's a log. The first one throws a rock at it to see the reaction, then pokes it with a stick and splashes water on it. There is no reaction, the first animal still thinks it's a crocodile and the second a log. The first animal starts to step on to the thing in the water",5,5,"prac_segB_desc","/static/video/Prac/wildebeest_part2.mp4","{""phase"": ""description"", ""counterbalance"": 0, ""vidpath"": ""/static/video/Prac/wildebeest_part2.mp4"", ""descstop"": 1, ""vidpair"": 2, ""offset"": ""33"", ""content"": ""The first animal thinks the thing in the water is a crocodile, whilst the second thinks it's a log. The first one throws a rock at it to see the reaction, then pokes it with a stick and splashes water on it. There is no reaction, the first animal still thinks it's a crocodile and the second a log. The first animal starts to step on to the thing in the water"", ""importance"": ""5"", ""time"": 77142, ""tag"": ""prac_segB_desc""}","description"
"101","1024",1701966633478,"8","5","practice","1","2",12,33,"The animals continue their debate on whether the object is a log or a crocodile. One splashes water and then pokes it with a stick. There is no sign of movement. The animal then climbs onto the object.",5,5,"prac_segB_desc","/static/video/Prac/wildebeest_part2.mp4","{""phase"": ""description"", ""counterbalance"": 5, ""vidpath"": ""/static/video/Prac/wildebeest_part2.mp4"", ""descstop"": 1, ""vidpair"": 2, ""offset"": ""33"", ""content"": ""The animals continue their debate on whether the object is a log or a crocodile. One splashes water and then pokes it with a stick. There is no sign of movement. The animal then climbs onto the object."", ""importance"": ""5"", ""time"": 65513, ""tag"": ""prac_segB_desc""}","description"
"106","1026",1703951431688,"8","6","practice","1","2",12,33,"The two oxens continue arguing untill one of them steps onto it",5,5,"prac_segB_desc","/static/video/Prac/wildebeest_part2.mp4","{""phase"": ""description"", ""counterbalance"": 6, ""vidpath"": ""/static/video/Prac/wildebeest_part2.mp4"", ""descstop"": 1, ""vidpair"": 2, ""offset"": ""33"", ""content"": ""The two oxens continue arguing untill one of them steps onto it"", ""importance"": ""5"", ""time"": 54872, ""tag"": ""prac_segB_desc""}","description"
"111","1027",1698331721990,"8","7","practice","1","2",12,33,"the two animals at the side of the bank continue to disagree on whether the mysterious object is a log or an alligator. one of them decides to try and move it by throwing a rock, poking it with a stick and splashing water.",5,5,"prac_segB_desc","/static/video/Prac/wildebeest_part2.mp4","{""phase"": ""description"", ""counterbalance"": 7, ""vidpath"": ""/static/video/Prac/wildebeest_part2.mp4"", ""descstop"": 1, ""vidpair"": 2, ""offset"": ""33"", ""content"": ""the two animals at the side of the bank continue to disagree on whether the mysterious object is a log or an alligator. one of them decides to try and move it by throwing a rock, poking it with a stick and splashing water."", ""importance"": ""5"", ""time"": 73113, ""tag"": ""prac_segB_desc""}","description"
"116","1028",1701961498813,"8","8","practice","1","2",12,33,"There were two large animals and they were in somewhat of a disagreement if the thing in the river was an alligator or if it was just a harmless log. One of the animals decided to jump on the item to see if it was an alligator or to confirm if it was a log or not.",6,6,"prac_segB_desc","/static/video/Prac/wildebeest_part2.mp4","{""phase"": ""description"", ""counterbalance"": 8, ""vidpath"": ""/static/video/Prac/wildebeest_part2.mp4"", ""descstop"": 1, ""vidpair"": 2, ""offset"": ""33"", ""content"": ""There were two large animals and they were in somewhat of a disagreement if the thing in the river was an alligator or if it was just a harmless log. One of the animals decided to jump on the item to see if it was an alligator or to confirm if it was a log or not."", ""importance"": ""6"", ""time"": 59202, ""tag"": ""prac_segB_desc""}","description"
