"","ID","Timestamp","Trial","counterbalance","phase","description_stop","paired_vid","onset","offset","description_content","importance","time","tag","vidpath","Datastring","test_trial"
"1044","1250",1703614470567,"8","4","practice","1","2",12,33,"There were two bulls on the shore of a river and they were debating if the object in the water was an alligator or a log. One of them threw a stone at it to see if it would move and it didn't. So then he poked it with a stick and it still didn't move. So then he finally stood on top of it and it didn't move.",5,5,"prac_segB_desc","/static/video/Prac/wildebeest_part2.mp4","{""phase"": ""description"", ""counterbalance"": 4, ""vidpath"": ""/static/video/Prac/wildebeest_part2.mp4"", ""descstop"": 1, ""vidpair"": 2, ""offset"": ""33"", ""content"": ""There were two bulls on the shore of a river and they were debating if the object in the water was an alligator or a log. One of them threw a stone at it to see if it would move and it didn't. So then he poked it with a stick and it still didn't move. So then he finally stood on top of it and it didn't move."", ""importance"": ""5"", ""time"": 61213, ""tag"": ""prac_segB_desc""}","description"
"1049","1252",1703967662423,"12","1","practice","1","2",12,33,"The 2 Water Buffalo continue to argue about the object in the river, One buffalo throws a rock at it, pokes it with a stick and then splashes it. The same buffalo then steps onto the object.",7,7,"prac_segB_desc","/static/video/Prac/wildebeest_part2.mp4","{""phase"": ""description"", ""counterbalance"": 1, ""vidpath"": ""/static/video/Prac/wildebeest_part2.mp4"", ""descstop"": 1, ""vidpair"": 2, ""offset"": ""33"", ""content"": ""The 2 Water Buffalo continue to argue about the object in the river, One buffalo throws a rock at it, pokes it with a stick and then splashes it. The same buffalo then steps onto the object."", ""importance"": ""7"", ""time"": 60188, ""tag"": ""prac_segB_desc""}","description"
"1054","1253",1702750153803,"8","6","practice","1","2",12,33,"One of the two bulls were trying to get into the dam by leaning on a wood. So, in their minds, the bulls thought that what they saw at the edge of the dam was a wood, not realizing that was a crocodile. As a result, one of the bulls eventually stood on top of the crocodile.",6,6,"prac_segB_desc","/static/video/Prac/wildebeest_part2.mp4","{""phase"": ""description"", ""counterbalance"": 6, ""vidpath"": ""/static/video/Prac/wildebeest_part2.mp4"", ""descstop"": 1, ""vidpair"": 2, ""offset"": ""33"", ""content"": ""One of the two bulls were trying to get into the dam by leaning on a wood. So, in their minds, the bulls thought that what they saw at the edge of the dam was a wood, not realizing that was a crocodile. As a result, one of the bulls eventually stood on top of the crocodile."", ""importance"": ""6"", ""time"": 129196, ""tag"": ""prac_segB_desc""}","description"
"1059","1254",1712071240974,"8","6","practice","1","2",12,33,"The left one asserts that it is a crocodile by first throwing a stick at the brown loggy looking item emerging from the river. The cow on the right makes  a sound and shows thought bubble indicating log. The left hand cow then pokes with a stick with a thought bubble suggesting crocodile but the other cow still thinks log. The left hand cow then with a moo sounding like look gets onto the log shaped item emerging from the river.",7,7,"prac_segB_desc","/static/video/Prac/wildebeest_part2.mp4","{""phase"": ""description"", ""counterbalance"": 6, ""vidpath"": ""/static/video/Prac/wildebeest_part2.mp4"", ""descstop"": 1, ""vidpair"": 2, ""offset"": ""33"", ""content"": ""The left one asserts that it is a crocodile by first throwing a stick at the brown loggy looking item emerging from the river. The cow on the right makes  a sound and shows thought bubble indicating log. The left hand cow then pokes with a stick with a thought bubble suggesting crocodile but the other cow still thinks log. The left hand cow then with a moo sounding like look gets onto the log shaped item emerging from the river."", ""importance"": ""7"", ""time"": 124756, ""tag"": ""prac_segB_desc""}","description"
"1064","1255",1712070948445,"8","7","practice","1","2",12,33,"The ox that is trying to convince the other that it is a crocodile first throws a stone at the object, then pokes it with a stick, then splashes water on it in an attempt to prove to the others that it is a croc and not a log. The ox (that believes its a crocodile) then jumps on top of the object. ",4,4,"prac_segB_desc","/static/video/Prac/wildebeest_part2.mp4","{""phase"": ""description"", ""counterbalance"": 7, ""vidpath"": ""/static/video/Prac/wildebeest_part2.mp4"", ""descstop"": 1, ""vidpair"": 2, ""offset"": ""33"", ""content"": ""The ox that is trying to convince the other that it is a crocodile first throws a stone at the object, then pokes it with a stick, then splashes water on it in an attempt to prove to the others that it is a croc and not a log. The ox (that believes its a crocodile) then jumps on top of the object. "", ""importance"": ""4"", ""time"": 60079, ""tag"": ""prac_segB_desc""}","description"
"1069","1256",1712769900155,"8","6","practice","1","2",12,33,"Two oxen are trying to decide what the object in the water is. One says it is a gator and the other thinks it's a log. The one that thinks it is a gator, pokes it then jumps on it.",7,7,"prac_segB_desc","/static/video/Prac/wildebeest_part2.mp4","{""phase"": ""description"", ""counterbalance"": 6, ""vidpath"": ""/static/video/Prac/wildebeest_part2.mp4"", ""descstop"": 1, ""vidpair"": 2, ""offset"": ""33"", ""content"": ""Two oxen are trying to decide what the object in the water is. One says it is a gator and the other thinks it's a log. The one that thinks it is a gator, pokes it then jumps on it."", ""importance"": ""7"", ""time"": 69308, ""tag"": ""prac_segB_desc""}","description"
"1074","1258",1712584884554,"8","7","practice","1","2",12,33,"The two moose continued to disagree on the object in the water. The one who believed it to be a crocodile, first threw a rock at it. Upon the object remaining still, the the who believed it to be a log voiced this. The crocodile believer then prodded it with a stick. When the object remained still again, the log believer voiced this. The crocodile believer then splashed water on the object, and with a further rejection of his belief, leaped onto the object in an attempt to get to the truth.",5,5,"prac_segB_desc","/static/video/Prac/wildebeest_part2.mp4","{""phase"": ""description"", ""counterbalance"": 7, ""vidpath"": ""/static/video/Prac/wildebeest_part2.mp4"", ""descstop"": 1, ""vidpair"": 2, ""offset"": ""33"", ""content"": ""The two moose continued to disagree on the object in the water. The one who believed it to be a crocodile, first threw a rock at it. Upon the object remaining still, the the who believed it to be a log voiced this. The crocodile believer then prodded it with a stick. When the object remained still again, the log believer voiced this. The crocodile believer then splashed water on the object, and with a further rejection of his belief, leaped onto the object in an attempt to get to the truth."", ""importance"": ""5"", ""time"": 141414, ""tag"": ""prac_segB_desc""}","description"
"1079","1259",1714401281258,"8","3","practice","1","2",12,33,"The two bulls where talking about if it was a crocodile. Then one of the bulls started prodding the object with a stick to see if it was a crocodile. Then the other bull said it was a log. Finally the other bull through a pebble at the object and then jumped on it.",6,6,"prac_segB_desc","/static/video/Prac/wildebeest_part2.mp4","{""phase"": ""description"", ""counterbalance"": 3, ""vidpath"": ""/static/video/Prac/wildebeest_part2.mp4"", ""descstop"": 1, ""vidpair"": 2, ""offset"": ""33"", ""content"": ""The two bulls where talking about if it was a crocodile. Then one of the bulls started prodding the object with a stick to see if it was a crocodile. Then the other bull said it was a log. Finally the other bull through a pebble at the object and then jumped on it."", ""importance"": ""6"", ""time"": 136776, ""tag"": ""prac_segB_desc""}","description"
"1084","1260",1706020804208,"8","4","practice","1","2",12,33,"Two Wildebeest are arguing in grunts over whether or not a floating object in the river is a log or a crocodile. They keep prodding the object in question, trying to get it to move. When it doesn't, one Wildebeest leaps upon the back of this creature or log.",6,6,"prac_segB_desc","/static/video/Prac/wildebeest_part2.mp4","{""phase"": ""description"", ""counterbalance"": 4, ""vidpath"": ""/static/video/Prac/wildebeest_part2.mp4"", ""descstop"": 1, ""vidpair"": 2, ""offset"": ""33"", ""content"": ""Two Wildebeest are arguing in grunts over whether or not a floating object in the river is a log or a crocodile. They keep prodding the object in question, trying to get it to move. When it doesn't, one Wildebeest leaps upon the back of this creature or log."", ""importance"": ""6"", ""time"": 58756, ""tag"": ""prac_segB_desc""}","description"
"1089","1262",1698331724195,"8","3","practice","1","2",12,33,"There are two water buffalo on the edge of a river, they are debating whether an object in the river is a crocodile or a log. The first buffalo then throws a rock at the object, they still believe their respective opinions on whether it is a crocodile or a log. Then the first buffalo pokes the object with a stick. Then the animal splashes the object with some water and then finally the animal jumps onto the object. Then they both agree that the object is a log, not a crocodile. ",7,7,"prac_segB_desc","/static/video/Prac/wildebeest_part2.mp4","{""phase"": ""description"", ""counterbalance"": 3, ""vidpath"": ""/static/video/Prac/wildebeest_part2.mp4"", ""descstop"": 1, ""vidpair"": 2, ""offset"": ""33"", ""content"": ""There are two water buffalo on the edge of a river, they are debating whether an object in the river is a crocodile or a log. The first buffalo then throws a rock at the object, they still believe their respective opinions on whether it is a crocodile or a log. Then the first buffalo pokes the object with a stick. Then the animal splashes the object with some water and then finally the animal jumps onto the object. Then they both agree that the object is a log, not a crocodile. "", ""importance"": ""7"", ""time"": 89891, ""tag"": ""prac_segB_desc""}","description"
"1094","1264",1701961766735,"8","0","practice","1","2",12,33,"to moose were on a river bank looking at an object floating in the water, one moose thought it was a crocodial floating in the water, the other moose thought it was a log of wood. the 1st moose the poked the object with a twig and it didnt move, he then put 2 of his feet on to the object and it still did not move",2,2,"prac_segB_desc","/static/video/Prac/wildebeest_part2.mp4","{""phase"": ""description"", ""counterbalance"": 0, ""vidpath"": ""/static/video/Prac/wildebeest_part2.mp4"", ""descstop"": 1, ""vidpair"": 2, ""offset"": ""33"", ""content"": ""to moose were on a river bank looking at an object floating in the water, one moose thought it was a crocodial floating in the water, the other moose thought it was a log of wood. the 1st moose the poked the object with a twig and it didnt move, he then put 2 of his feet on to the object and it still did not move"", ""importance"": ""2"", ""time"": 169351, ""tag"": ""prac_segB_desc""}","description"
"1099","1265",1701964225382,"8","5","practice","1","2",12,33,"The two bisons are arguing if the thing in the water is a crocodile or a log. The one saying it's a crocodile throws a rock, pokes it with a stick and splashes water on it but nothing happens. He then jumps on on the thing.",5,5,"prac_segB_desc","/static/video/Prac/wildebeest_part2.mp4","{""phase"": ""description"", ""counterbalance"": 5, ""vidpath"": ""/static/video/Prac/wildebeest_part2.mp4"", ""descstop"": 1, ""vidpair"": 2, ""offset"": ""33"", ""content"": ""The two bisons are arguing if the thing in the water is a crocodile or a log. The one saying it's a crocodile throws a rock, pokes it with a stick and splashes water on it but nothing happens. He then jumps on on the thing."", ""importance"": ""5"", ""time"": 59947, ""tag"": ""prac_segB_desc""}","description"
"1104","1266",1714580871233,"8","4","practice","1","2",12,33,"Two water buffalo by a body of water were wondering what an object floating in the water in front of them was. One of them thought it was a crocodile and the other thought it was a log. One of the buffalo poked the floating object with a stick and when the object didn't move, the buffalo decided to step on top of the object.",3,3,"prac_segB_desc","/static/video/Prac/wildebeest_part2.mp4","{""phase"": ""description"", ""counterbalance"": 4, ""vidpath"": ""/static/video/Prac/wildebeest_part2.mp4"", ""descstop"": 1, ""vidpair"": 2, ""offset"": ""33"", ""content"": ""Two water buffalo by a body of water were wondering what an object floating in the water in front of them was. One of them thought it was a crocodile and the other thought it was a log. One of the buffalo poked the floating object with a stick and when the object didn't move, the buffalo decided to step on top of the object."", ""importance"": ""3"", ""time"": 98022, ""tag"": ""prac_segB_desc""}","description"
"1109","1267",1713361975150,"8","8","practice","1","2",12,33,"Two animated water hogs are standing at the edge of some water. They see what looks like a log sticking out of the water. One water hog says that is is a crocodile (by using a speech cloud with a picture of a crocodile on). The other says that it is a log. The one that thinks it is a crocodile throws a stone at the \log\, pokes it with a stick and then splashes water on it. Each time it says it is a crocodile and the other disagrees and says it is a log. The one who thinks it is a crocodile decides to jump onto the \log\.",5,5,"prac_segB_desc","/static/video/Prac/wildebeest_part2.mp4","{""phase"": ""description"", ""counterbalance"": 8, ""vidpath"": ""/static/video/Prac/wildebeest_part2.mp4"", ""descstop"": 1, ""vidpair"": 2, ""offset"": ""33"", ""content"": ""Two animated water hogs are standing at the edge of some water. They see what looks like a log sticking out of the water. One water hog says that is is a crocodile (by using a speech cloud with a picture of a crocodile on). The other says that it is a log. The one that thinks it is a crocodile throws a stone at the \""log\"", pokes it with a stick and then splashes water on it. Each time it says it is a crocodile and the other disagrees and says it is a log. The one who thinks it is a crocodile decides to jump onto the \""log\""."", ""importance"": ""5"", ""time"": 131787, ""tag"": ""prac_segB_desc""}","description"
"1113","1268",1714401258261,"8","3","practice","1","2",12,33,"The cows dispute what the object in the water is. One throws a rock at it and pokes it. He climbs onto it.",7,7,"prac_segB_desc","/static/video/Prac/wildebeest_part2.mp4","{""phase"": ""description"", ""counterbalance"": 3, ""vidpath"": ""/static/video/Prac/wildebeest_part2.mp4"", ""descstop"": 1, ""vidpair"": 2, ""offset"": ""33"", ""content"": ""The cows dispute what the object in the water is. One throws a rock at it and pokes it. He climbs onto it."", ""importance"": ""7"", ""time"": 52555, ""tag"": ""prac_segB_desc""}","description"
"1118","1269",1704214326379,"8","3","practice","1","2",12,33,"The two buffalo continued to argue over whether the thing in the water is an alligator or a log. The one claiming alligator threw a rock, poked it with a stick, splashed it, then climbed on it. They continued going back and forth about alligator or rock with each thing.",5,5,"prac_segB_desc","/static/video/Prac/wildebeest_part2.mp4","{""phase"": ""description"", ""counterbalance"": 3, ""vidpath"": ""/static/video/Prac/wildebeest_part2.mp4"", ""descstop"": 1, ""vidpair"": 2, ""offset"": ""33"", ""content"": ""The two buffalo continued to argue over whether the thing in the water is an alligator or a log. The one claiming alligator threw a rock, poked it with a stick, splashed it, then climbed on it. They continued going back and forth about alligator or rock with each thing."", ""importance"": ""5"", ""time"": 72176, ""tag"": ""prac_segB_desc""}","description"
"1123","1271",1698331798711,"8","8","practice","1","2",12,33,"2 wildebeast trying to find out if it was a log or a crocodile they was looking at ",5,5,"prac_segB_desc","/static/video/Prac/wildebeest_part2.mp4","{""phase"": ""description"", ""counterbalance"": 8, ""vidpath"": ""/static/video/Prac/wildebeest_part2.mp4"", ""descstop"": 1, ""vidpair"": 2, ""offset"": ""33"", ""content"": ""2 wildebeast trying to find out if it was a log or a crocodile they was looking at "", ""importance"": ""5"", ""time"": 37178, ""tag"": ""prac_segB_desc""}","description"
"1127","1272",1703168484973,"8","3","practice","1","2",12,33,"The ox on the left is trying to determine whether the item in the water is a croc or a log. First, he taps it with a twig, then he splashes a bit of water on it, and then he steps on it a bit. ",5,5,"prac_segB_desc","/static/video/Prac/wildebeest_part2.mp4","{""phase"": ""description"", ""counterbalance"": 3, ""vidpath"": ""/static/video/Prac/wildebeest_part2.mp4"", ""descstop"": 1, ""vidpair"": 2, ""offset"": ""33"", ""content"": ""The ox on the left is trying to determine whether the item in the water is a croc or a log. First, he taps it with a twig, then he splashes a bit of water on it, and then he steps on it a bit. "", ""importance"": ""5"", ""time"": 55629, ""tag"": ""prac_segB_desc""}","description"
"1132","1273",1714580917835,"8","4","practice","1","2",12,33,"Two yaks are on the banks of a river observing an object in the water. One yak thinks it's an alligator, but the other thinks it's a log. One yak throws a stone at it, but there is no response. That same yak then pokes it with a stick.",6,6,"prac_segB_desc","/static/video/Prac/wildebeest_part2.mp4","{""phase"": ""description"", ""counterbalance"": 4, ""vidpath"": ""/static/video/Prac/wildebeest_part2.mp4"", ""descstop"": 1, ""vidpair"": 2, ""offset"": ""33"", ""content"": ""Two yaks are on the banks of a river observing an object in the water. One yak thinks it's an alligator, but the other thinks it's a log. One yak throws a stone at it, but there is no response. That same yak then pokes it with a stick."", ""importance"": ""6"", ""time"": 139222, ""tag"": ""prac_segB_desc""}","description"
"1137","1274",1701964320227,"8","0","practice","1","2",12,33,"Two animals are staring at a shape in the water next to them, one of them thinks it is a log and the other thinks it is a crocodile. When one of the animals keeps saying it's a log, the other starts to poke it with a stick, but it doesn't move, the first animal then says it's a log again so the other animal starts pushing it and begins to climb on top of it.",6,6,"prac_segB_desc","/static/video/Prac/wildebeest_part2.mp4","{""phase"": ""description"", ""counterbalance"": 0, ""vidpath"": ""/static/video/Prac/wildebeest_part2.mp4"", ""descstop"": 1, ""vidpair"": 2, ""offset"": ""33"", ""content"": ""Two animals are staring at a shape in the water next to them, one of them thinks it is a log and the other thinks it is a crocodile. When one of the animals keeps saying it's a log, the other starts to poke it with a stick, but it doesn't move, the first animal then says it's a log again so the other animal starts pushing it and begins to climb on top of it."", ""importance"": ""6"", ""time"": 150510, ""tag"": ""prac_segB_desc""}","description"
"1142","1275",1712585169302,"8","2","practice","1","2",12,33,"Two bison were debating whether a mystery object in the river was a log or a crocodile. One bison pokes the object and proceeds to climb on top of it. ",4,4,"prac_segB_desc","/static/video/Prac/wildebeest_part2.mp4","{""phase"": ""description"", ""counterbalance"": 2, ""vidpath"": ""/static/video/Prac/wildebeest_part2.mp4"", ""descstop"": 1, ""vidpair"": 2, ""offset"": ""33"", ""content"": ""Two bison were debating whether a mystery object in the river was a log or a crocodile. One bison pokes the object and proceeds to climb on top of it. "", ""importance"": ""4"", ""time"": 148781, ""tag"": ""prac_segB_desc""}","description"
"1147","1276",1712585711157,"8","7","practice","1","2",12,33,"Two cows were standing by the river wanting to drink some water. They saw something in the river . The other cow was saying its a log and the other said its a crocodile. The one cow who thought it was a log the took a plunge and got into the river and stepped on the \item\.",7,7,"prac_segB_desc","/static/video/Prac/wildebeest_part2.mp4","{""phase"": ""description"", ""counterbalance"": 7, ""vidpath"": ""/static/video/Prac/wildebeest_part2.mp4"", ""descstop"": 1, ""vidpair"": 2, ""offset"": ""33"", ""content"": ""Two cows were standing by the river wanting to drink some water. They saw something in the river . The other cow was saying its a log and the other said its a crocodile. The one cow who thought it was a log the took a plunge and got into the river and stepped on the \""item\""."", ""importance"": ""7"", ""time"": 369397, ""tag"": ""prac_segB_desc""}","description"
"1152","1278",1712586221201,"8","6","practice","1","2",12,33,"The two bison stand by the water one points at the object in the water thinking crocodile the other shakes their head no saying log.  The bison again thinks crocodile and throws a stone which bounces off.  The friend again thinks log the bison this time gets a stick and pokes the object thinking crocodile his friend thinks no log so in frustration flicks water at the object before he jumps on top of the object looking at his friend.",7,7,"prac_segB_desc","/static/video/Prac/wildebeest_part2.mp4","{""phase"": ""description"", ""counterbalance"": 6, ""vidpath"": ""/static/video/Prac/wildebeest_part2.mp4"", ""descstop"": 1, ""vidpair"": 2, ""offset"": ""33"", ""content"": ""The two bison stand by the water one points at the object in the water thinking crocodile the other shakes their head no saying log.  The bison again thinks crocodile and throws a stone which bounces off.  The friend again thinks log the bison this time gets a stick and pokes the object thinking crocodile his friend thinks no log so in frustration flicks water at the object before he jumps on top of the object looking at his friend."", ""importance"": ""7"", ""time"": 230074, ""tag"": ""prac_segB_desc""}","description"
"1157","1279",1712757811734,"8","4","practice","1","2",12,33,"The two bulls are still disagreeing about whether the floating object is an alligator or a log. One of the bulls proceeds to throw a rock, a stick, splash the object with water, and climb on it's back to determine whether it is in fact an alligator or a log.",7,7,"prac_segB_desc","/static/video/Prac/wildebeest_part2.mp4","{""phase"": ""description"", ""counterbalance"": 4, ""vidpath"": ""/static/video/Prac/wildebeest_part2.mp4"", ""descstop"": 1, ""vidpair"": 2, ""offset"": ""33"", ""content"": ""The two bulls are still disagreeing about whether the floating object is an alligator or a log. One of the bulls proceeds to throw a rock, a stick, splash the object with water, and climb on it's back to determine whether it is in fact an alligator or a log."", ""importance"": ""7"", ""time"": 59792, ""tag"": ""prac_segB_desc""}","description"
"1162","1280",1713539866124,"8","7","practice","1","2",12,33,"Two bison are trying to determine if a shape in the water is a log or a crocodile. The bison that fears the shape is a crocodile completes several tests, such as throwing a pebble and poking the shape with a stick, before finally jumping on the shape to see what happens. ",5,5,"prac_segB_desc","/static/video/Prac/wildebeest_part2.mp4","{""phase"": ""description"", ""counterbalance"": 7, ""vidpath"": ""/static/video/Prac/wildebeest_part2.mp4"", ""descstop"": 1, ""vidpair"": 2, ""offset"": ""33"", ""content"": ""Two bison are trying to determine if a shape in the water is a log or a crocodile. The bison that fears the shape is a crocodile completes several tests, such as throwing a pebble and poking the shape with a stick, before finally jumping on the shape to see what happens. "", ""importance"": ""5"", ""time"": 70232, ""tag"": ""prac_segB_desc""}","description"
"1167","1282",1698331926065,"8","7","practice","1","2",12,33,"There two oxes. One of them was trying to convince the other the object in the water was a crocodile. Other ox thinks it's a log. First ox first throws a stone to the object. Other ox still believes it's a log. Then first ox touches the object with a stick, other ox still believes it's a log. Then first ox jumps on the object.",6,6,"prac_segB_desc","/static/video/Prac/wildebeest_part2.mp4","{""phase"": ""description"", ""counterbalance"": 7, ""vidpath"": ""/static/video/Prac/wildebeest_part2.mp4"", ""descstop"": 1, ""vidpair"": 2, ""offset"": ""33"", ""content"": ""There two oxes. One of them was trying to convince the other the object in the water was a crocodile. Other ox thinks it's a log. First ox first throws a stone to the object. Other ox still believes it's a log. Then first ox touches the object with a stick, other ox still believes it's a log. Then first ox jumps on the object."", ""importance"": ""6"", ""time"": 278955, ""tag"": ""prac_segB_desc""}","description"
