"","ID","Timestamp","Trial","counterbalance","phase","description_stop","paired_vid","onset","offset","description_content","importance","time","tag","vidpath","Datastring","test_trial"
"246","1060",1712074970460,"12","5","practice","1","2",12,33,"two ox with horns are standing on land looking into the water.  They are trying to work out what is in the water.  The thought bubbles suggest they think it might be a log or a crocodile.  They prod it with their feet",3,3,"prac_segB_desc","/static/video/Prac/wildebeest_part2.mp4","{""phase"": ""description"", ""counterbalance"": 5, ""vidpath"": ""/static/video/Prac/wildebeest_part2.mp4"", ""descstop"": 1, ""vidpair"": 2, ""offset"": ""33"", ""content"": ""two ox with horns are standing on land looking into the water.  They are trying to work out what is in the water.  The thought bubbles suggest they think it might be a log or a crocodile.  They prod it with their feet"", ""importance"": ""3"", ""time"": 49149, ""tag"": ""prac_segB_desc""}","description"
"251","1061",1712152978261,"8","1","practice","1","2",12,33,"The first cow thinks a shape in the water is a crocodile, whilst the second cow thinks it is just a log. The first cow throws a stone at the shape to prove it is a crocodile, but nothing happens. It then prods the shape with a stick, and still nothing happens. The second cow still thinks it is a log. The first cow then leaps onto the shape in the water,",6,6,"prac_segB_desc","/static/video/Prac/wildebeest_part2.mp4","{""phase"": ""description"", ""counterbalance"": 1, ""vidpath"": ""/static/video/Prac/wildebeest_part2.mp4"", ""descstop"": 1, ""vidpair"": 2, ""offset"": ""33"", ""content"": ""The first cow thinks a shape in the water is a crocodile, whilst the second cow thinks it is just a log. The first cow throws a stone at the shape to prove it is a crocodile, but nothing happens. It then prods the shape with a stick, and still nothing happens. The second cow still thinks it is a log. The first cow then leaps onto the shape in the water,"", ""importance"": ""6"", ""time"": 136006, ""tag"": ""prac_segB_desc""}","description"
"256","1063",1712584924172,"8","1","practice","1","2",12,33,"There is a group of bison as the edge of the lake. There are talking to one another where one of thinks that there is a crocodile in the lake and the other bison thinks that it is a log. Then one of them throws a rock at the object in the water then pokes a stick at it. Then thinking it is a log jumps onto it.",6,6,"prac_segB_desc","/static/video/Prac/wildebeest_part2.mp4","{""phase"": ""description"", ""counterbalance"": 1, ""vidpath"": ""/static/video/Prac/wildebeest_part2.mp4"", ""descstop"": 1, ""vidpair"": 2, ""offset"": ""33"", ""content"": ""There is a group of bison as the edge of the lake. There are talking to one another where one of thinks that there is a crocodile in the lake and the other bison thinks that it is a log. Then one of them throws a rock at the object in the water then pokes a stick at it. Then thinking it is a log jumps onto it."", ""importance"": ""6"", ""time"": 111827, ""tag"": ""prac_segB_desc""}","description"
"261","1064",1712587245888,"12","3","practice","1","2",12,33,"Two bull type creatures stood at the edge of some water. They are disagreeing on what the shape in the water is. One says log one says crocodile.\nThe one that says crocodile throws a rock at it then pokes it with a tick when it doesnt react. It still doesnt react so he steps on it.",5,5,"prac_segB_desc","/static/video/Prac/wildebeest_part2.mp4","{""phase"": ""description"", ""counterbalance"": 3, ""vidpath"": ""/static/video/Prac/wildebeest_part2.mp4"", ""descstop"": 1, ""vidpair"": 2, ""offset"": ""33"", ""content"": ""Two bull type creatures stood at the edge of some water. They are disagreeing on what the shape in the water is. One says log one says crocodile.\nThe one that says crocodile throws a rock at it then pokes it with a tick when it doesnt react. It still doesnt react so he steps on it."", ""importance"": ""5"", ""time"": 75847, ""tag"": ""prac_segB_desc""}","description"
"266","1065",1712757956776,"8","2","practice","1","2",12,33,"One of the buffalo asks the other if its a log and the other says its a crocodile. They keep arguing so the one who thinks its a crocodile throws a stick at the thing in the water and nothing happens. Then they argue some more and the one who threw the stick at it then splashes water at it and again nothing happens. So finally the buffalo goes and jumps upon it and its standing there waiting.",3,3,"prac_segB_desc","/static/video/Prac/wildebeest_part2.mp4","{""phase"": ""description"", ""counterbalance"": 2, ""vidpath"": ""/static/video/Prac/wildebeest_part2.mp4"", ""descstop"": 1, ""vidpair"": 2, ""offset"": ""33"", ""content"": ""One of the buffalo asks the other if its a log and the other says its a crocodile. They keep arguing so the one who thinks its a crocodile throws a stick at the thing in the water and nothing happens. Then they argue some more and the one who threw the stick at it then splashes water at it and again nothing happens. So finally the buffalo goes and jumps upon it and its standing there waiting."", ""importance"": ""3"", ""time"": 133136, ""tag"": ""prac_segB_desc""}","description"
"271","1066",1712673326219,"8","6","practice","1","2",12,33,"The two water bufallo continue to argue if the object is a log or a croc - The one stating it's a croc proceeds to then throw a stone at the object, nothing happens, he then pokes it with a stick and splashes water on it and still nothing.  He then eventually climbs ontop of the object",7,7,"prac_segB_desc","/static/video/Prac/wildebeest_part2.mp4","{""phase"": ""description"", ""counterbalance"": 6, ""vidpath"": ""/static/video/Prac/wildebeest_part2.mp4"", ""descstop"": 1, ""vidpair"": 2, ""offset"": ""33"", ""content"": ""The two water bufallo continue to argue if the object is a log or a croc - The one stating it's a croc proceeds to then throw a stone at the object, nothing happens, he then pokes it with a stick and splashes water on it and still nothing.  He then eventually climbs ontop of the object"", ""importance"": ""7"", ""time"": 88908, ""tag"": ""prac_segB_desc""}","description"
"276","1067",1712070222868,"8","3","practice","1","2",12,33,"Thw two buffalo are still debating whether the thing in the water is a log or a crocodile. The one pokes it with a stick and kicks water at it convinced its a croc while the other says no. Then he jumps onto the object",6,6,"prac_segB_desc","/static/video/Prac/wildebeest_part2.mp4","{""phase"": ""description"", ""counterbalance"": 3, ""vidpath"": ""/static/video/Prac/wildebeest_part2.mp4"", ""descstop"": 1, ""vidpair"": 2, ""offset"": ""33"", ""content"": ""Thw two buffalo are still debating whether the thing in the water is a log or a crocodile. The one pokes it with a stick and kicks water at it convinced its a croc while the other says no. Then he jumps onto the object"", ""importance"": ""6"", ""time"": 86058, ""tag"": ""prac_segB_desc""}","description"
"281","1068",1711991580276,"8","1","practice","1","2",12,33,"The two bulls are debating the item in the water.  One insists it is an alligator.  The other insists it is a log.  The first bull splashes water on the item. Nothing happens.  They each restate their opinions.  The first bull then pokes the item with a stick and again nothing happens.  They again reiterate their same opinions. ",4,4,"prac_segB_desc","/static/video/Prac/wildebeest_part2.mp4","{""phase"": ""description"", ""counterbalance"": 1, ""vidpath"": ""/static/video/Prac/wildebeest_part2.mp4"", ""descstop"": 1, ""vidpair"": 2, ""offset"": ""33"", ""content"": ""The two bulls are debating the item in the water.  One insists it is an alligator.  The other insists it is a log.  The first bull splashes water on the item. Nothing happens.  They each restate their opinions.  The first bull then pokes the item with a stick and again nothing happens.  They again reiterate their same opinions. "", ""importance"": ""4"", ""time"": 134670, ""tag"": ""prac_segB_desc""}","description"
"286","1070",1711992227341,"8","0","practice","1","2",12,33,"one of the two bulls thinks there is an alligator in the water and the other thinks is a wooden log. They tested to see if it moved by throwing rocks and poking it with a stick. I didn't move ",7,7,"prac_segB_desc","/static/video/Prac/wildebeest_part2.mp4","{""phase"": ""description"", ""counterbalance"": 0, ""vidpath"": ""/static/video/Prac/wildebeest_part2.mp4"", ""descstop"": 1, ""vidpair"": 2, ""offset"": ""33"", ""content"": ""one of the two bulls thinks there is an alligator in the water and the other thinks is a wooden log. They tested to see if it moved by throwing rocks and poking it with a stick. I didn't move "", ""importance"": ""7"", ""time"": 135609, ""tag"": ""prac_segB_desc""}","description"
"291","1071",1712070369064,"8","0","practice","1","2",12,33,"The bisons were unsure whether the object floating in the water was a crocodile or log. One bison throws a pebble at the object, then pokes it with a stick, then finally jumps on it.",6,6,"prac_segB_desc","/static/video/Prac/wildebeest_part2.mp4","{""phase"": ""description"", ""counterbalance"": 0, ""vidpath"": ""/static/video/Prac/wildebeest_part2.mp4"", ""descstop"": 1, ""vidpair"": 2, ""offset"": ""33"", ""content"": ""The bisons were unsure whether the object floating in the water was a crocodile or log. One bison throws a pebble at the object, then pokes it with a stick, then finally jumps on it."", ""importance"": ""6"", ""time"": 115535, ""tag"": ""prac_segB_desc""}","description"
"296","1072",1712673000428,"8","8","practice","1","2",12,33,"One of the Bulls tried to convince the other bull that what was in the water was a crocodile and not a wood. After much argument, one of the bulls had to get into the water and climb on the subject to confirm if what the other bull was assuming was true or not.",7,7,"prac_segB_desc","/static/video/Prac/wildebeest_part2.mp4","{""phase"": ""description"", ""counterbalance"": 8, ""vidpath"": ""/static/video/Prac/wildebeest_part2.mp4"", ""descstop"": 1, ""vidpair"": 2, ""offset"": ""33"", ""content"": ""One of the Bulls tried to convince the other bull that what was in the water was a crocodile and not a wood. After much argument, one of the bulls had to get into the water and climb on the subject to confirm if what the other bull was assuming was true or not."", ""importance"": ""7"", ""time"": 208845, ""tag"": ""prac_segB_desc""}","description"
"300","1073",1712757882690,"8","0","practice","1","2",12,33,"Two animals are standing next to water and in the water is something that looks like a crocodile or a log. One, cow like animal, thinks its a log and the other a croc, so one of them throws a stone at it and it doesn't move so he gets a twig and pokes it which still doesn't make it move and then he jumps on to the log/crocodile.",6,6,"prac_segB_desc","/static/video/Prac/wildebeest_part2.mp4","{""phase"": ""description"", ""counterbalance"": 0, ""vidpath"": ""/static/video/Prac/wildebeest_part2.mp4"", ""descstop"": 1, ""vidpair"": 2, ""offset"": ""33"", ""content"": ""Two animals are standing next to water and in the water is something that looks like a crocodile or a log. One, cow like animal, thinks its a log and the other a croc, so one of them throws a stone at it and it doesn't move so he gets a twig and pokes it which still doesn't make it move and then he jumps on to the log/crocodile."", ""importance"": ""6"", ""time"": 105462, ""tag"": ""prac_segB_desc""}","description"
"305","1074",1712769474229,"8","7","practice","1","2",12,33,"Two animals are beside a river and arguing about whether a lump they can see in the water is a log or a predator. ",6,6,"prac_segB_desc","/static/video/Prac/wildebeest_part2.mp4","{""phase"": ""description"", ""counterbalance"": 7, ""vidpath"": ""/static/video/Prac/wildebeest_part2.mp4"", ""descstop"": 1, ""vidpair"": 2, ""offset"": ""33"", ""content"": ""Two animals are beside a river and arguing about whether a lump they can see in the water is a log or a predator. "", ""importance"": ""6"", ""time"": 60692, ""tag"": ""prac_segB_desc""}","description"
"310","1075",1712757821741,"8","3","practice","1","2",12,33,"Two animals were looking at an object in the river from the side of the bank. One of the animals thought it was a crocodile and one of them thought it was a log. One of the animals poked the object and got no response, so it moved onto it.",7,7,"prac_segB_desc","/static/video/Prac/wildebeest_part2.mp4","{""phase"": ""description"", ""counterbalance"": 3, ""vidpath"": ""/static/video/Prac/wildebeest_part2.mp4"", ""descstop"": 1, ""vidpair"": 2, ""offset"": ""33"", ""content"": ""Two animals were looking at an object in the river from the side of the bank. One of the animals thought it was a crocodile and one of them thought it was a log. One of the animals poked the object and got no response, so it moved onto it."", ""importance"": ""7"", ""time"": 59805, ""tag"": ""prac_segB_desc""}","description"
"315","1076",1712070539699,"8","2","practice","1","2",12,33,"The two buffalos are still debating on whether what's floating in the river is a crocodile or a log. The one that think's it's a crocodile throws a stone at the floating object to see if it will move. the object does not move so the other buffalo says it's a log. The other one still thinks it's a crocodile and decides to poke it with a stick. he then jumps on top of the floating object. ",6,6,"prac_segB_desc","/static/video/Prac/wildebeest_part2.mp4","{""phase"": ""description"", ""counterbalance"": 2, ""vidpath"": ""/static/video/Prac/wildebeest_part2.mp4"", ""descstop"": 1, ""vidpair"": 2, ""offset"": ""33"", ""content"": ""The two buffalos are still debating on whether what's floating in the river is a crocodile or a log. The one that think's it's a crocodile throws a stone at the floating object to see if it will move. the object does not move so the other buffalo says it's a log. The other one still thinks it's a crocodile and decides to poke it with a stick. he then jumps on top of the floating object. "", ""importance"": ""6"", ""time"": 162260, ""tag"": ""prac_segB_desc""}","description"
"320","1077",1711991956647,"8","6","practice","1","2",12,33,"The two animals continue to argue whether the item in the water is a piece of wood/branch or an alligator. The animal on the left grabbed a stick and poked the item and it didn't move much, so then he jumped on the item which revealed it was not an alligator. ",7,7,"prac_segB_desc","/static/video/Prac/wildebeest_part2.mp4","{""phase"": ""description"", ""counterbalance"": 6, ""vidpath"": ""/static/video/Prac/wildebeest_part2.mp4"", ""descstop"": 1, ""vidpair"": 2, ""offset"": ""33"", ""content"": ""The two animals continue to argue whether the item in the water is a piece of wood/branch or an alligator. The animal on the left grabbed a stick and poked the item and it didn't move much, so then he jumped on the item which revealed it was not an alligator. "", ""importance"": ""7"", ""time"": 113148, ""tag"": ""prac_segB_desc""}","description"
"325","1078",1711991981937,"8","4","practice","1","2",12,33,"So those 2 water buffalo are still standing at the edge of the water. They are arguing about whether an object in the water is an alligator or a log. They go back and forth a couple of times until the buffalo arguing that it's an alligator tries to prove his side and picks up a rock and throw it at the object. The object doesn't move and the other buffalo reiterates that it's a log. The alligator buffalo still thinks it's an alligator and tries to prove his side further by picking up a stick and poking the object. The object doesn't move again and they argue back and forth. The alligator side buffalo goes one step further and steps on the object and splashes water at it, but again the object does not move. Neither buffalo has wavered in their opinion, however, and continue to argue regardless of the building evidence.",6,6,"prac_segB_desc","/static/video/Prac/wildebeest_part2.mp4","{""phase"": ""description"", ""counterbalance"": 4, ""vidpath"": ""/static/video/Prac/wildebeest_part2.mp4"", ""descstop"": 1, ""vidpair"": 2, ""offset"": ""33"", ""content"": ""So those 2 water buffalo are still standing at the edge of the water. They are arguing about whether an object in the water is an alligator or a log. They go back and forth a couple of times until the buffalo arguing that it's an alligator tries to prove his side and picks up a rock and throw it at the object. The object doesn't move and the other buffalo reiterates that it's a log. The alligator buffalo still thinks it's an alligator and tries to prove his side further by picking up a stick and poking the object. The object doesn't move again and they argue back and forth. The alligator side buffalo goes one step further and steps on the object and splashes water at it, but again the object does not move. Neither buffalo has wavered in their opinion, however, and continue to argue regardless of the building evidence."", ""importance"": ""6"", ""time"": 311645, ""tag"": ""prac_segB_desc""}","description"
"330","1079",1711992135243,"8","6","practice","1","2",12,33,"Two animals are debating if a particular object poking out of the water is a crocodile or a log. It appears that they're both conflicted in their opinions and thus one of the animals choses to poke it with a stick. Still nothing, the animal then chooses to jump on the mysterious object.",6,6,"prac_segB_desc","/static/video/Prac/wildebeest_part2.mp4","{""phase"": ""description"", ""counterbalance"": 6, ""vidpath"": ""/static/video/Prac/wildebeest_part2.mp4"", ""descstop"": 1, ""vidpair"": 2, ""offset"": ""33"", ""content"": ""Two animals are debating if a particular object poking out of the water is a crocodile or a log. It appears that they're both conflicted in their opinions and thus one of the animals choses to poke it with a stick. Still nothing, the animal then chooses to jump on the mysterious object."", ""importance"": ""6"", ""time"": 110808, ""tag"": ""prac_segB_desc""}","description"
"335","1081",1712073576027,"8","5","practice","1","2",12,33,"The two animals were trying to decide wether the object in the water was a log or a crocodile. One of them said crocodile and flicked water onto it, poked it with a stick and also jumped onto it but the other still said it was a log.",5,5,"prac_segB_desc","/static/video/Prac/wildebeest_part2.mp4","{""phase"": ""description"", ""counterbalance"": 5, ""vidpath"": ""/static/video/Prac/wildebeest_part2.mp4"", ""descstop"": 1, ""vidpair"": 2, ""offset"": ""33"", ""content"": ""The two animals were trying to decide wether the object in the water was a log or a crocodile. One of them said crocodile and flicked water onto it, poked it with a stick and also jumped onto it but the other still said it was a log."", ""importance"": ""5"", ""time"": 88196, ""tag"": ""prac_segB_desc""}","description"
"340","1082",1711991601400,"8","5","practice","1","2",12,33,"The ox tried to get a reaction from the alligator by throwing a rock at it. There was no reaction. Then the ox tried poking the alligator with a stick. There was still no reaction. The ox tried splashing water on the alligator, that didn't work either. Finally, the ox climbed on top of the alligator. ",5,5,"prac_segB_desc","/static/video/Prac/wildebeest_part2.mp4","{""phase"": ""description"", ""counterbalance"": 5, ""vidpath"": ""/static/video/Prac/wildebeest_part2.mp4"", ""descstop"": 1, ""vidpair"": 2, ""offset"": ""33"", ""content"": ""The ox tried to get a reaction from the alligator by throwing a rock at it. There was no reaction. Then the ox tried poking the alligator with a stick. There was still no reaction. The ox tried splashing water on the alligator, that didn't work either. Finally, the ox climbed on top of the alligator. "", ""importance"": ""5"", ""time"": 154805, ""tag"": ""prac_segB_desc""}","description"
"345","1083",1712073602986,"8","7","practice","1","2",12,33,"Two bison are at a pond trying to determine if the object in the water is a log or an alligator. One bison throws a rock at it, then pokes it with a stick trying to convince the other its a real alligator. the second bison still thinks its a log.",6,6,"prac_segB_desc","/static/video/Prac/wildebeest_part2.mp4","{""phase"": ""description"", ""counterbalance"": 7, ""vidpath"": ""/static/video/Prac/wildebeest_part2.mp4"", ""descstop"": 1, ""vidpair"": 2, ""offset"": ""33"", ""content"": ""Two bison are at a pond trying to determine if the object in the water is a log or an alligator. One bison throws a rock at it, then pokes it with a stick trying to convince the other its a real alligator. the second bison still thinks its a log."", ""importance"": ""6"", ""time"": 97790, ""tag"": ""prac_segB_desc""}","description"
"350","1084",1712584975040,"8","3","practice","1","2",12,33,"Two cows standing by the river bank, in the river there's is a brownish thing that could be a rock or crocodile, these two cows are in disagreement about whether this is a crocodile or wood, the other one is certain that it is a crocodile, it keeps throwing stones at the object, it went as far as standing on the object in the water just to prove a point that the object is a crocodile.",5,5,"prac_segB_desc","/static/video/Prac/wildebeest_part2.mp4","{""phase"": ""description"", ""counterbalance"": 3, ""vidpath"": ""/static/video/Prac/wildebeest_part2.mp4"", ""descstop"": 1, ""vidpair"": 2, ""offset"": ""33"", ""content"": ""Two cows standing by the river bank, in the river there's is a brownish thing that could be a rock or crocodile, these two cows are in disagreement about whether this is a crocodile or wood, the other one is certain that it is a crocodile, it keeps throwing stones at the object, it went as far as standing on the object in the water just to prove a point that the object is a crocodile."", ""importance"": ""5"", ""time"": 169077, ""tag"": ""prac_segB_desc""}","description"
"355","1085",1712152875592,"8","8","practice","1","2",12,33,"Two animals were looking at an object in a lake and they were both were trying to work out what the object was. One thought the object was a log, and the other thought it was a crocodile.",6,6,"prac_segB_desc","/static/video/Prac/wildebeest_part2.mp4","{""phase"": ""description"", ""counterbalance"": 8, ""vidpath"": ""/static/video/Prac/wildebeest_part2.mp4"", ""descstop"": 1, ""vidpair"": 2, ""offset"": ""33"", ""content"": ""Two animals were looking at an object in a lake and they were both were trying to work out what the object was. One thought the object was a log, and the other thought it was a crocodile."", ""importance"": ""6"", ""time"": 114518, ""tag"": ""prac_segB_desc""}","description"
"359","1086",1712585041176,"8","6","practice","1","2",12,33,"The animals were wondering what was infront of them in the water , the one said it was a log , the other said crocodile .Out of curiosity the one used a stick to tap it and then decided to step on it.",3,3,"prac_segB_desc","/static/video/Prac/wildebeest_part2.mp4","{""phase"": ""description"", ""counterbalance"": 6, ""vidpath"": ""/static/video/Prac/wildebeest_part2.mp4"", ""descstop"": 1, ""vidpair"": 2, ""offset"": ""33"", ""content"": ""The animals were wondering what was infront of them in the water , the one said it was a log , the other said crocodile .Out of curiosity the one used a stick to tap it and then decided to step on it."", ""importance"": ""3"", ""time"": 81249, ""tag"": ""prac_segB_desc""}","description"
"364","1087",1712757879675,"8","0","practice","1","2",12,33,"Two cows are standing at the edge of water. They're wondering to each other if the bumpy area they see sticking out of the water is a log or an alligator. One of them pokes it with a stick and tries to stand on it.",6,6,"prac_segB_desc","/static/video/Prac/wildebeest_part2.mp4","{""phase"": ""description"", ""counterbalance"": 0, ""vidpath"": ""/static/video/Prac/wildebeest_part2.mp4"", ""descstop"": 1, ""vidpair"": 2, ""offset"": ""33"", ""content"": ""Two cows are standing at the edge of water. They're wondering to each other if the bumpy area they see sticking out of the water is a log or an alligator. One of them pokes it with a stick and tries to stand on it."", ""importance"": ""6"", ""time"": 48266, ""tag"": ""prac_segB_desc""}","description"
"369","1088",1712757823920,"8","0","practice","1","2",12,33,"Two mooses saw something in the river and they were undecided if it was a log or crocodile so one of the poked it with a stick ",3,3,"prac_segB_desc","/static/video/Prac/wildebeest_part2.mp4","{""phase"": ""description"", ""counterbalance"": 0, ""vidpath"": ""/static/video/Prac/wildebeest_part2.mp4"", ""descstop"": 1, ""vidpair"": 2, ""offset"": ""33"", ""content"": ""Two mooses saw something in the river and they were undecided if it was a log or crocodile so one of the poked it with a stick "", ""importance"": ""3"", ""time"": 47275, ""tag"": ""prac_segB_desc""}","description"
"374","1089",1712769522855,"8","6","practice","1","2",12,33,"one of the cows was poking at the log to see if it was actually an alligator.",5,5,"prac_segB_desc","/static/video/Prac/wildebeest_part2.mp4","{""phase"": ""description"", ""counterbalance"": 6, ""vidpath"": ""/static/video/Prac/wildebeest_part2.mp4"", ""descstop"": 1, ""vidpair"": 2, ""offset"": ""33"", ""content"": ""one of the cows was poking at the log to see if it was actually an alligator."", ""importance"": ""5"", ""time"": 24167, ""tag"": ""prac_segB_desc""}","description"
