"","ID","Timestamp","Trial","counterbalance","phase","description_stop","paired_vid","onset","offset","description_content","importance","time","tag","vidpath","Datastring","test_trial"
"1","1000",1698251806015,"8","1","practice","1","2",12,33,"One bison thinks it could be a crocodile or a log.  The other thinks it's a log.  The first bison uses a stick to poke the log to see if it's a crocodile.  It isn't and it jumps on the log.",7,7,"prac_segB_desc","/static/video/Prac/wildebeest_part2.mp4","{""phase"": ""description"", ""counterbalance"": 1, ""vidpath"": ""/static/video/Prac/wildebeest_part2.mp4"", ""descstop"": 1, ""vidpair"": 2, ""offset"": ""33"", ""content"": ""One bison thinks it could be a crocodile or a log.  The other thinks it's a log.  The first bison uses a stick to poke the log to see if it's a crocodile.  It isn't and it jumps on the log."", ""importance"": ""7"", ""time"": 74013, ""tag"": ""prac_segB_desc""}","description"
"6","1001",1698252131591,"8","2","practice","1","2",12,33,"Remember the two cows? When you fell asleep, they were debating if, in the river, there was a crocodile or a log. They kept going back and forth for a while. Even the cow that says crocodile throws a stone to prove that it's a crocodile. But nothing happened. The object in the water stayed still. The cow eventually jumped on the object to prove his point to his friend.",7,7,"prac_segB_desc","/static/video/Prac/wildebeest_part2.mp4","{""phase"": ""description"", ""counterbalance"": 2, ""vidpath"": ""/static/video/Prac/wildebeest_part2.mp4"", ""descstop"": 1, ""vidpair"": 2, ""offset"": ""33"", ""content"": ""Remember the two cows? When you fell asleep, they were debating if, in the river, there was a crocodile or a log. They kept going back and forth for a while. Even the cow that says crocodile throws a stone to prove that it's a crocodile. But nothing happened. The object in the water stayed still. The cow eventually jumped on the object to prove his point to his friend."", ""importance"": ""7"", ""time"": 238407, ""tag"": ""prac_segB_desc""}","description"
"11","1004",1698331736949,"8","8","practice","1","2",12,33,"The two buffaloes(?) continued to debate whether they were looking at a log or a crocodile.  They threw things at it, poked it and eventually one jumped onto it - but it did not move at all. Strangely the buffalo that thought it was a croc was the one that jumped on it",2,2,"prac_segB_desc","/static/video/Prac/wildebeest_part2.mp4","{""phase"": ""description"", ""counterbalance"": 8, ""vidpath"": ""/static/video/Prac/wildebeest_part2.mp4"", ""descstop"": 1, ""vidpair"": 2, ""offset"": ""33"", ""content"": ""The two buffaloes(?) continued to debate whether they were looking at a log or a crocodile.  They threw things at it, poked it and eventually one jumped onto it - but it did not move at all. Strangely the buffalo that thought it was a croc was the one that jumped on it"", ""importance"": ""2"", ""time"": 92614, ""tag"": ""prac_segB_desc""}","description"
"15","1006",1698256238028,"8","4","practice","1","2",12,33,"One of the animals, who is convinced that the feature in the water is a crocodile and not a log, throws a stone (to get some reaction from it), then pokes with a stick, that splashes some water, then jumps on the object.",6,6,"prac_segB_desc","/static/video/Prac/wildebeest_part2.mp4","{""phase"": ""description"", ""counterbalance"": 4, ""vidpath"": ""/static/video/Prac/wildebeest_part2.mp4"", ""descstop"": 1, ""vidpair"": 2, ""offset"": ""33"", ""content"": ""One of the animals, who is convinced that the feature in the water is a crocodile and not a log, throws a stone (to get some reaction from it), then pokes with a stick, that splashes some water, then jumps on the object."", ""importance"": ""6"", ""time"": 124750, ""tag"": ""prac_segB_desc""}","description"
"20","1007",1698332003600,"8","0","practice","1","2",12,33,"The buffalo which thinks the object in the water is a crocodile throws a stone at the object. The object does not move. The other buffalo is still adamant that it is a log. So the buffalo which thinks its a crocodile and pokes it with a stick. The object does nothing. The other buffalo is still adamant its a log. The buffalo who thinks the object is a crocodile then jumps on to the object.",7,7,"prac_segB_desc","/static/video/Prac/wildebeest_part2.mp4","{""phase"": ""description"", ""counterbalance"": 0, ""vidpath"": ""/static/video/Prac/wildebeest_part2.mp4"", ""descstop"": 1, ""vidpair"": 2, ""offset"": ""33"", ""content"": ""The buffalo which thinks the object in the water is a crocodile throws a stone at the object. The object does not move. The other buffalo is still adamant that it is a log. So the buffalo which thinks its a crocodile and pokes it with a stick. The object does nothing. The other buffalo is still adamant its a log. The buffalo who thinks the object is a crocodile then jumps on to the object."", ""importance"": ""7"", ""time"": 134788, ""tag"": ""prac_segB_desc""}","description"
"25","1008",1701964174425,"8","5","practice","1","2",12,33,"The buffalo was trying to see if the thing in the water was a crocodile. It threw a rock at it, poked it with a stick, and then climbed on top of it. The thing had no reaction yet.",5,5,"prac_segB_desc","/static/video/Prac/wildebeest_part2.mp4","{""phase"": ""description"", ""counterbalance"": 5, ""vidpath"": ""/static/video/Prac/wildebeest_part2.mp4"", ""descstop"": 1, ""vidpair"": 2, ""offset"": ""33"", ""content"": ""The buffalo was trying to see if the thing in the water was a crocodile. It threw a rock at it, poked it with a stick, and then climbed on top of it. The thing had no reaction yet."", ""importance"": ""5"", ""time"": 51163, ""tag"": ""prac_segB_desc""}","description"
"30","1010",1702480199045,"8","5","practice","1","2",12,33,"the wilderbeest are arguing about whether what they see in the water is a log or a crocodile. the one insisting it is a crocodile decides to test it in various ways like throwing a rock at it, poke it with a stick or sitting on it. The other one keeps saying it's just a log",5,5,"prac_segB_desc","/static/video/Prac/wildebeest_part2.mp4","{""phase"": ""description"", ""counterbalance"": 5, ""vidpath"": ""/static/video/Prac/wildebeest_part2.mp4"", ""descstop"": 1, ""vidpair"": 2, ""offset"": ""33"", ""content"": ""the wilderbeest are arguing about whether what they see in the water is a log or a crocodile. the one insisting it is a crocodile decides to test it in various ways like throwing a rock at it, poke it with a stick or sitting on it. The other one keeps saying it's just a log"", ""importance"": ""5"", ""time"": 69286, ""tag"": ""prac_segB_desc""}","description"
"35","1011",1702480420513,"8","0","practice","1","2",12,33,"A buffalo throws stones at a partly submerged crocodile to check if it is safe to cross the river.  The buffalo also throws a stick at the crocodile.",7,7,"prac_segB_desc","/static/video/Prac/wildebeest_part2.mp4","{""phase"": ""description"", ""counterbalance"": 0, ""vidpath"": ""/static/video/Prac/wildebeest_part2.mp4"", ""descstop"": 1, ""vidpair"": 2, ""offset"": ""33"", ""content"": ""A buffalo throws stones at a partly submerged crocodile to check if it is safe to cross the river.  The buffalo also throws a stick at the crocodile."", ""importance"": ""7"", ""time"": 64147, ""tag"": ""prac_segB_desc""}","description"
"40","1016",1701965388590,"8","3","practice","1","2",12,33,"The bison were standing by the waters edge looking at something in the water. One bison says that he thinks it is a crocodile. The other says a log. They discuss for a minute, one insisting it is a crocodile and the other a log. One pokes the thing with a stick but it does not move. The other bison says again it is a log. Then the first bison jumps on the thing. It does not move.",4,4,"prac_segB_desc","/static/video/Prac/wildebeest_part2.mp4","{""phase"": ""description"", ""counterbalance"": 3, ""vidpath"": ""/static/video/Prac/wildebeest_part2.mp4"", ""descstop"": 1, ""vidpair"": 2, ""offset"": ""33"", ""content"": ""The bison were standing by the waters edge looking at something in the water. One bison says that he thinks it is a crocodile. The other says a log. They discuss for a minute, one insisting it is a crocodile and the other a log. One pokes the thing with a stick but it does not move. The other bison says again it is a log. Then the first bison jumps on the thing. It does not move."", ""importance"": ""4"", ""time"": 87967, ""tag"": ""prac_segB_desc""}","description"
"45","1017",1701961799787,"8","1","practice","1","2",12,33,"Two animals are drinking water from a lake. They see something in the water near them. One of them thinks its a log and the other thinks it's a croc. The one that thinks it's a croc throws a rock, pokes it with a stick and the jumps on it to be sure. The object never moves. ",5,5,"prac_segB_desc","/static/video/Prac/wildebeest_part2.mp4","{""phase"": ""description"", ""counterbalance"": 1, ""vidpath"": ""/static/video/Prac/wildebeest_part2.mp4"", ""descstop"": 1, ""vidpair"": 2, ""offset"": ""33"", ""content"": ""Two animals are drinking water from a lake. They see something in the water near them. One of them thinks its a log and the other thinks it's a croc. The one that thinks it's a croc throws a rock, pokes it with a stick and the jumps on it to be sure. The object never moves. "", ""importance"": ""5"", ""time"": 118563, ""tag"": ""prac_segB_desc""}","description"
"50","1018",1701961858651,"8","7","practice","1","2",12,33,"The 2 bison are at the edge of the river.  One of them thinks it's a log in the river, the other things it's an alligator.  The one bison that thinks it's an alligator throws a rock at the object and nothing happens.  They both still think it's their respective choices.  So the same bison slashes some water on it.  Again nothing happens and they both are unchanged in their opinions.  Then the same bison hops onto the object and now we're at that part.",6,6,"prac_segB_desc","/static/video/Prac/wildebeest_part2.mp4","{""phase"": ""description"", ""counterbalance"": 7, ""vidpath"": ""/static/video/Prac/wildebeest_part2.mp4"", ""descstop"": 1, ""vidpair"": 2, ""offset"": ""33"", ""content"": ""The 2 bison are at the edge of the river.  One of them thinks it's a log in the river, the other things it's an alligator.  The one bison that thinks it's an alligator throws a rock at the object and nothing happens.  They both still think it's their respective choices.  So the same bison slashes some water on it.  Again nothing happens and they both are unchanged in their opinions.  Then the same bison hops onto the object and now we're at that part."", ""importance"": ""6"", ""time"": 86607, ""tag"": ""prac_segB_desc""}","description"
"54","1021",1698331695276,"8","6","practice","1","2",12,33,"The two buffalo standing on the river bank use a stone and a stick to try and decide if what is in the water is a log or crocodile. One of the buffalo decided it was a log and took the jump to land on top of it.",5,5,"prac_segB_desc","/static/video/Prac/wildebeest_part2.mp4","{""phase"": ""description"", ""counterbalance"": 6, ""vidpath"": ""/static/video/Prac/wildebeest_part2.mp4"", ""descstop"": 1, ""vidpair"": 2, ""offset"": ""33"", ""content"": ""The two buffalo standing on the river bank use a stone and a stick to try and decide if what is in the water is a log or crocodile. One of the buffalo decided it was a log and took the jump to land on top of it."", ""importance"": ""5"", ""time"": 76560, ""tag"": ""prac_segB_desc""}","description"
"58","1022",1698252155999,"8","3","practice","1","2",12,33,"Two wildebeests are standing at the waters edge staring at something in the water. One of them is convinced it's a crocodile while the other thinks it's just a log. The one that believes it's a crocodile (Wildebeest 1) throws a rock with no response from the object. The other wildebeest (wildebeest 2) reiterates that its a log much to the others annoyance. Wildebeest 1 then pokes it with a stick and splashes water onto the object, leading to the same exchange as before. Wildebeest 1 then climbs onto the object to further prove it's point.",6,6,"prac_segB_desc","/static/video/Prac/wildebeest_part2.mp4","{""phase"": ""description"", ""counterbalance"": 3, ""vidpath"": ""/static/video/Prac/wildebeest_part2.mp4"", ""descstop"": 1, ""vidpair"": 2, ""offset"": ""33"", ""content"": ""Two wildebeests are standing at the waters edge staring at something in the water. One of them is convinced it's a crocodile while the other thinks it's just a log. The one that believes it's a crocodile (Wildebeest 1) throws a rock with no response from the object. The other wildebeest (wildebeest 2) reiterates that its a log much to the others annoyance. Wildebeest 1 then pokes it with a stick and splashes water onto the object, leading to the same exchange as before. Wildebeest 1 then climbs onto the object to further prove it's point."", ""importance"": ""6"", ""time"": 282414, ""tag"": ""prac_segB_desc""}","description"
"63","1023",1698251813346,"8","5","practice","1","2",12,33,"The two rams were standing at the edge of the water trying to decide if the object in the water was a crocodile or a log. One of them thinks it's a crocodile, the other thinks it's a log. One ram tosses a rock at it to try to figure it out. Then they still argue about what the object in the water is. The ram then pokes the object with a stick. Nothing happens, so the ram jumps onto the object in the water and it is okay.",5,5,"prac_segB_desc","/static/video/Prac/wildebeest_part2.mp4","{""phase"": ""description"", ""counterbalance"": 5, ""vidpath"": ""/static/video/Prac/wildebeest_part2.mp4"", ""descstop"": 1, ""vidpair"": 2, ""offset"": ""33"", ""content"": ""The two rams were standing at the edge of the water trying to decide if the object in the water was a crocodile or a log. One of them thinks it's a crocodile, the other thinks it's a log. One ram tosses a rock at it to try to figure it out. Then they still argue about what the object in the water is. The ram then pokes the object with a stick. Nothing happens, so the ram jumps onto the object in the water and it is okay."", ""importance"": ""5"", ""time"": 143328, ""tag"": ""prac_segB_desc""}","description"
"68","1026",1701969545729,"8","5","practice","1","2",12,33,"The two buffalos are still arguing over whether it is a log or a crocodile in the water. One then prods it with a stick and splashes water on it. The object still does not move so the buffalo jumps onto it.",5,5,"prac_segB_desc","/static/video/Prac/wildebeest_part2.mp4","{""phase"": ""description"", ""counterbalance"": 5, ""vidpath"": ""/static/video/Prac/wildebeest_part2.mp4"", ""descstop"": 1, ""vidpair"": 2, ""offset"": ""33"", ""content"": ""The two buffalos are still arguing over whether it is a log or a crocodile in the water. One then prods it with a stick and splashes water on it. The object still does not move so the buffalo jumps onto it."", ""importance"": ""5"", ""time"": 82728, ""tag"": ""prac_segB_desc""}","description"
"73","1030",1698331665999,"8","3","practice","1","2",12,33,"The cows continue to argue about whether the strange object is a crocodile or a log. The one that believes it is a crocodile throws a stone at it and nothing happens. The other one then suggests again that it's a log. He then splashes it with water before standing on it and still nothing happens. The other cow continues to suggest it's a log.",5,5,"prac_segB_desc","/static/video/Prac/wildebeest_part2.mp4","{""phase"": ""description"", ""counterbalance"": 3, ""vidpath"": ""/static/video/Prac/wildebeest_part2.mp4"", ""descstop"": 1, ""vidpair"": 2, ""offset"": ""33"", ""content"": ""The cows continue to argue about whether the strange object is a crocodile or a log. The one that believes it is a crocodile throws a stone at it and nothing happens. The other one then suggests again that it's a log. He then splashes it with water before standing on it and still nothing happens. The other cow continues to suggest it's a log."", ""importance"": ""5"", ""time"": 74706, ""tag"": ""prac_segB_desc""}","description"
"78","1031",1698331695378,"8","2","practice","1","2",12,33,"Two cows are standing by a lake, and see something sticking out of the water. The first cow thinks it's an alligator, but the second one thinks it's a log. They go back and forth, but the first one insists it's an alligator, so it throws a rock at it first, then pokes it with a stick, then splashes water on it, and then jumps on it. But the object in the water does not respond at all.",5,5,"prac_segB_desc","/static/video/Prac/wildebeest_part2.mp4","{""phase"": ""description"", ""counterbalance"": 2, ""vidpath"": ""/static/video/Prac/wildebeest_part2.mp4"", ""descstop"": 1, ""vidpair"": 2, ""offset"": ""33"", ""content"": ""Two cows are standing by a lake, and see something sticking out of the water. The first cow thinks it's an alligator, but the second one thinks it's a log. They go back and forth, but the first one insists it's an alligator, so it throws a rock at it first, then pokes it with a stick, then splashes water on it, and then jumps on it. But the object in the water does not respond at all."", ""importance"": ""5"", ""time"": 71028, ""tag"": ""prac_segB_desc""}","description"
"83","1033",1702480193270,"8","4","practice","1","2",12,33,"The wildebeest to the left tried to convince the other one that the item in the river is a crocodile. However, the other one does not believe him. To convince him further, he splashed water on the item and also jumps onto it.",6,6,"prac_segB_desc","/static/video/Prac/wildebeest_part2.mp4","{""phase"": ""description"", ""counterbalance"": 4, ""vidpath"": ""/static/video/Prac/wildebeest_part2.mp4"", ""descstop"": 1, ""vidpair"": 2, ""offset"": ""33"", ""content"": ""The wildebeest to the left tried to convince the other one that the item in the river is a crocodile. However, the other one does not believe him. To convince him further, he splashed water on the item and also jumps onto it."", ""importance"": ""6"", ""time"": 67749, ""tag"": ""prac_segB_desc""}","description"
"88","1034",1703775963539,"8","2","practice","1","2",12,33,"The buffalo can't decide if it's a log or a crocodile.  First of all a stone is thrown at the mystery object, then a log, but nothing happens.  Then water is splashed at it, and again nothing.  Then the first buffalo steps onto the object.",7,7,"prac_segB_desc","/static/video/Prac/wildebeest_part2.mp4","{""phase"": ""description"", ""counterbalance"": 2, ""vidpath"": ""/static/video/Prac/wildebeest_part2.mp4"", ""descstop"": 1, ""vidpair"": 2, ""offset"": ""33"", ""content"": ""The buffalo can't decide if it's a log or a crocodile.  First of all a stone is thrown at the mystery object, then a log, but nothing happens.  Then water is splashed at it, and again nothing.  Then the first buffalo steps onto the object."", ""importance"": ""7"", ""time"": 61095, ""tag"": ""prac_segB_desc""}","description"
"93","1035",1702480476451,"8","5","practice","1","2",12,33,"The cows are still arguing about what is in the water. One says its a log, the other thinks it's a crocodile. One tried throwing a stone, poking it with a stick, splashing it with water and jumping on it in order to further investigate. ",6,6,"prac_segB_desc","/static/video/Prac/wildebeest_part2.mp4","{""phase"": ""description"", ""counterbalance"": 5, ""vidpath"": ""/static/video/Prac/wildebeest_part2.mp4"", ""descstop"": 1, ""vidpair"": 2, ""offset"": ""33"", ""content"": ""The cows are still arguing about what is in the water. One says its a log, the other thinks it's a crocodile. One tried throwing a stone, poking it with a stick, splashing it with water and jumping on it in order to further investigate. "", ""importance"": ""6"", ""time"": 131302, ""tag"": ""prac_segB_desc""}","description"
"98","1036",1701961909927,"8","2","practice","1","2",12,33,"The two bulls argued about the object on the lake. The right bull says it's a log of wood, but the left bull insists it's a crocodile. To prove this, The right bull threw a stone at the object and poked it with a stick. With no response, the right bull climbed on top of the object. ",7,7,"prac_segB_desc","/static/video/Prac/wildebeest_part2.mp4","{""phase"": ""description"", ""counterbalance"": 2, ""vidpath"": ""/static/video/Prac/wildebeest_part2.mp4"", ""descstop"": 1, ""vidpair"": 2, ""offset"": ""33"", ""content"": ""The two bulls argued about the object on the lake. The right bull says it's a log of wood, but the left bull insists it's a crocodile. To prove this, The right bull threw a stone at the object and poked it with a stick. With no response, the right bull climbed on top of the object. "", ""importance"": ""7"", ""time"": 302422, ""tag"": ""prac_segB_desc""}","description"
"103","1037",1701961804479,"8","4","practice","1","2",12,33,"The two cattle continued to debate what they were seeing in the water, either a crocodile or log.  The left hand cow first threw a stone at the object then prodded it with a stick.  It did not move.  It then jumped on to the object.",7,7,"prac_segB_desc","/static/video/Prac/wildebeest_part2.mp4","{""phase"": ""description"", ""counterbalance"": 4, ""vidpath"": ""/static/video/Prac/wildebeest_part2.mp4"", ""descstop"": 1, ""vidpair"": 2, ""offset"": ""33"", ""content"": ""The two cattle continued to debate what they were seeing in the water, either a crocodile or log.  The left hand cow first threw a stone at the object then prodded it with a stick.  It did not move.  It then jumped on to the object."", ""importance"": ""7"", ""time"": 127383, ""tag"": ""prac_segB_desc""}","description"
"108","1038",1704380501629,"8","1","practice","1","2",12,33,"The two yaks were standing on the banks having a discussion about the log vs. crocodile. The one that kept saying it was a croc threw a rock at it and it did not move. He then threw a stick at it and it still did not move. He then splashed water on it and still no movement. At the end, he stepped onto it and it had not moved. ",5,5,"prac_segB_desc","/static/video/Prac/wildebeest_part2.mp4","{""phase"": ""description"", ""counterbalance"": 1, ""vidpath"": ""/static/video/Prac/wildebeest_part2.mp4"", ""descstop"": 1, ""vidpair"": 2, ""offset"": ""33"", ""content"": ""The two yaks were standing on the banks having a discussion about the log vs. crocodile. The one that kept saying it was a croc threw a rock at it and it did not move. He then threw a stick at it and it still did not move. He then splashed water on it and still no movement. At the end, he stepped onto it and it had not moved. "", ""importance"": ""5"", ""time"": 74199, ""tag"": ""prac_segB_desc""}","description"
"113","1039",1704303019902,"8","6","practice","1","2",12,33,"There were two wild buffalos debating whether there was a crocodile or a bark of a tree in the water, until one buffalo decides to throw a stone on the back of the tree and then also pressed it with a twig to reconfirm it was not a crocodile. The Buffalo that thought it was a crocodile now knowing it was not jumped on the bark of the three int the water and confirmed to the other buffalo that he was right about it being a bark of a tree",5,5,"prac_segB_desc","/static/video/Prac/wildebeest_part2.mp4","{""phase"": ""description"", ""counterbalance"": 6, ""vidpath"": ""/static/video/Prac/wildebeest_part2.mp4"", ""descstop"": 1, ""vidpair"": 2, ""offset"": ""33"", ""content"": ""There were two wild buffalos debating whether there was a crocodile or a bark of a tree in the water, until one buffalo decides to throw a stone on the back of the tree and then also pressed it with a twig to reconfirm it was not a crocodile. The Buffalo that thought it was a crocodile now knowing it was not jumped on the bark of the three int the water and confirmed to the other buffalo that he was right about it being a bark of a tree"", ""importance"": ""5"", ""time"": 152333, ""tag"": ""prac_segB_desc""}","description"
"117","1040",1704307552450,"8","6","practice","1","2",12,33,"Two cows are arguing whether a lump in the water is an alligator or a log. The one who thinks it's an alligator tests is a couple of ways and then ends up jumping onto  it.",6,6,"prac_segB_desc","/static/video/Prac/wildebeest_part2.mp4","{""phase"": ""description"", ""counterbalance"": 6, ""vidpath"": ""/static/video/Prac/wildebeest_part2.mp4"", ""descstop"": 1, ""vidpair"": 2, ""offset"": ""33"", ""content"": ""Two cows are arguing whether a lump in the water is an alligator or a log. The one who thinks it's an alligator tests is a couple of ways and then ends up jumping onto  it."", ""importance"": ""6"", ""time"": 241500, ""tag"": ""prac_segB_desc""}","description"
