"","ID","Timestamp","Trial","counterbalance","phase","description_stop","paired_vid","onset","offset","description_content","importance","time","tag","vidpath","Datastring","test_trial"
"247","1074",1702480411739,"12","4","practice","1","2",12,33,"The 2 wildebeest are arguing whether the object in the water is a log or an alligator. The one who thinks it's an alligator throws a stone at the object, with no response. They continue arguing. The one who thinks it's an alligator pokes the object with a stick, with again no response. And they continue arguing. So the one who thinks it's an alligator splashes water at the object and then steps on to it.",6,6,"prac_segB_desc","/static/video/Prac/wildebeest_part2.mp4","{""phase"": ""description"", ""counterbalance"": 4, ""vidpath"": ""/static/video/Prac/wildebeest_part2.mp4"", ""descstop"": 1, ""vidpair"": 2, ""offset"": ""33"", ""content"": ""The 2 wildebeest are arguing whether the object in the water is a log or an alligator. The one who thinks it's an alligator throws a stone at the object, with no response. They continue arguing. The one who thinks it's an alligator pokes the object with a stick, with again no response. And they continue arguing. So the one who thinks it's an alligator splashes water at the object and then steps on to it."", ""importance"": ""6"", ""time"": 146871, ""tag"": ""prac_segB_desc""}","description"
"252","1076",1698333989343,"8","4","practice","1","2",12,33,"The two bison are arguing  over whether the object in the water is a log or an alligator. The alligator-inclined bison throws a pebble at it, to no response, then pokes it with a stick, to no response, and then finally jumps on top of the object.",3,3,"prac_segB_desc","/static/video/Prac/wildebeest_part2.mp4","{""phase"": ""description"", ""counterbalance"": 4, ""vidpath"": ""/static/video/Prac/wildebeest_part2.mp4"", ""descstop"": 1, ""vidpair"": 2, ""offset"": ""33"", ""content"": ""The two bison are arguing  over whether the object in the water is a log or an alligator. The alligator-inclined bison throws a pebble at it, to no response, then pokes it with a stick, to no response, and then finally jumps on top of the object."", ""importance"": ""3"", ""time"": 88652, ""tag"": ""prac_segB_desc""}","description"
"257","1079",1703951451027,"8","7","practice","1","2",12,33,"The water buffalo on the left is convinced that the object in the water is a crocodile. The other water buffalo disagrees and says it is a log. The left buffallo throws a rock at the object. Then it throws a stick at the object. Finally, the buffalo jumps on top of the object in the water.",6,6,"prac_segB_desc","/static/video/Prac/wildebeest_part2.mp4","{""phase"": ""description"", ""counterbalance"": 7, ""vidpath"": ""/static/video/Prac/wildebeest_part2.mp4"", ""descstop"": 1, ""vidpair"": 2, ""offset"": ""33"", ""content"": ""The water buffalo on the left is convinced that the object in the water is a crocodile. The other water buffalo disagrees and says it is a log. The left buffallo throws a rock at the object. Then it throws a stick at the object. Finally, the buffalo jumps on top of the object in the water."", ""importance"": ""6"", ""time"": 168115, ""tag"": ""prac_segB_desc""}","description"
"261","1080",1703696419745,"8","4","practice","1","2",12,33,"2 cows were at the waters edge. There was something in the water. 1 thought it was a log and the other thought it was an alligator. They threw a rock at ot and poked it with a stick. One of them jumpedo n top of it.",5,5,"prac_segB_desc","/static/video/Prac/wildebeest_part2.mp4","{""phase"": ""description"", ""counterbalance"": 4, ""vidpath"": ""/static/video/Prac/wildebeest_part2.mp4"", ""descstop"": 1, ""vidpair"": 2, ""offset"": ""33"", ""content"": ""2 cows were at the waters edge. There was something in the water. 1 thought it was a log and the other thought it was an alligator. They threw a rock at ot and poked it with a stick. One of them jumpedo n top of it."", ""importance"": ""5"", ""time"": 65439, ""tag"": ""prac_segB_desc""}","description"
"266","1082",1703951353577,"8","7","practice","1","2",12,33,"Two aniimals are investigating an umfamilliar object. They attempt to find out what it is. Maybe its an alligator.",7,7,"prac_segB_desc","/static/video/Prac/wildebeest_part2.mp4","{""phase"": ""description"", ""counterbalance"": 7, ""vidpath"": ""/static/video/Prac/wildebeest_part2.mp4"", ""descstop"": 1, ""vidpair"": 2, ""offset"": ""33"", ""content"": ""Two aniimals are investigating an umfamilliar object. They attempt to find out what it is. Maybe its an alligator."", ""importance"": ""7"", ""time"": 37880, ""tag"": ""prac_segB_desc""}","description"
"270","1083",1703951280906,"8","7","practice","1","2",12,33,"The yak that was convinced the thing in the water was a crocodile did it's best to try prove it was a croc by splashing it with water, hitting it with a rock and then standing on its back",7,7,"prac_segB_desc","/static/video/Prac/wildebeest_part2.mp4","{""phase"": ""description"", ""counterbalance"": 7, ""vidpath"": ""/static/video/Prac/wildebeest_part2.mp4"", ""descstop"": 1, ""vidpair"": 2, ""offset"": ""33"", ""content"": ""The yak that was convinced the thing in the water was a crocodile did it's best to try prove it was a croc by splashing it with water, hitting it with a rock and then standing on its back"", ""importance"": ""7"", ""time"": 43695, ""tag"": ""prac_segB_desc""}","description"
"274","1084",1703614702915,"8","5","practice","1","2",12,33,"One of the wilderbeasts pokes a stick at the crocodile log and he jumps on it and gets eaten.",7,7,"prac_segB_desc","/static/video/Prac/wildebeest_part2.mp4","{""phase"": ""description"", ""counterbalance"": 5, ""vidpath"": ""/static/video/Prac/wildebeest_part2.mp4"", ""descstop"": 1, ""vidpair"": 2, ""offset"": ""33"", ""content"": ""One of the wilderbeasts pokes a stick at the crocodile log and he jumps on it and gets eaten."", ""importance"": ""7"", ""time"": 34253, ""tag"": ""prac_segB_desc""}","description"
"279","1085",1704380933021,"8","1","practice","1","2",12,33,"Two bulls are standing on a river bank next to river with an object floating in the middle. Above the heads of one bull a speech bubble with a crocodile pops up. Then above the other bull a speech bubble with a log pops up. One bull then prods the object and then steps on to it. ",3,3,"prac_segB_desc","/static/video/Prac/wildebeest_part2.mp4","{""phase"": ""description"", ""counterbalance"": 1, ""vidpath"": ""/static/video/Prac/wildebeest_part2.mp4"", ""descstop"": 1, ""vidpair"": 2, ""offset"": ""33"", ""content"": ""Two bulls are standing on a river bank next to river with an object floating in the middle. Above the heads of one bull a speech bubble with a crocodile pops up. Then above the other bull a speech bubble with a log pops up. One bull then prods the object and then steps on to it. "", ""importance"": ""3"", ""time"": 111678, ""tag"": ""prac_segB_desc""}","description"
"284","1086",1704295951553,"8","6","practice","1","2",12,33," Two brown cows with horns wanted to travel in a river. They saw something in the water that could be used to cross the water. One cow thought it looked like an alligator. So to see if it was, one cow hit it with a rock and a stick. It did not move so the cow jump on top of it.",5,5,"prac_segB_desc","/static/video/Prac/wildebeest_part2.mp4","{""phase"": ""description"", ""counterbalance"": 6, ""vidpath"": ""/static/video/Prac/wildebeest_part2.mp4"", ""descstop"": 1, ""vidpair"": 2, ""offset"": ""33"", ""content"": "" Two brown cows with horns wanted to travel in a river. They saw something in the water that could be used to cross the water. One cow thought it looked like an alligator. So to see if it was, one cow hit it with a rock and a stick. It did not move so the cow jump on top of it."", ""importance"": ""5"", ""time"": 223205, ""tag"": ""prac_segB_desc""}","description"
"288","1087",1701964784291,"8","6","practice","1","2",12,33,"2 buffalo standing at the edge of a river, disagreeing about what they see in front of them. one thinks it's a crocodile the other a log. The first firstly throws a stone at it, then pokes it with a stick before splashing it with water. It then puts it's front 2 legs on it.",4,4,"prac_segB_desc","/static/video/Prac/wildebeest_part2.mp4","{""phase"": ""description"", ""counterbalance"": 6, ""vidpath"": ""/static/video/Prac/wildebeest_part2.mp4"", ""descstop"": 1, ""vidpair"": 2, ""offset"": ""33"", ""content"": ""2 buffalo standing at the edge of a river, disagreeing about what they see in front of them. one thinks it's a crocodile the other a log. The first firstly throws a stone at it, then pokes it with a stick before splashing it with water. It then puts it's front 2 legs on it."", ""importance"": ""4"", ""time"": 109286, ""tag"": ""prac_segB_desc""}","description"
"292","1088",1701961565377,"8","1","practice","1","2",12,33,"Two gnus are discussing an object they see in the water. One thinks it is a crocodile while the other thinks it is a log. They throw things at it and poke it with a stick, and then one of them jumps onto the object. We still don't know what it really is.",7,7,"prac_segB_desc","/static/video/Prac/wildebeest_part2.mp4","{""phase"": ""description"", ""counterbalance"": 1, ""vidpath"": ""/static/video/Prac/wildebeest_part2.mp4"", ""descstop"": 1, ""vidpair"": 2, ""offset"": ""33"", ""content"": ""Two gnus are discussing an object they see in the water. One thinks it is a crocodile while the other thinks it is a log. They throw things at it and poke it with a stick, and then one of them jumps onto the object. We still don't know what it really is."", ""importance"": ""7"", ""time"": 101183, ""tag"": ""prac_segB_desc""}","description"
"297","1089",1701961418042,"8","3","practice","1","2",12,33,"The two buffalo are arguing whether it is a log, or a crocodile in the water. The throw a rock at it and nothing happens, they poke it with a stick and nothing happens, they then splash it and still nothings happens. Finally the one Buffalo stands on it and nothing happens.",6,6,"prac_segB_desc","/static/video/Prac/wildebeest_part2.mp4","{""phase"": ""description"", ""counterbalance"": 3, ""vidpath"": ""/static/video/Prac/wildebeest_part2.mp4"", ""descstop"": 1, ""vidpair"": 2, ""offset"": ""33"", ""content"": ""The two buffalo are arguing whether it is a log, or a crocodile in the water. The throw a rock at it and nothing happens, they poke it with a stick and nothing happens, they then splash it and still nothings happens. Finally the one Buffalo stands on it and nothing happens."", ""importance"": ""6"", ""time"": 74454, ""tag"": ""prac_segB_desc""}","description"
"302","1090",1701961835642,"8","7","practice","1","2",12,33,"there were two animals and one animal said there was a crocodile and the second animal responded that can used a plank of wood the one tried but saw did not work and decided to splash some water to see if the crocodile would wake up or not and then jumped on it.",6,6,"prac_segB_desc","/static/video/Prac/wildebeest_part2.mp4","{""phase"": ""description"", ""counterbalance"": 7, ""vidpath"": ""/static/video/Prac/wildebeest_part2.mp4"", ""descstop"": 1, ""vidpair"": 2, ""offset"": ""33"", ""content"": ""there were two animals and one animal said there was a crocodile and the second animal responded that can used a plank of wood the one tried but saw did not work and decided to splash some water to see if the crocodile would wake up or not and then jumped on it."", ""importance"": ""6"", ""time"": 188555, ""tag"": ""prac_segB_desc""}","description"
"306","1091",1701964305447,"8","3","practice","1","2",12,33,"There are two bulls on land standing next to water. They are arguing about what they are seeing in the water. The first bull believes it is a log and the second bull insists it's a crocodile. They go back and forth. One of the bulls decides to throw a pebble at it to see if it moves. If it moves, it's most likely a crocodile. It didn't move. Next, the bull pokes it with a stick, but it still didn't move. They determine it is not a crocodile and one of the bulls jumps on the log.",4,4,"prac_segB_desc","/static/video/Prac/wildebeest_part2.mp4","{""phase"": ""description"", ""counterbalance"": 3, ""vidpath"": ""/static/video/Prac/wildebeest_part2.mp4"", ""descstop"": 1, ""vidpair"": 2, ""offset"": ""33"", ""content"": ""There are two bulls on land standing next to water. They are arguing about what they are seeing in the water. The first bull believes it is a log and the second bull insists it's a crocodile. They go back and forth. One of the bulls decides to throw a pebble at it to see if it moves. If it moves, it's most likely a crocodile. It didn't move. Next, the bull pokes it with a stick, but it still didn't move. They determine it is not a crocodile and one of the bulls jumps on the log."", ""importance"": ""4"", ""time"": 146330, ""tag"": ""prac_segB_desc""}","description"
"311","1092",1701964253141,"8","4","practice","1","2",12,33,"There were 2 wildebeest at the edge of a river. They were trying to decide if what looked like a log was actually a log or a crocodile. In the end one of them jumped on top and stood on it!",6,6,"prac_segB_desc","/static/video/Prac/wildebeest_part2.mp4","{""phase"": ""description"", ""counterbalance"": 4, ""vidpath"": ""/static/video/Prac/wildebeest_part2.mp4"", ""descstop"": 1, ""vidpair"": 2, ""offset"": ""33"", ""content"": ""There were 2 wildebeest at the edge of a river. They were trying to decide if what looked like a log was actually a log or a crocodile. In the end one of them jumped on top and stood on it!"", ""importance"": ""6"", ""time"": 83005, ""tag"": ""prac_segB_desc""}","description"
"316","1093",1703614671004,"8","5","practice","1","2",12,33,"There were two cows at the edge of a pond. One was describing what he thought was a alligator and the other thought it was a log to step on. They tested it out with a stick, and then One went to go step on it at that point nothing yet had happened to either cow.",7,7,"prac_segB_desc","/static/video/Prac/wildebeest_part2.mp4","{""phase"": ""description"", ""counterbalance"": 5, ""vidpath"": ""/static/video/Prac/wildebeest_part2.mp4"", ""descstop"": 1, ""vidpair"": 2, ""offset"": ""33"", ""content"": ""There were two cows at the edge of a pond. One was describing what he thought was a alligator and the other thought it was a log to step on. They tested it out with a stick, and then One went to go step on it at that point nothing yet had happened to either cow."", ""importance"": ""7"", ""time"": 66304, ""tag"": ""prac_segB_desc""}","description"
"321","1095",1704383247136,"8","1","practice","1","2",12,33,"The yaks see an object in the water and are unsure of what it is. They consult that it could be an alligator, log or something else. They then proceed to throw a stick at the object.",5,5,"prac_segB_desc","/static/video/Prac/wildebeest_part2.mp4","{""phase"": ""description"", ""counterbalance"": 1, ""vidpath"": ""/static/video/Prac/wildebeest_part2.mp4"", ""descstop"": 1, ""vidpair"": 2, ""offset"": ""33"", ""content"": ""The yaks see an object in the water and are unsure of what it is. They consult that it could be an alligator, log or something else. They then proceed to throw a stick at the object."", ""importance"": ""5"", ""time"": 49119, ""tag"": ""prac_segB_desc""}","description"
"326","1097",1704295783169,"8","6","practice","1","2",12,33,"Two bison are standing by a river, there is an object in the riover. One bison thinks it is a crocodile, the other thinks it is a log. The bison that thinks it is a crocodile tries to get a response from the object by kicking stones at it, poking it with a stick, splashing it with water and then finally by jumping on it",5,5,"prac_segB_desc","/static/video/Prac/wildebeest_part2.mp4","{""phase"": ""description"", ""counterbalance"": 6, ""vidpath"": ""/static/video/Prac/wildebeest_part2.mp4"", ""descstop"": 1, ""vidpair"": 2, ""offset"": ""33"", ""content"": ""Two bison are standing by a river, there is an object in the riover. One bison thinks it is a crocodile, the other thinks it is a log. The bison that thinks it is a crocodile tries to get a response from the object by kicking stones at it, poking it with a stick, splashing it with water and then finally by jumping on it"", ""importance"": ""5"", ""time"": 102648, ""tag"": ""prac_segB_desc""}","description"
"330","1098",1704296957725,"8","6","practice","1","2",12,33,"Two Wildebeest are standing on the riverbank looking at an object. One tells the other that the object is a crocodile. The other says it's a log. The 1st Wildebeest throws a stone, then prods it with a stick, and finally jumps on top of the object in an attempt to prove it is a crocodile.",6,6,"prac_segB_desc","/static/video/Prac/wildebeest_part2.mp4","{""phase"": ""description"", ""counterbalance"": 6, ""vidpath"": ""/static/video/Prac/wildebeest_part2.mp4"", ""descstop"": 1, ""vidpair"": 2, ""offset"": ""33"", ""content"": ""Two Wildebeest are standing on the riverbank looking at an object. One tells the other that the object is a crocodile. The other says it's a log. The 1st Wildebeest throws a stone, then prods it with a stick, and finally jumps on top of the object in an attempt to prove it is a crocodile."", ""importance"": ""6"", ""time"": 123007, ""tag"": ""prac_segB_desc""}","description"
"334","1099",1703779678260,"8","2","practice","1","2",12,33,"It was an animated movie in which two buffalo or cow like animals were having a conversation about whether an object in the water was a crocodile or a log. One of the animals that thought it was a crocodile began throwing and poking the object with projecticles to provoke a reaction and prove to the other that it was but without any response before then taking a leap of faith blindly by jumping onto the object and was standing on top of it when the clip ended which didn't make much sense when that was the animal that thought it was a crocodile rather than a log which would suggest at this point that both animals now believe it is a log but that hasn't actually been confirmed yet.",7,7,"prac_segB_desc","/static/video/Prac/wildebeest_part2.mp4","{""phase"": ""description"", ""counterbalance"": 2, ""vidpath"": ""/static/video/Prac/wildebeest_part2.mp4"", ""descstop"": 1, ""vidpair"": 2, ""offset"": ""33"", ""content"": ""It was an animated movie in which two buffalo or cow like animals were having a conversation about whether an object in the water was a crocodile or a log. One of the animals that thought it was a crocodile began throwing and poking the object with projecticles to provoke a reaction and prove to the other that it was but without any response before then taking a leap of faith blindly by jumping onto the object and was standing on top of it when the clip ended which didn't make much sense when that was the animal that thought it was a crocodile rather than a log which would suggest at this point that both animals now believe it is a log but that hasn't actually been confirmed yet."", ""importance"": ""7"", ""time"": 236654, ""tag"": ""prac_segB_desc""}","description"
"339","1101",1701961401246,"8","2","practice","1","2",12,33,"Two elks? standing by water looking at something in the water . They are discussing whether it's a log, or is it a crocodile? one throws a stone, no reaction, he then prods it with a stick, so then jumps on, still no reaction",6,6,"prac_segB_desc","/static/video/Prac/wildebeest_part2.mp4","{""phase"": ""description"", ""counterbalance"": 2, ""vidpath"": ""/static/video/Prac/wildebeest_part2.mp4"", ""descstop"": 1, ""vidpair"": 2, ""offset"": ""33"", ""content"": ""Two elks? standing by water looking at something in the water . They are discussing whether it's a log, or is it a crocodile? one throws a stone, no reaction, he then prods it with a stick, so then jumps on, still no reaction"", ""importance"": ""6"", ""time"": 187007, ""tag"": ""prac_segB_desc""}","description"
"344","1103",1703777374353,"8","2","practice","1","2",12,33,"Two animals, possibly buffalo or bison are stood by the edge of some water. They are animated, and are grunting at each other which takes the form of a conversation in speech bubbles - they are establishing whether an object in the water is a log or a crocodile. One says log, the other says crocodile. The one that thinks the object is a crocodile keeps hitting the object with various things, first a stone, then a stick. At the end the buffalo that thinks the object is a crocodile jumps on the crocodile.",6,6,"prac_segB_desc","/static/video/Prac/wildebeest_part2.mp4","{""phase"": ""description"", ""counterbalance"": 2, ""vidpath"": ""/static/video/Prac/wildebeest_part2.mp4"", ""descstop"": 1, ""vidpair"": 2, ""offset"": ""33"", ""content"": ""Two animals, possibly buffalo or bison are stood by the edge of some water. They are animated, and are grunting at each other which takes the form of a conversation in speech bubbles - they are establishing whether an object in the water is a log or a crocodile. One says log, the other says crocodile. The one that thinks the object is a crocodile keeps hitting the object with various things, first a stone, then a stick. At the end the buffalo that thinks the object is a crocodile jumps on the crocodile."", ""importance"": ""6"", ""time"": 101342, ""tag"": ""prac_segB_desc""}","description"
"349","1105",1704385362565,"8","1","practice","1","2",12,33,"The 2 animals continued to argue if the thing in the water was a crocodile or a log. The first animal threw a stone at the thing in the water. The second animal again said it was a log while the first animal said it was a crocodile. Then the animal poked it with a stick. The 2nd animal again said log, and the first said crocodile. The first animal splashed water on the thing before jumping on it",2,2,"prac_segB_desc","/static/video/Prac/wildebeest_part2.mp4","{""phase"": ""description"", ""counterbalance"": 1, ""vidpath"": ""/static/video/Prac/wildebeest_part2.mp4"", ""descstop"": 1, ""vidpair"": 2, ""offset"": ""33"", ""content"": ""The 2 animals continued to argue if the thing in the water was a crocodile or a log. The first animal threw a stone at the thing in the water. The second animal again said it was a log while the first animal said it was a crocodile. Then the animal poked it with a stick. The 2nd animal again said log, and the first said crocodile. The first animal splashed water on the thing before jumping on it"", ""importance"": ""2"", ""time"": 151754, ""tag"": ""prac_segB_desc""}","description"
"354","1106",1704381611469,"8","1","practice","1","2",12,33,"The two wildebeest were still debating if the object in the water is a log or crocodile. The wildebeest that thinks its a crocodile points a stick to the object and pokes its and then jumps on the object that's in the water.",7,7,"prac_segB_desc","/static/video/Prac/wildebeest_part2.mp4","{""phase"": ""description"", ""counterbalance"": 1, ""vidpath"": ""/static/video/Prac/wildebeest_part2.mp4"", ""descstop"": 1, ""vidpair"": 2, ""offset"": ""33"", ""content"": ""The two wildebeest were still debating if the object in the water is a log or crocodile. The wildebeest that thinks its a crocodile points a stick to the object and pokes its and then jumps on the object that's in the water."", ""importance"": ""7"", ""time"": 279700, ""tag"": ""prac_segB_desc""}","description"
"359","1108",1704394882329,"8","0","practice","1","2",12,33,"Cows keep arguing over what it is in the water - log or crocodile. The one who says that it is crocodile, throws a rock at it, then pokes with a branch and then jumps on top of it.",5,5,"prac_segB_desc","/static/video/Prac/wildebeest_part2.mp4","{""phase"": ""description"", ""counterbalance"": 0, ""vidpath"": ""/static/video/Prac/wildebeest_part2.mp4"", ""descstop"": 1, ""vidpair"": 2, ""offset"": ""33"", ""content"": ""Cows keep arguing over what it is in the water - log or crocodile. The one who says that it is crocodile, throws a rock at it, then pokes with a branch and then jumps on top of it."", ""importance"": ""5"", ""time"": 67001, ""tag"": ""prac_segB_desc""}","description"
"364","1109",1704394813360,"8","0","practice","1","2",12,33,"There's two cows at a waterhole. There's an item in the water but they can only see a small portion of it. It could be a log, or it could be a crocodile. They don't know which it is. One cow's trying to check what it is by trying to stir it up. It's thrown a stone and tapped it. The item hasn't budged so it seems like it might just be a log.",6,6,"prac_segB_desc","/static/video/Prac/wildebeest_part2.mp4","{""phase"": ""description"", ""counterbalance"": 0, ""vidpath"": ""/static/video/Prac/wildebeest_part2.mp4"", ""descstop"": 1, ""vidpair"": 2, ""offset"": ""33"", ""content"": ""There's two cows at a waterhole. There's an item in the water but they can only see a small portion of it. It could be a log, or it could be a crocodile. They don't know which it is. One cow's trying to check what it is by trying to stir it up. It's thrown a stone and tapped it. The item hasn't budged so it seems like it might just be a log."", ""importance"": ""6"", ""time"": 83949, ""tag"": ""prac_segB_desc""}","description"
