"","ID","Timestamp","Trial","counterbalance","phase","description_stop","paired_vid","onset","offset","description_content","importance","time","tag","vidpath","Datastring","test_trial"
"610","1176",1711992115422,"8","5","practice","1","2",12,33,"Two bison at a watering hole, a mysterious floating object, which appeared to look like a croc' or was it a log, one thought lig, the other thought croc, he threw a stone at it, poked it with a stick, even jumped on its back.. ",6,6,"prac_segB_desc","/static/video/Prac/wildebeest_part2.mp4","{""phase"": ""description"", ""counterbalance"": 5, ""vidpath"": ""/static/video/Prac/wildebeest_part2.mp4"", ""descstop"": 1, ""vidpair"": 2, ""offset"": ""33"", ""content"": ""Two bison at a watering hole, a mysterious floating object, which appeared to look like a croc' or was it a log, one thought lig, the other thought croc, he threw a stone at it, poked it with a stick, even jumped on its back.. "", ""importance"": ""6"", ""time"": 121805, ""tag"": ""prac_segB_desc""}","description"
"615","1177",1712070273141,"8","0","practice","1","2",12,33,"The two wildebeest continue to argue over what the object in the water may be - either a crocodile or a log. The wildebeest who's arguing it's a crocodile becomes increasingly irate, and begins throwing rocks at, else poking with a stick, the object in the water. The other wildebeest remains unconvinced. In frustration, the first wildebeest jumps onto the object.",5,5,"prac_segB_desc","/static/video/Prac/wildebeest_part2.mp4","{""phase"": ""description"", ""counterbalance"": 0, ""vidpath"": ""/static/video/Prac/wildebeest_part2.mp4"", ""descstop"": 1, ""vidpair"": 2, ""offset"": ""33"", ""content"": ""The two wildebeest continue to argue over what the object in the water may be - either a crocodile or a log. The wildebeest who's arguing it's a crocodile becomes increasingly irate, and begins throwing rocks at, else poking with a stick, the object in the water. The other wildebeest remains unconvinced. In frustration, the first wildebeest jumps onto the object."", ""importance"": ""5"", ""time"": 73290, ""tag"": ""prac_segB_desc""}","description"
"620","1178",1712584834548,"8","3","practice","1","2",12,33,"The wildebeests debated whether the object was an alligator or log. They threw a rock at it, poked it with a stick, and splashed water on it. Then one of them stepped onto it.",5,5,"prac_segB_desc","/static/video/Prac/wildebeest_part2.mp4","{""phase"": ""description"", ""counterbalance"": 3, ""vidpath"": ""/static/video/Prac/wildebeest_part2.mp4"", ""descstop"": 1, ""vidpair"": 2, ""offset"": ""33"", ""content"": ""The wildebeests debated whether the object was an alligator or log. They threw a rock at it, poked it with a stick, and splashed water on it. Then one of them stepped onto it."", ""importance"": ""5"", ""time"": 75570, ""tag"": ""prac_segB_desc""}","description"
"625","1180",1712769117734,"8","2","practice","1","2",12,33,"Two animals were getting water. They saw somethng in the water. It could be a log or could be an alligator. They through rocks at it and poked it with a stick to test. ",5,5,"prac_segB_desc","/static/video/Prac/wildebeest_part2.mp4","{""phase"": ""description"", ""counterbalance"": 2, ""vidpath"": ""/static/video/Prac/wildebeest_part2.mp4"", ""descstop"": 1, ""vidpair"": 2, ""offset"": ""33"", ""content"": ""Two animals were getting water. They saw somethng in the water. It could be a log or could be an alligator. They through rocks at it and poked it with a stick to test. "", ""importance"": ""5"", ""time"": 83746, ""tag"": ""prac_segB_desc""}","description"
"630","1181",1712769342018,"8","6","practice","1","2",12,33,"The cow on the left said crocodile while the one on the right said log. The one on the left and picked up a rock tossing it at the object in the water. The one on the right said crocodile and the one on the right said log. The one on the left grabbed a stick and was poking the thing in the water. He then splashed it and placed the front two legs first before stepping onto the thing in the water.",7,7,"prac_segB_desc","/static/video/Prac/wildebeest_part2.mp4","{""phase"": ""description"", ""counterbalance"": 6, ""vidpath"": ""/static/video/Prac/wildebeest_part2.mp4"", ""descstop"": 1, ""vidpair"": 2, ""offset"": ""33"", ""content"": ""The cow on the left said crocodile while the one on the right said log. The one on the left and picked up a rock tossing it at the object in the water. The one on the right said crocodile and the one on the right said log. The one on the left grabbed a stick and was poking the thing in the water. He then splashed it and placed the front two legs first before stepping onto the thing in the water."", ""importance"": ""7"", ""time"": 146065, ""tag"": ""prac_segB_desc""}","description"
"634","1182",1713797210000,"8","2","practice","1","2",12,33,"The two cows keep going back and forth, the \it's an alligator\ cow tosses a small stone at the object in the water. Nothing happens. It pokes it with a stick. Nothing happens. It splashes water on it. Nothing happens. It taps it with a hoof, and nothing happens, so it finally steps onto it. ",5,5,"prac_segB_desc","/static/video/Prac/wildebeest_part2.mp4","{""phase"": ""description"", ""counterbalance"": 2, ""vidpath"": ""/static/video/Prac/wildebeest_part2.mp4"", ""descstop"": 1, ""vidpair"": 2, ""offset"": ""33"", ""content"": ""The two cows keep going back and forth, the \""it's an alligator\"" cow tosses a small stone at the object in the water. Nothing happens. It pokes it with a stick. Nothing happens. It splashes water on it. Nothing happens. It taps it with a hoof, and nothing happens, so it finally steps onto it. "", ""importance"": ""5"", ""time"": 78066, ""tag"": ""prac_segB_desc""}","description"
"639","1183",1712672521834,"8","2","practice","1","2",12,33,"There was 2 bulls at the waterside, in the middle of the river there was a shape. One bull thought it was a crocodile whilst the other thought it was a log . The bull who thought it was only a log stepped on it to help him cross the water.",7,7,"prac_segB_desc","/static/video/Prac/wildebeest_part2.mp4","{""phase"": ""description"", ""counterbalance"": 2, ""vidpath"": ""/static/video/Prac/wildebeest_part2.mp4"", ""descstop"": 1, ""vidpair"": 2, ""offset"": ""33"", ""content"": ""There was 2 bulls at the waterside, in the middle of the river there was a shape. One bull thought it was a crocodile whilst the other thought it was a log . The bull who thought it was only a log stepped on it to help him cross the water."", ""importance"": ""7"", ""time"": 112820, ""tag"": ""prac_segB_desc""}","description"
"644","1184",1712152987995,"8","8","practice","1","2",12,33,"So the two wilder-beasts continue their conversation as before, with one insisting that the object in the water is a crocodile and the other that it is just a log. There is a back and forth with them reiterating their positions and each time, the one who believes it to be a crocodile, punctuates their point with a physical action, throwing rocks at it, poking it with a stick, and at the point we stopped, they had stepped out onto the object.",6,6,"prac_segB_desc","/static/video/Prac/wildebeest_part2.mp4","{""phase"": ""description"", ""counterbalance"": 8, ""vidpath"": ""/static/video/Prac/wildebeest_part2.mp4"", ""descstop"": 1, ""vidpair"": 2, ""offset"": ""33"", ""content"": ""So the two wilder-beasts continue their conversation as before, with one insisting that the object in the water is a crocodile and the other that it is just a log. There is a back and forth with them reiterating their positions and each time, the one who believes it to be a crocodile, punctuates their point with a physical action, throwing rocks at it, poking it with a stick, and at the point we stopped, they had stepped out onto the object."", ""importance"": ""6"", ""time"": 253761, ""tag"": ""prac_segB_desc""}","description"
"648","1185",1712672634419,"8","7","practice","1","2",12,33,"One of the animals on the bank threw a rock at the thing in the water. Then prodded it with a stick. Then splashed water on it. Then jumped on top of it. The two animals continued to disagree on what it was.",5,5,"prac_segB_desc","/static/video/Prac/wildebeest_part2.mp4","{""phase"": ""description"", ""counterbalance"": 7, ""vidpath"": ""/static/video/Prac/wildebeest_part2.mp4"", ""descstop"": 1, ""vidpair"": 2, ""offset"": ""33"", ""content"": ""One of the animals on the bank threw a rock at the thing in the water. Then prodded it with a stick. Then splashed water on it. Then jumped on top of it. The two animals continued to disagree on what it was."", ""importance"": ""5"", ""time"": 189987, ""tag"": ""prac_segB_desc""}","description"
"652","1188",1711992260627,"8","2","practice","1","2",12,33,"the two wildebeest were looking at what one thought was a crocodile and one thought it was a log in the river,th one who thought it was a croc threw a rock at the at the object and then poked it with a stick not satisfied with that he jumpe on top of the what he thought was a croc then the video ended",7,7,"prac_segB_desc","/static/video/Prac/wildebeest_part2.mp4","{""phase"": ""description"", ""counterbalance"": 2, ""vidpath"": ""/static/video/Prac/wildebeest_part2.mp4"", ""descstop"": 1, ""vidpair"": 2, ""offset"": ""33"", ""content"": ""the two wildebeest were looking at what one thought was a crocodile and one thought it was a log in the river,th one who thought it was a croc threw a rock at the at the object and then poked it with a stick not satisfied with that he jumpe on top of the what he thought was a croc then the video ended"", ""importance"": ""7"", ""time"": 241708, ""tag"": ""prac_segB_desc""}","description"
"657","1189",1712070188780,"8","8","practice","1","2",12,33,"The buffalos were still debating if there was an alligator or log in the water.  One of them jump on top trying to prove it was alligator .",7,7,"prac_segB_desc","/static/video/Prac/wildebeest_part2.mp4","{""phase"": ""description"", ""counterbalance"": 8, ""vidpath"": ""/static/video/Prac/wildebeest_part2.mp4"", ""descstop"": 1, ""vidpair"": 2, ""offset"": ""33"", ""content"": ""The buffalos were still debating if there was an alligator or log in the water.  One of them jump on top trying to prove it was alligator ."", ""importance"": ""7"", ""time"": 56104, ""tag"": ""prac_segB_desc""}","description"
"661","1190",1712070613280,"8","2","practice","1","2",12,33,"Looks like two cartoon buffalo or bovine horned anyway are standing by some water one on he left grunts and a pic of a gator is shown in a bubble capsule the other gurts with a bubble showing log they go back and forth sticking to their perceptions the gator perceiver throws a small rock, splashes water, pokes with a stick nothing happens and then jumps on to the object bouncing up and down.",6,6,"prac_segB_desc","/static/video/Prac/wildebeest_part2.mp4","{""phase"": ""description"", ""counterbalance"": 2, ""vidpath"": ""/static/video/Prac/wildebeest_part2.mp4"", ""descstop"": 1, ""vidpair"": 2, ""offset"": ""33"", ""content"": ""Looks like two cartoon buffalo or bovine horned anyway are standing by some water one on he left grunts and a pic of a gator is shown in a bubble capsule the other gurts with a bubble showing log they go back and forth sticking to their perceptions the gator perceiver throws a small rock, splashes water, pokes with a stick nothing happens and then jumps on to the object bouncing up and down."", ""importance"": ""6"", ""time"": 163546, ""tag"": ""prac_segB_desc""}","description"
"666","1191",1712074256561,"8","4","practice","1","2",12,33,"one of the cows thinks its a crocodile while the other cow thinks its a piece of wood, the cow that thinks its a crocodile then throws a rock at the object in the water, then the cow pokes it with a stick, then the cow kicks water at it, then the cow jumps onto the object in the water.   ",5,5,"prac_segB_desc","/static/video/Prac/wildebeest_part2.mp4","{""phase"": ""description"", ""counterbalance"": 4, ""vidpath"": ""/static/video/Prac/wildebeest_part2.mp4"", ""descstop"": 1, ""vidpair"": 2, ""offset"": ""33"", ""content"": ""one of the cows thinks its a crocodile while the other cow thinks its a piece of wood, the cow that thinks its a crocodile then throws a rock at the object in the water, then the cow pokes it with a stick, then the cow kicks water at it, then the cow jumps onto the object in the water.   "", ""importance"": ""5"", ""time"": 368828, ""tag"": ""prac_segB_desc""}","description"
"671","1193",1712070274384,"8","4","practice","1","2",12,33,"The cows are arguing if the thing in the water is a log of crocodile. The one that thinks its a crocodile just hopped on it to try to prove it to the friend",6,6,"prac_segB_desc","/static/video/Prac/wildebeest_part2.mp4","{""phase"": ""description"", ""counterbalance"": 4, ""vidpath"": ""/static/video/Prac/wildebeest_part2.mp4"", ""descstop"": 1, ""vidpair"": 2, ""offset"": ""33"", ""content"": ""The cows are arguing if the thing in the water is a log of crocodile. The one that thinks its a crocodile just hopped on it to try to prove it to the friend"", ""importance"": ""6"", ""time"": 29514, ""tag"": ""prac_segB_desc""}","description"
"676","1194",1712584891575,"8","5","practice","1","2",12,33,"The cow that thought the object was a log threw a stone at the object, followed by a stick and then splashed some water at it. There was no reaction frrom the object, but the other cow still thought it was an alligator. At the end of the clip, the cow that thought the object was a log stepped onto it.",5,5,"prac_segB_desc","/static/video/Prac/wildebeest_part2.mp4","{""phase"": ""description"", ""counterbalance"": 5, ""vidpath"": ""/static/video/Prac/wildebeest_part2.mp4"", ""descstop"": 1, ""vidpair"": 2, ""offset"": ""33"", ""content"": ""The cow that thought the object was a log threw a stone at the object, followed by a stick and then splashed some water at it. There was no reaction frrom the object, but the other cow still thought it was an alligator. At the end of the clip, the cow that thought the object was a log stepped onto it."", ""importance"": ""5"", ""time"": 116283, ""tag"": ""prac_segB_desc""}","description"
"681","1195",1713797555640,"8","2","practice","1","2",12,33,"The were two buffalo by the water front, one buffalo was skeptical if there is a crocodile in the water while the other thought of a wood. The first that thought a crocodile was inside used a stick to the body of water and found nothing. The buffalo stepped his feet inside the water.",6,6,"prac_segB_desc","/static/video/Prac/wildebeest_part2.mp4","{""phase"": ""description"", ""counterbalance"": 2, ""vidpath"": ""/static/video/Prac/wildebeest_part2.mp4"", ""descstop"": 1, ""vidpair"": 2, ""offset"": ""33"", ""content"": ""The were two buffalo by the water front, one buffalo was skeptical if there is a crocodile in the water while the other thought of a wood. The first that thought a crocodile was inside used a stick to the body of water and found nothing. The buffalo stepped his feet inside the water."", ""importance"": ""6"", ""time"": 153986, ""tag"": ""prac_segB_desc""}","description"
"686","1196",1712153023416,"8","1","practice","1","2",12,33,"The wildebeest on the left throws a rock at the alligator/log, then the one on the right says it's a log because the rock didn't make the alligator move. Then the wildebeest on the left pokes it with a stick, then splashes water on the alligator/log. Finally, it jumps on top of the alligator/log.",6,6,"prac_segB_desc","/static/video/Prac/wildebeest_part2.mp4","{""phase"": ""description"", ""counterbalance"": 1, ""vidpath"": ""/static/video/Prac/wildebeest_part2.mp4"", ""descstop"": 1, ""vidpair"": 2, ""offset"": ""33"", ""content"": ""The wildebeest on the left throws a rock at the alligator/log, then the one on the right says it's a log because the rock didn't make the alligator move. Then the wildebeest on the left pokes it with a stick, then splashes water on the alligator/log. Finally, it jumps on top of the alligator/log."", ""importance"": ""6"", ""time"": 104763, ""tag"": ""prac_segB_desc""}","description"
"691","1197",1712073688805,"8","3","practice","1","2",12,33,"The bison disagreed whether the object in the water was a log or a crocodile. They tested it a few ways like throwing a stone at it, but still disagreed. Finally one bison jumped onto the object to check",6,6,"prac_segB_desc","/static/video/Prac/wildebeest_part2.mp4","{""phase"": ""description"", ""counterbalance"": 3, ""vidpath"": ""/static/video/Prac/wildebeest_part2.mp4"", ""descstop"": 1, ""vidpair"": 2, ""offset"": ""33"", ""content"": ""The bison disagreed whether the object in the water was a log or a crocodile. They tested it a few ways like throwing a stone at it, but still disagreed. Finally one bison jumped onto the object to check"", ""importance"": ""6"", ""time"": 54289, ""tag"": ""prac_segB_desc""}","description"
"696","1198",1712073568022,"8","4","practice","1","2",12,33,"There are two wildebeest at the waters edge, there is also an object in the water. One thinks that the object is a crocodile and the other thinks it is a log. The one who thinks it is a crocodile throws a stone, splashes it, hits it with a stick and even jumps on it to prove that it is a crocodile with no reaction.",5,5,"prac_segB_desc","/static/video/Prac/wildebeest_part2.mp4","{""phase"": ""description"", ""counterbalance"": 4, ""vidpath"": ""/static/video/Prac/wildebeest_part2.mp4"", ""descstop"": 1, ""vidpair"": 2, ""offset"": ""33"", ""content"": ""There are two wildebeest at the waters edge, there is also an object in the water. One thinks that the object is a crocodile and the other thinks it is a log. The one who thinks it is a crocodile throws a stone, splashes it, hits it with a stick and even jumps on it to prove that it is a crocodile with no reaction."", ""importance"": ""5"", ""time"": 108111, ""tag"": ""prac_segB_desc""}","description"
"701","1199",1713190146125,"8","5","practice","1","2",12,33,"The first animal tests the object 4 times while insisting it is a crocodile, and his friends insists it's a log. He throws a rock, then uses a stick, then splashes with water, then climbs onto it. ",7,7,"prac_segB_desc","/static/video/Prac/wildebeest_part2.mp4","{""phase"": ""description"", ""counterbalance"": 5, ""vidpath"": ""/static/video/Prac/wildebeest_part2.mp4"", ""descstop"": 1, ""vidpair"": 2, ""offset"": ""33"", ""content"": ""The first animal tests the object 4 times while insisting it is a crocodile, and his friends insists it's a log. He throws a rock, then uses a stick, then splashes with water, then climbs onto it. "", ""importance"": ""7"", ""time"": 51550, ""tag"": ""prac_segB_desc""}","description"
"706","1200",1712672553020,"8","0","practice","1","2",12,33,"The two buffalos are arguing about whether the shape in the water is a log or crocodile. The one who thinks it is a crocodile throws a rock at it, prods it with a stick, throws water at it and eventually jumps on it in an attempt to prove it is a crocodile. ",5,5,"prac_segB_desc","/static/video/Prac/wildebeest_part2.mp4","{""phase"": ""description"", ""counterbalance"": 0, ""vidpath"": ""/static/video/Prac/wildebeest_part2.mp4"", ""descstop"": 1, ""vidpair"": 2, ""offset"": ""33"", ""content"": ""The two buffalos are arguing about whether the shape in the water is a log or crocodile. The one who thinks it is a crocodile throws a rock at it, prods it with a stick, throws water at it and eventually jumps on it in an attempt to prove it is a crocodile. "", ""importance"": ""5"", ""time"": 70732, ""tag"": ""prac_segB_desc""}","description"
"711","1201",1712584891804,"8","6","practice","1","2",12,33,"The two wilder beast discuss whether the object in the water is a crocodile or a log. The wilder beast closest to the water pokes the object with a stick, tries splashing it with water and tries to step on the object.",2,2,"prac_segB_desc","/static/video/Prac/wildebeest_part2.mp4","{""phase"": ""description"", ""counterbalance"": 6, ""vidpath"": ""/static/video/Prac/wildebeest_part2.mp4"", ""descstop"": 1, ""vidpair"": 2, ""offset"": ""33"", ""content"": ""The two wilder beast discuss whether the object in the water is a crocodile or a log. The wilder beast closest to the water pokes the object with a stick, tries splashing it with water and tries to step on the object."", ""importance"": ""2"", ""time"": 102027, ""tag"": ""prac_segB_desc""}","description"
"715","1202",1712769218466,"8","7","practice","1","2",12,33,"The two bulls are arguing over what a mysterious shape in the water is. The first bull thinks it's a crocodile, but the second thinks it's a log. The first bull then throws a stone at it, and both bulls still stick by their original theories. Then the first bull pokes the shape with a stick, and we still don't know what it is. Both bulls still think they are right. Then the first bull splashes water on the shape and presses on it with it's front two legs! ",5,5,"prac_segB_desc","/static/video/Prac/wildebeest_part2.mp4","{""phase"": ""description"", ""counterbalance"": 7, ""vidpath"": ""/static/video/Prac/wildebeest_part2.mp4"", ""descstop"": 1, ""vidpair"": 2, ""offset"": ""33"", ""content"": ""The two bulls are arguing over what a mysterious shape in the water is. The first bull thinks it's a crocodile, but the second thinks it's a log. The first bull then throws a stone at it, and both bulls still stick by their original theories. Then the first bull pokes the shape with a stick, and we still don't know what it is. Both bulls still think they are right. Then the first bull splashes water on the shape and presses on it with it's front two legs! "", ""importance"": ""5"", ""time"": 155790, ""tag"": ""prac_segB_desc""}","description"
"719","1203",1713190418322,"8","2","practice","1","2",12,33,"There are 2 water buffalo beside the water. There is an object in the water in front of them. They are arguing back and forth about if it is a log of an alligator. One of the them throws a rock at the object, it doesn't move. Then, it pushes on it with it foot, it dips down from the pressure, then pops back up. The water buffalo then jumps on the object. It bobs under it, but still no reaction. ",6,6,"prac_segB_desc","/static/video/Prac/wildebeest_part2.mp4","{""phase"": ""description"", ""counterbalance"": 2, ""vidpath"": ""/static/video/Prac/wildebeest_part2.mp4"", ""descstop"": 1, ""vidpair"": 2, ""offset"": ""33"", ""content"": ""There are 2 water buffalo beside the water. There is an object in the water in front of them. They are arguing back and forth about if it is a log of an alligator. One of the them throws a rock at the object, it doesn't move. Then, it pushes on it with it foot, it dips down from the pressure, then pops back up. The water buffalo then jumps on the object. It bobs under it, but still no reaction. "", ""importance"": ""6"", ""time"": 255578, ""tag"": ""prac_segB_desc""}","description"
"724","1204",1712758074617,"8","1","practice","1","2",12,33,"The bull threw a rock at the floating object in the water. They are still debating on whether it is a log or a crocodile. The bull then prodded the object with a stick with no response, still thinking it is a crocodile. Adamant that the object is a crocodile, the bull jumps on the object",6,6,"prac_segB_desc","/static/video/Prac/wildebeest_part2.mp4","{""phase"": ""description"", ""counterbalance"": 1, ""vidpath"": ""/static/video/Prac/wildebeest_part2.mp4"", ""descstop"": 1, ""vidpair"": 2, ""offset"": ""33"", ""content"": ""The bull threw a rock at the floating object in the water. They are still debating on whether it is a log or a crocodile. The bull then prodded the object with a stick with no response, still thinking it is a crocodile. Adamant that the object is a crocodile, the bull jumps on the object"", ""importance"": ""6"", ""time"": 64526, ""tag"": ""prac_segB_desc""}","description"
"729","1205",1711993653705,"8","1","practice","1","2",12,33,"Two moose are standing on the rivers edge staring at an object in the river. One of the moose beleives the object is a crocodile and the other beleives it is a log. To try and prove his point the first moose prods the object with a stick. And then jumps ontop of it, to try and show it is not a crocodile.",3,3,"prac_segB_desc","/static/video/Prac/wildebeest_part2.mp4","{""phase"": ""description"", ""counterbalance"": 1, ""vidpath"": ""/static/video/Prac/wildebeest_part2.mp4"", ""descstop"": 1, ""vidpair"": 2, ""offset"": ""33"", ""content"": ""Two moose are standing on the rivers edge staring at an object in the river. One of the moose beleives the object is a crocodile and the other beleives it is a log. To try and prove his point the first moose prods the object with a stick. And then jumps ontop of it, to try and show it is not a crocodile."", ""importance"": ""3"", ""time"": 66366, ""tag"": ""prac_segB_desc""}","description"
