"","ID","Timestamp","Trial","counterbalance","phase","description_stop","paired_vid","onset","offset","description_content","importance","time","tag","vidpath","Datastring","test_trial"
"330","1061",1702749426155,"8","5","practice","1","2",12,33,"Two Bison stand at the edge of a waterway. Together they stare at an object in the water. One believes it to be a crocodile, while the other disagrees and believes it is a log. The first Bison says crocodile and throws a stone at the object. Nothing happens. The other Bison says, \log.\ The first Bison steps onto the object and says, \crocodile.\",7,7,"prac_segB_desc","/static/video/Prac/wildebeest_part2.mp4","{""phase"": ""description"", ""counterbalance"": 5, ""vidpath"": ""/static/video/Prac/wildebeest_part2.mp4"", ""descstop"": 1, ""vidpair"": 2, ""offset"": ""33"", ""content"": ""Two Bison stand at the edge of a waterway. Together they stare at an object in the water. One believes it to be a crocodile, while the other disagrees and believes it is a log. The first Bison says crocodile and throws a stone at the object. Nothing happens. The other Bison says, \""log.\"" The first Bison steps onto the object and says, \""crocodile.\"""", ""importance"": ""7"", ""time"": 223752, ""tag"": ""prac_segB_desc""}","description"
"336","1063",1703955236323,"8","0","practice","1","2",12,33,"one of the two wildebeast standing on the bank threw a pebble at the crcodile. no response so it poked the crocodile with a stick. again there was no response, with this the wildebeast jumped on top of the crocodile.",6,6,"prac_segB_desc","/static/video/Prac/wildebeest_part2.mp4","{""phase"": ""description"", ""counterbalance"": 0, ""vidpath"": ""/static/video/Prac/wildebeest_part2.mp4"", ""descstop"": 1, ""vidpair"": 2, ""offset"": ""33"", ""content"": ""one of the two wildebeast standing on the bank threw a pebble at the crcodile. no response so it poked the crocodile with a stick. again there was no response, with this the wildebeast jumped on top of the crocodile."", ""importance"": ""6"", ""time"": 105112, ""tag"": ""prac_segB_desc""}","description"
"343","1064",1701964276817,"8","3","practice","1","2",12,33,"Two bulls are stood together by the water and they see something close by in the water. One thinks it is a crocodile and the other thinks it is a log. One throws a stone to try and see if it is a crocodile, nothing happens, then the bull decides to stand on it, to ensure it is a floating log.",5,5,"prac_segB_desc","/static/video/Prac/wildebeest_part2.mp4","{""phase"": ""description"", ""counterbalance"": 3, ""vidpath"": ""/static/video/Prac/wildebeest_part2.mp4"", ""descstop"": 1, ""vidpair"": 2, ""offset"": ""33"", ""content"": ""Two bulls are stood together by the water and they see something close by in the water. One thinks it is a crocodile and the other thinks it is a log. One throws a stone to try and see if it is a crocodile, nothing happens, then the bull decides to stand on it, to ensure it is a floating log."", ""importance"": ""5"", ""time"": 148888, ""tag"": ""prac_segB_desc""}","description"
"349","1065",1703168228887,"8","1","practice","1","2",12,33,"Two wilderbeast are standing at the edge of a lake. They communicate with little groaning sounds. There's something floating in the water directly in front of them. One of the wilderbeast thinks it's a crocodile, the other thinks it's a log. One of the wilderbeast taps the thing with a stick and then climbs onto it. ",5,5,"prac_segB_desc","/static/video/Prac/wildebeest_part2.mp4","{""phase"": ""description"", ""counterbalance"": 1, ""vidpath"": ""/static/video/Prac/wildebeest_part2.mp4"", ""descstop"": 1, ""vidpair"": 2, ""offset"": ""33"", ""content"": ""Two wilderbeast are standing at the edge of a lake. They communicate with little groaning sounds. There's something floating in the water directly in front of them. One of the wilderbeast thinks it's a crocodile, the other thinks it's a log. One of the wilderbeast taps the thing with a stick and then climbs onto it. "", ""importance"": ""5"", ""time"": 165242, ""tag"": ""prac_segB_desc""}","description"
"356","1066",1706021603189,"8","5","practice","1","2",12,33,"The buffalos are still deciding whether the item in the river is a crocodile or a log, buffalo one throws a stone at the item, he then prods it with a stick, he splashes it before jumping onto the item.",7,7,"prac_segB_desc","/static/video/Prac/wildebeest_part2.mp4","{""phase"": ""description"", ""counterbalance"": 5, ""vidpath"": ""/static/video/Prac/wildebeest_part2.mp4"", ""descstop"": 1, ""vidpair"": 2, ""offset"": ""33"", ""content"": ""The buffalos are still deciding whether the item in the river is a crocodile or a log, buffalo one throws a stone at the item, he then prods it with a stick, he splashes it before jumping onto the item."", ""importance"": ""7"", ""time"": 82766, ""tag"": ""prac_segB_desc""}","description"
"362","1067",1712070286023,"8","2","practice","1","2",12,33,"Two buffalos are staring at what appears to be a log in the water. One buffalo thinks it's a crocodile in disguise, the other thinks it's a mere log. The buffalo that thinks it's a crocodile does everything it can to prove that it's a crocodile. The buffalo eventually stands on top of the object.",7,7,"prac_segB_desc","/static/video/Prac/wildebeest_part2.mp4","{""phase"": ""description"", ""counterbalance"": 2, ""vidpath"": ""/static/video/Prac/wildebeest_part2.mp4"", ""descstop"": 1, ""vidpair"": 2, ""offset"": ""33"", ""content"": ""Two buffalos are staring at what appears to be a log in the water. One buffalo thinks it's a crocodile in disguise, the other thinks it's a mere log. The buffalo that thinks it's a crocodile does everything it can to prove that it's a crocodile. The buffalo eventually stands on top of the object."", ""importance"": ""7"", ""time"": 100660, ""tag"": ""prac_segB_desc""}","description"
"368","1068",1712073704258,"8","1","practice","1","2",12,33,"The cows continue to debate if the object in the water is a log or a crocodile. One cow throws a rock at the object an pokes it with a stick. Then that same cow jumps on top of the object floating in the water.",7,7,"prac_segB_desc","/static/video/Prac/wildebeest_part2.mp4","{""phase"": ""description"", ""counterbalance"": 1, ""vidpath"": ""/static/video/Prac/wildebeest_part2.mp4"", ""descstop"": 1, ""vidpair"": 2, ""offset"": ""33"", ""content"": ""The cows continue to debate if the object in the water is a log or a crocodile. One cow throws a rock at the object an pokes it with a stick. Then that same cow jumps on top of the object floating in the water."", ""importance"": ""7"", ""time"": 55384, ""tag"": ""prac_segB_desc""}","description"
"375","1069",1712070163532,"8","5","practice","1","2",12,33,"The bulls were trying to decide whether the object in the water was an alligator or a log. The one bull pokes at it with a stick and then jumps onto the object.",4,4,"prac_segB_desc","/static/video/Prac/wildebeest_part2.mp4","{""phase"": ""description"", ""counterbalance"": 5, ""vidpath"": ""/static/video/Prac/wildebeest_part2.mp4"", ""descstop"": 1, ""vidpair"": 2, ""offset"": ""33"", ""content"": ""The bulls were trying to decide whether the object in the water was an alligator or a log. The one bull pokes at it with a stick and then jumps onto the object."", ""importance"": ""4"", ""time"": 52426, ""tag"": ""prac_segB_desc""}","description"
"381","1071",1713190330830,"8","2","practice","1","2",12,33,"The character/ox who thought it was a crocodile threw a stone at the thing in the water. The thing did not respond, so the other character said it was a log. The other character then insisted it was a crocodile and poked it with a stick. The thing in the water still did not respond, and the other character again said that it was a log. The first character insisted it was a crocodile again, and the began to splash the thing with water and climb on top of it. ",7,7,"prac_segB_desc","/static/video/Prac/wildebeest_part2.mp4","{""phase"": ""description"", ""counterbalance"": 2, ""vidpath"": ""/static/video/Prac/wildebeest_part2.mp4"", ""descstop"": 1, ""vidpair"": 2, ""offset"": ""33"", ""content"": ""The character/ox who thought it was a crocodile threw a stone at the thing in the water. The thing did not respond, so the other character said it was a log. The other character then insisted it was a crocodile and poked it with a stick. The thing in the water still did not respond, and the other character again said that it was a log. The first character insisted it was a crocodile again, and the began to splash the thing with water and climb on top of it. "", ""importance"": ""7"", ""time"": 186640, ""tag"": ""prac_segB_desc""}","description"
"387","1072",1714397034639,"8","8","practice","1","2",12,33,"There are 2 horned bulls standing on the side of a river. They observe something in the water, one bull insists it is a long in the water the other bull says it is a crocodile. The second bull then proceeds to throw a stone, the other bull still thinks it is a long, so the second bull then pokes the assumed crocodile but nothing happens so he jumps on it",5,5,"prac_segB_desc","/static/video/Prac/wildebeest_part2.mp4","{""phase"": ""description"", ""counterbalance"": 8, ""vidpath"": ""/static/video/Prac/wildebeest_part2.mp4"", ""descstop"": 1, ""vidpair"": 2, ""offset"": ""33"", ""content"": ""There are 2 horned bulls standing on the side of a river. They observe something in the water, one bull insists it is a long in the water the other bull says it is a crocodile. The second bull then proceeds to throw a stone, the other bull still thinks it is a long, so the second bull then pokes the assumed crocodile but nothing happens so he jumps on it"", ""importance"": ""5"", ""time"": 220787, ""tag"": ""prac_segB_desc""}","description"
"393","1074",1712070185637,"8","4","practice","1","2",12,33,"cow thinks there is a log in the water and jumps on it",5,5,"prac_segB_desc","/static/video/Prac/wildebeest_part2.mp4","{""phase"": ""description"", ""counterbalance"": 4, ""vidpath"": ""/static/video/Prac/wildebeest_part2.mp4"", ""descstop"": 1, ""vidpair"": 2, ""offset"": ""33"", ""content"": ""cow thinks there is a log in the water and jumps on it"", ""importance"": ""5"", ""time"": 38070, ""tag"": ""prac_segB_desc""}","description"
"399","1075",1713371517869,"8","6","practice","1","2",12,33,"The buffalo tried pushed and eventually stood on the object to see if it was a crocodile or a log.",5,5,"prac_segB_desc","/static/video/Prac/wildebeest_part2.mp4","{""phase"": ""description"", ""counterbalance"": 6, ""vidpath"": ""/static/video/Prac/wildebeest_part2.mp4"", ""descstop"": 1, ""vidpair"": 2, ""offset"": ""33"", ""content"": ""The buffalo tried pushed and eventually stood on the object to see if it was a crocodile or a log."", ""importance"": ""5"", ""time"": 30446, ""tag"": ""prac_segB_desc""}","description"
"405","1076",1714396850801,"8","8","practice","1","2",12,33,"One of the cows threw stones at the 'crocodile' to see if it was real.",3,3,"prac_segB_desc","/static/video/Prac/wildebeest_part2.mp4","{""phase"": ""description"", ""counterbalance"": 8, ""vidpath"": ""/static/video/Prac/wildebeest_part2.mp4"", ""descstop"": 1, ""vidpair"": 2, ""offset"": ""33"", ""content"": ""One of the cows threw stones at the 'crocodile' to see if it was real."", ""importance"": ""3"", ""time"": 61875, ""tag"": ""prac_segB_desc""}","description"
"411","1077",1702749634125,"8","7","practice","1","2",12,33,"Two Bison(or whatever animal they are) are still arguing over the object they see in the water. One thinks it is a log while the other a crocodile (Though if it is a crocodile why the hell are they standing so close). Anyway, the two bison try throwing stones, splashing water, and poking the unknown object with a stick. One Bison hops on the log/crocodile.",5,5,"prac_segB_desc","/static/video/Prac/wildebeest_part2.mp4","{""phase"": ""description"", ""counterbalance"": 7, ""vidpath"": ""/static/video/Prac/wildebeest_part2.mp4"", ""descstop"": 1, ""vidpair"": 2, ""offset"": ""33"", ""content"": ""Two Bison(or whatever animal they are) are still arguing over the object they see in the water. One thinks it is a log while the other a crocodile (Though if it is a crocodile why the hell are they standing so close). Anyway, the two bison try throwing stones, splashing water, and poking the unknown object with a stick. One Bison hops on the log/crocodile."", ""importance"": ""5"", ""time"": 168681, ""tag"": ""prac_segB_desc""}","description"
"417","1078",1701961563705,"8","4","practice","1","2",12,33,"The moose on the left keeps saying that the thing is a log but the one on the left keeps insisting that it's a crocodile. The moose on the right throws a stone at it, the thing doesn't budge. The left moose says (not literally) \see? it's a log\. The right moose is like noo it's a crocodile and pokes at it with a branch. It still doesn't move, so the right moose goes on top of the thing and starts jumping. ",5,5,"prac_segB_desc","/static/video/Prac/wildebeest_part2.mp4","{""phase"": ""description"", ""counterbalance"": 4, ""vidpath"": ""/static/video/Prac/wildebeest_part2.mp4"", ""descstop"": 1, ""vidpair"": 2, ""offset"": ""33"", ""content"": ""The moose on the left keeps saying that the thing is a log but the one on the left keeps insisting that it's a crocodile. The moose on the right throws a stone at it, the thing doesn't budge. The left moose says (not literally) \""see? it's a log\"". The right moose is like noo it's a crocodile and pokes at it with a branch. It still doesn't move, so the right moose goes on top of the thing and starts jumping. "", ""importance"": ""5"", ""time"": 147745, ""tag"": ""prac_segB_desc""}","description"
"423","1080",1713190022410,"8","1","practice","1","2",12,33,"two bulls were at a river trying to determine whether what is in front of them in the river is a log or a crocodile",5,5,"prac_segB_desc","/static/video/Prac/wildebeest_part2.mp4","{""phase"": ""description"", ""counterbalance"": 1, ""vidpath"": ""/static/video/Prac/wildebeest_part2.mp4"", ""descstop"": 1, ""vidpair"": 2, ""offset"": ""33"", ""content"": ""two bulls were at a river trying to determine whether what is in front of them in the river is a log or a crocodile"", ""importance"": ""5"", ""time"": 29382, ""tag"": ""prac_segB_desc""}","description"
"430","1081",1712153256371,"8","3","practice","1","2",12,33,"Two cows are discussing whether the object in the river is a log or a crocodile. One of the cows goes and stands on it.",5,5,"prac_segB_desc","/static/video/Prac/wildebeest_part2.mp4","{""phase"": ""description"", ""counterbalance"": 3, ""vidpath"": ""/static/video/Prac/wildebeest_part2.mp4"", ""descstop"": 1, ""vidpair"": 2, ""offset"": ""33"", ""content"": ""Two cows are discussing whether the object in the river is a log or a crocodile. One of the cows goes and stands on it."", ""importance"": ""5"", ""time"": 30101, ""tag"": ""prac_segB_desc""}","description"
"436","1083",1712071489232,"8","8","practice","1","2",12,33,"A few buffalos were standing on the edge of a lake, there was something bumpy sticking out of the water that looked to be either an alligator or a log. The buffalos were arguing about what it was, one was saying alligator the other was saying log. They flung water at it and it didnt move, poked it with a stick and everything. Eventually one buffalo went and stood on it in the water. The alligator or log never moved an inch!",4,4,"prac_segB_desc","/static/video/Prac/wildebeest_part2.mp4","{""phase"": ""description"", ""counterbalance"": 8, ""vidpath"": ""/static/video/Prac/wildebeest_part2.mp4"", ""descstop"": 1, ""vidpair"": 2, ""offset"": ""33"", ""content"": ""A few buffalos were standing on the edge of a lake, there was something bumpy sticking out of the water that looked to be either an alligator or a log. The buffalos were arguing about what it was, one was saying alligator the other was saying log. They flung water at it and it didnt move, poked it with a stick and everything. Eventually one buffalo went and stood on it in the water. The alligator or log never moved an inch!"", ""importance"": ""4"", ""time"": 104720, ""tag"": ""prac_segB_desc""}","description"
"442","1084",1712153150355,"8","3","practice","1","2",12,33,"There were two water buffalo standing near a lake. There was something in the water and they were debating about whether it was a log or a alligator. The one that thought it was an alligator then threw a rock at the thing in the water. It then proceeded to poke it with a stick and then eventually jumped on top of it.",5,5,"prac_segB_desc","/static/video/Prac/wildebeest_part2.mp4","{""phase"": ""description"", ""counterbalance"": 3, ""vidpath"": ""/static/video/Prac/wildebeest_part2.mp4"", ""descstop"": 1, ""vidpair"": 2, ""offset"": ""33"", ""content"": ""There were two water buffalo standing near a lake. There was something in the water and they were debating about whether it was a log or a alligator. The one that thought it was an alligator then threw a rock at the thing in the water. It then proceeded to poke it with a stick and then eventually jumped on top of it."", ""importance"": ""5"", ""time"": 97522, ""tag"": ""prac_segB_desc""}","description"
"448","1085",1712072608783,"12","6","practice","1","2",12,33,"There are two animals poking something in the water. They are not sure what it is. One thinks it's a log and the other thinks it might be a gator. One pokes it with a stick, throws water on it, and then steps on it. The video ends after that.",5,5,"prac_segB_desc","/static/video/Prac/wildebeest_part2.mp4","{""phase"": ""description"", ""counterbalance"": 6, ""vidpath"": ""/static/video/Prac/wildebeest_part2.mp4"", ""descstop"": 1, ""vidpair"": 2, ""offset"": ""33"", ""content"": ""There are two animals poking something in the water. They are not sure what it is. One thinks it's a log and the other thinks it might be a gator. One pokes it with a stick, throws water on it, and then steps on it. The video ends after that."", ""importance"": ""5"", ""time"": 64965, ""tag"": ""prac_segB_desc""}","description"
"454","1086",1712584993903,"8","3","practice","1","2",12,33,"two animals with horns are standing on a river bank arguing about whether an object in the water is a log or a crocodile. The one thats believes it is a crocodile first throws a stone and then prods the object with a stick before jumping onto the object",7,7,"prac_segB_desc","/static/video/Prac/wildebeest_part2.mp4","{""phase"": ""description"", ""counterbalance"": 3, ""vidpath"": ""/static/video/Prac/wildebeest_part2.mp4"", ""descstop"": 1, ""vidpair"": 2, ""offset"": ""33"", ""content"": ""two animals with horns are standing on a river bank arguing about whether an object in the water is a log or a crocodile. The one thats believes it is a crocodile first throws a stone and then prods the object with a stick before jumping onto the object"", ""importance"": ""7"", ""time"": 154379, ""tag"": ""prac_segB_desc""}","description"
"460","1087",1713190123150,"8","0","practice","1","2",12,33,"The bull throws a rock at the object floating in the water. They still debate whether the object is a log or a crocodile, so the bull then prods it and they still disagree. The bull then jumps on",6,6,"prac_segB_desc","/static/video/Prac/wildebeest_part2.mp4","{""phase"": ""description"", ""counterbalance"": 0, ""vidpath"": ""/static/video/Prac/wildebeest_part2.mp4"", ""descstop"": 1, ""vidpair"": 2, ""offset"": ""33"", ""content"": ""The bull throws a rock at the object floating in the water. They still debate whether the object is a log or a crocodile, so the bull then prods it and they still disagree. The bull then jumps on"", ""importance"": ""6"", ""time"": 53613, ""tag"": ""prac_segB_desc""}","description"
"467","1088",1703608772999,"8","4","practice","1","2",12,33,"A group of animals were on the edge of a body of water. They were staring at a floating object in the water trying to decide if it was a crocodile or a log floating. One animal thought it was a log while the other thought it was a crocodile. They poked it, splashed it, and observed it. Eventually, one of the animals hopped on it to decide.",7,7,"prac_segB_desc","/static/video/Prac/wildebeest_part2.mp4","{""phase"": ""description"", ""counterbalance"": 4, ""vidpath"": ""/static/video/Prac/wildebeest_part2.mp4"", ""descstop"": 1, ""vidpair"": 2, ""offset"": ""33"", ""content"": ""A group of animals were on the edge of a body of water. They were staring at a floating object in the water trying to decide if it was a crocodile or a log floating. One animal thought it was a log while the other thought it was a crocodile. They poked it, splashed it, and observed it. Eventually, one of the animals hopped on it to decide."", ""importance"": ""7"", ""time"": 92056, ""tag"": ""prac_segB_desc""}","description"
"473","1089",1703951462913,"8","2","practice","1","2",12,33,"The two bison(?) continued arguing about whether the thing in the water was a crocodile or a log. The bison that thought it was a crocodile threw a rock into the water to see if the croc would move. It didn't, so the same bison poked the thing with a stock. Nothing happened so the same bison splashed some water onto the thing. Again, nothing happened, so the same bison got on top of the thing in the water and pushed down on it a couple of times.",6,6,"prac_segB_desc","/static/video/Prac/wildebeest_part2.mp4","{""phase"": ""description"", ""counterbalance"": 2, ""vidpath"": ""/static/video/Prac/wildebeest_part2.mp4"", ""descstop"": 1, ""vidpair"": 2, ""offset"": ""33"", ""content"": ""The two bison(?) continued arguing about whether the thing in the water was a crocodile or a log. The bison that thought it was a crocodile threw a rock into the water to see if the croc would move. It didn't, so the same bison poked the thing with a stock. Nothing happened so the same bison splashed some water onto the thing. Again, nothing happened, so the same bison got on top of the thing in the water and pushed down on it a couple of times."", ""importance"": ""6"", ""time"": 117676, ""tag"": ""prac_segB_desc""}","description"
"479","1091",1712070565998,"8","8","practice","1","2",12,33,"The cow that thought the object in the water was a crocodile , threw a stone at the object , then poked it with a stick , splashed water at it and finally jumped in the water and onto the object. After each event this cow thought the object was a crocodile the other cow each time thought it was a log.",6,6,"prac_segB_desc","/static/video/Prac/wildebeest_part2.mp4","{""phase"": ""description"", ""counterbalance"": 8, ""vidpath"": ""/static/video/Prac/wildebeest_part2.mp4"", ""descstop"": 1, ""vidpair"": 2, ""offset"": ""33"", ""content"": ""The cow that thought the object in the water was a crocodile , threw a stone at the object , then poked it with a stick , splashed water at it and finally jumped in the water and onto the object. After each event this cow thought the object was a crocodile the other cow each time thought it was a log."", ""importance"": ""6"", ""time"": 173061, ""tag"": ""prac_segB_desc""}","description"
"485","1092",1712672409184,"8","1","practice","1","2",12,33,"The two animals continue to argue about whether the lump in the pond is an alligator or a log.  One of them throws a rock at it, pokes it with a stick, and finally jumps on top of it.",6,6,"prac_segB_desc","/static/video/Prac/wildebeest_part2.mp4","{""phase"": ""description"", ""counterbalance"": 1, ""vidpath"": ""/static/video/Prac/wildebeest_part2.mp4"", ""descstop"": 1, ""vidpair"": 2, ""offset"": ""33"", ""content"": ""The two animals continue to argue about whether the lump in the pond is an alligator or a log.  One of them throws a rock at it, pokes it with a stick, and finally jumps on top of it."", ""importance"": ""6"", ""time"": 43638, ""tag"": ""prac_segB_desc""}","description"
"492","1093",1712152497351,"8","4","practice","1","2",12,33,"both animals kept arguing the first one threw a stone at the unknown object, poked it with a stick, splashed water on it and also climbed the object",5,5,"prac_segB_desc","/static/video/Prac/wildebeest_part2.mp4","{""phase"": ""description"", ""counterbalance"": 4, ""vidpath"": ""/static/video/Prac/wildebeest_part2.mp4"", ""descstop"": 1, ""vidpair"": 2, ""offset"": ""33"", ""content"": ""both animals kept arguing the first one threw a stone at the unknown object, poked it with a stick, splashed water on it and also climbed the object"", ""importance"": ""5"", ""time"": 107441, ""tag"": ""prac_segB_desc""}","description"
"498","1095",1712073519087,"12","3","practice","1","2",12,33,"The two animals are arguing about whether the object is a log or a crocodile. The one who thinks its a crocodile decides to jump on it.",5,5,"prac_segB_desc","/static/video/Prac/wildebeest_part2.mp4","{""phase"": ""description"", ""counterbalance"": 3, ""vidpath"": ""/static/video/Prac/wildebeest_part2.mp4"", ""descstop"": 1, ""vidpair"": 2, ""offset"": ""33"", ""content"": ""The two animals are arguing about whether the object is a log or a crocodile. The one who thinks its a crocodile decides to jump on it."", ""importance"": ""5"", ""time"": 72311, ""tag"": ""prac_segB_desc""}","description"
"504","1098",1712153140734,"8","8","practice","1","2",12,33,"Two aardvarks disagree whether a lump in the water is a log or a an alligator.",7,7,"prac_segB_desc","/static/video/Prac/wildebeest_part2.mp4","{""phase"": ""description"", ""counterbalance"": 8, ""vidpath"": ""/static/video/Prac/wildebeest_part2.mp4"", ""descstop"": 1, ""vidpair"": 2, ""offset"": ""33"", ""content"": ""Two aardvarks disagree whether a lump in the water is a log or a an alligator."", ""importance"": ""7"", ""time"": 48251, ""tag"": ""prac_segB_desc""}","description"
