"","ID","Timestamp","Trial","counterbalance","phase","description_stop","paired_vid","onset","offset","description_content","importance","time","tag","vidpath","Datastring","test_trial"
"1","1000",1712770016427,"8","0","practice","1","2",12,33,"Two cows are arguing whether its a stick or a crocodile in the water.",6,6,"prac_segB_desc","/static/video/Prac/wildebeest_part2.mp4","{""phase"": ""description"", ""counterbalance"": 0, ""vidpath"": ""/static/video/Prac/wildebeest_part2.mp4"", ""descstop"": 1, ""vidpair"": 2, ""offset"": ""33"", ""content"": ""Two cows are arguing whether its a stick or a crocodile in the water."", ""importance"": ""6"", ""time"": 58307, ""tag"": ""prac_segB_desc""}","description"
"8","1001",1713191736222,"8","0","practice","1","2",12,33,"two buffalos were deciding wether what was floating in the water was a log or a crocodile. one of them then stepped on it.",6,6,"prac_segB_desc","/static/video/Prac/wildebeest_part2.mp4","{""phase"": ""description"", ""counterbalance"": 0, ""vidpath"": ""/static/video/Prac/wildebeest_part2.mp4"", ""descstop"": 1, ""vidpair"": 2, ""offset"": ""33"", ""content"": ""two buffalos were deciding wether what was floating in the water was a log or a crocodile. one of them then stepped on it."", ""importance"": ""6"", ""time"": 139833, ""tag"": ""prac_segB_desc""}","description"
"15","1002",1713886683758,"8","7","practice","1","2",12,33,"Two water buffalo are standing next to a body of water and there is an object that is floating in the water near the shoreline.  The water buffalo have a conversation about the object, one water buffalo thinks its a crocodile while the other water buffalo thinks its a log.  One water buffalo starts throwing rocks and splashing water on the object to get it to react but nothing happens.  Finally the water buffalo jumps on top of the object.",6,6,"prac_segB_desc","/static/video/Prac/wildebeest_part2.mp4","{""phase"": ""description"", ""counterbalance"": 7, ""vidpath"": ""/static/video/Prac/wildebeest_part2.mp4"", ""descstop"": 1, ""vidpair"": 2, ""offset"": ""33"", ""content"": ""Two water buffalo are standing next to a body of water and there is an object that is floating in the water near the shoreline.  The water buffalo have a conversation about the object, one water buffalo thinks its a crocodile while the other water buffalo thinks its a log.  One water buffalo starts throwing rocks and splashing water on the object to get it to react but nothing happens.  Finally the water buffalo jumps on top of the object."", ""importance"": ""6"", ""time"": 145271, ""tag"": ""prac_segB_desc""}","description"
"21","1003",1713287766427,"8","2","practice","1","2",12,33,"The two bison keep going back and forth with the one on the left saying it is an alligator, while the one on the right says log. The bison that thought it was an alligator, decided to throw a rock at the \log\, splash water at it, and also poke it with a stick. Nothing happened so it jumped on top of the \log\. ",7,7,"prac_segB_desc","/static/video/Prac/wildebeest_part2.mp4","{""phase"": ""description"", ""counterbalance"": 2, ""vidpath"": ""/static/video/Prac/wildebeest_part2.mp4"", ""descstop"": 1, ""vidpair"": 2, ""offset"": ""33"", ""content"": ""The two bison keep going back and forth with the one on the left saying it is an alligator, while the one on the right says log. The bison that thought it was an alligator, decided to throw a rock at the \""log\"", splash water at it, and also poke it with a stick. Nothing happened so it jumped on top of the \""log\"". "", ""importance"": ""7"", ""time"": 93018, ""tag"": ""prac_segB_desc""}","description"
"27","1004",1712769904332,"8","7","practice","1","2",12,33,"The cow that thought the object was a crocodile first threw a stone at the object, but the object didn't respond. The other cow still thinks it is a log. The first cow then jumps on to the object, but the object still does not respond.",6,6,"prac_segB_desc","/static/video/Prac/wildebeest_part2.mp4","{""phase"": ""description"", ""counterbalance"": 7, ""vidpath"": ""/static/video/Prac/wildebeest_part2.mp4"", ""descstop"": 1, ""vidpair"": 2, ""offset"": ""33"", ""content"": ""The cow that thought the object was a crocodile first threw a stone at the object, but the object didn't respond. The other cow still thinks it is a log. The first cow then jumps on to the object, but the object still does not respond."", ""importance"": ""6"", ""time"": 167427, ""tag"": ""prac_segB_desc""}","description"
"33","1005",1713192887672,"8","4","practice","1","2",12,33,"The cow who thinks the thing in the water is a crocodile throws a rock at it.  The object doesn't move so the other cow says it's a log.  The first cow insists it's a crocodile and pokes it with a stick.  it still doesn't move so the second cow reiterates that it's a log. The first cow then jumps onto the object.",5,5,"prac_segB_desc","/static/video/Prac/wildebeest_part2.mp4","{""phase"": ""description"", ""counterbalance"": 4, ""vidpath"": ""/static/video/Prac/wildebeest_part2.mp4"", ""descstop"": 1, ""vidpair"": 2, ""offset"": ""33"", ""content"": ""The cow who thinks the thing in the water is a crocodile throws a rock at it.  The object doesn't move so the other cow says it's a log.  The first cow insists it's a crocodile and pokes it with a stick.  it still doesn't move so the second cow reiterates that it's a log. The first cow then jumps onto the object."", ""importance"": ""5"", ""time"": 107407, ""tag"": ""prac_segB_desc""}","description"
"39","1006",1714489814383,"8","5","practice","1","2",12,33,"One of the two bull cows on the edge of the water pokes the hump in the water with a stick, but it doesn't move. The bubble over the other cow's head shows that he thinks it's still a chunk of wood. The first bull cow then splashes water on it. Again, it doesn't move and then it jumps up on the hump and stands there staring down at it.",6,6,"prac_segB_desc","/static/video/Prac/wildebeest_part2.mp4","{""phase"": ""description"", ""counterbalance"": 5, ""vidpath"": ""/static/video/Prac/wildebeest_part2.mp4"", ""descstop"": 1, ""vidpair"": 2, ""offset"": ""33"", ""content"": ""One of the two bull cows on the edge of the water pokes the hump in the water with a stick, but it doesn't move. The bubble over the other cow's head shows that he thinks it's still a chunk of wood. The first bull cow then splashes water on it. Again, it doesn't move and then it jumps up on the hump and stands there staring down at it."", ""importance"": ""6"", ""time"": 212973, ""tag"": ""prac_segB_desc""}","description"
"45","1007",1713190152550,"8","5","practice","1","2",12,33,"the two moose are still trying to figure out if the 'thing' in the water is a crocodile or a log.  The moose on the left throws a stone at it and nothing happens.  He then picks up a stick and starts poking it with it.  There is no movement so they are both starting to think it could be a log.  One of them then jumps on top of the 'thing'",6,6,"prac_segB_desc","/static/video/Prac/wildebeest_part2.mp4","{""phase"": ""description"", ""counterbalance"": 5, ""vidpath"": ""/static/video/Prac/wildebeest_part2.mp4"", ""descstop"": 1, ""vidpair"": 2, ""offset"": ""33"", ""content"": ""the two moose are still trying to figure out if the 'thing' in the water is a crocodile or a log.  The moose on the left throws a stone at it and nothing happens.  He then picks up a stick and starts poking it with it.  There is no movement so they are both starting to think it could be a log.  One of them then jumps on top of the 'thing'"", ""importance"": ""6"", ""time"": 124927, ""tag"": ""prac_segB_desc""}","description"
"51","1008",1713190096345,"8","2","practice","1","2",12,33,"The two bison on the bank of the river. One thinks the thing in the water is a log and the other thinks it is a crocodile. One bison throws a stone at it then pokes it with a stick to see which one it is. Nothing happens to the object in the water suggesting that it is a log. ",5,5,"prac_segB_desc","/static/video/Prac/wildebeest_part2.mp4","{""phase"": ""description"", ""counterbalance"": 2, ""vidpath"": ""/static/video/Prac/wildebeest_part2.mp4"", ""descstop"": 1, ""vidpair"": 2, ""offset"": ""33"", ""content"": ""The two bison on the bank of the river. One thinks the thing in the water is a log and the other thinks it is a crocodile. One bison throws a stone at it then pokes it with a stick to see which one it is. Nothing happens to the object in the water suggesting that it is a log. "", ""importance"": ""5"", ""time"": 86527, ""tag"": ""prac_segB_desc""}","description"
"57","1009",1713190270328,"8","2","practice","1","2",12,33,"The moose in the back still thinks it's a crocodile and the moose in the front still thinks that it's a log. So to prove it, the moose in the back begins to poke, splash, and throw a rock at the object in the water. After it still does not move the moose in the back then jumps on top of it.",6,6,"prac_segB_desc","/static/video/Prac/wildebeest_part2.mp4","{""phase"": ""description"", ""counterbalance"": 2, ""vidpath"": ""/static/video/Prac/wildebeest_part2.mp4"", ""descstop"": 1, ""vidpair"": 2, ""offset"": ""33"", ""content"": ""The moose in the back still thinks it's a crocodile and the moose in the front still thinks that it's a log. So to prove it, the moose in the back begins to poke, splash, and throw a rock at the object in the water. After it still does not move the moose in the back then jumps on top of it."", ""importance"": ""6"", ""time"": 59590, ""tag"": ""prac_segB_desc""}","description"
"63","1010",1713359846265,"8","0","practice","1","2",12,33,"The buffalo that thinks the object in the lake is a crocodile throws a stone at it. He then pokes it with a stick and then jumps onto it. The other buffalo maintains all along that the object is a floating log.9",6,6,"prac_segB_desc","/static/video/Prac/wildebeest_part2.mp4","{""phase"": ""description"", ""counterbalance"": 0, ""vidpath"": ""/static/video/Prac/wildebeest_part2.mp4"", ""descstop"": 1, ""vidpair"": 2, ""offset"": ""33"", ""content"": ""The buffalo that thinks the object in the lake is a crocodile throws a stone at it. He then pokes it with a stick and then jumps onto it. The other buffalo maintains all along that the object is a floating log.9"", ""importance"": ""6"", ""time"": 68611, ""tag"": ""prac_segB_desc""}","description"
"70","1011",1698331735647,"8","7","practice","1","2",12,33,"The two bulls are standing by the river, they are arguing about if the object in the river is a crocodile or a log. They've been poking it and throwing stones to try and decide which one it is. Now one of the bulls has jumped ontop of it.",4,4,"prac_segB_desc","/static/video/Prac/wildebeest_part2.mp4","{""phase"": ""description"", ""counterbalance"": 7, ""vidpath"": ""/static/video/Prac/wildebeest_part2.mp4"", ""descstop"": 1, ""vidpair"": 2, ""offset"": ""33"", ""content"": ""The two bulls are standing by the river, they are arguing about if the object in the river is a crocodile or a log. They've been poking it and throwing stones to try and decide which one it is. Now one of the bulls has jumped ontop of it."", ""importance"": ""4"", ""time"": 55744, ""tag"": ""prac_segB_desc""}","description"
"76","1012",1698331771718,"8","6","practice","1","2",12,33,"Two animals with horns are at the water's edge and there is an object in the water. One of the animals is convinced it is an alligator, while the other thinks its just a log. They are both trying to convince the other. One of the animals - the one who thinks its an alligator - pokes the object with a stick and splashes water at it to try and reveal what it is. When it did nothing, it jumped on top of the object.",5,5,"prac_segB_desc","/static/video/Prac/wildebeest_part2.mp4","{""phase"": ""description"", ""counterbalance"": 6, ""vidpath"": ""/static/video/Prac/wildebeest_part2.mp4"", ""descstop"": 1, ""vidpair"": 2, ""offset"": ""33"", ""content"": ""Two animals with horns are at the water's edge and there is an object in the water. One of the animals is convinced it is an alligator, while the other thinks its just a log. They are both trying to convince the other. One of the animals - the one who thinks its an alligator - pokes the object with a stick and splashes water at it to try and reveal what it is. When it did nothing, it jumped on top of the object."", ""importance"": ""5"", ""time"": 92891, ""tag"": ""prac_segB_desc""}","description"
"82","1013",1698251681885,"8","1","practice","1","2",12,33,"Two bulls are trying to decide if a floating object is an alligator or a piece of wood. One bull starts poking the object and it doesn't move. So he jumps onto the object.",5,5,"prac_segB_desc","/static/video/Prac/wildebeest_part2.mp4","{""phase"": ""description"", ""counterbalance"": 1, ""vidpath"": ""/static/video/Prac/wildebeest_part2.mp4"", ""descstop"": 1, ""vidpair"": 2, ""offset"": ""33"", ""content"": ""Two bulls are trying to decide if a floating object is an alligator or a piece of wood. One bull starts poking the object and it doesn't move. So he jumps onto the object."", ""importance"": ""5"", ""time"": 53812, ""tag"": ""prac_segB_desc""}","description"
"89","1015",1713359922210,"8","0","practice","1","2",12,33,"The buffalo were deliberating if the thing that they could see in the water was a piece of wood or an allegator. They prodded it and one jumped onto the thing to closer inspect it, putting itself in potential danger.",7,7,"prac_segB_desc","/static/video/Prac/wildebeest_part2.mp4","{""phase"": ""description"", ""counterbalance"": 0, ""vidpath"": ""/static/video/Prac/wildebeest_part2.mp4"", ""descstop"": 1, ""vidpair"": 2, ""offset"": ""33"", ""content"": ""The buffalo were deliberating if the thing that they could see in the water was a piece of wood or an allegator. They prodded it and one jumped onto the thing to closer inspect it, putting itself in potential danger."", ""importance"": ""7"", ""time"": 112282, ""tag"": ""prac_segB_desc""}","description"
"96","1018",1713359905818,"8","0","practice","1","2",12,33,"the two buffalo continue to debate if the object in the water is a log or a crocodile ,one of the buffolos begins to throw a stone at the object and then touch it with a stick,he then steps onto the object",5,5,"prac_segB_desc","/static/video/Prac/wildebeest_part2.mp4","{""phase"": ""description"", ""counterbalance"": 0, ""vidpath"": ""/static/video/Prac/wildebeest_part2.mp4"", ""descstop"": 1, ""vidpair"": 2, ""offset"": ""33"", ""content"": ""the two buffalo continue to debate if the object in the water is a log or a crocodile ,one of the buffolos begins to throw a stone at the object and then touch it with a stick,he then steps onto the object"", ""importance"": ""5"", ""time"": 104698, ""tag"": ""prac_segB_desc""}","description"
"103","1019",1713190445136,"12","8","practice","1","2",12,33,"Wildebeest are standing beside water, looking at an object in the water cautiously. One Wildebeest suggests that it is a crocodile, but the other believes it to be a log. They throw a stick to see if there is a reaction, but there isn't. One gingerly sets foot on the object, then steps on. It is a rock.",5,5,"prac_segB_desc","/static/video/Prac/wildebeest_part2.mp4","{""phase"": ""description"", ""counterbalance"": 8, ""vidpath"": ""/static/video/Prac/wildebeest_part2.mp4"", ""descstop"": 1, ""vidpair"": 2, ""offset"": ""33"", ""content"": ""Wildebeest are standing beside water, looking at an object in the water cautiously. One Wildebeest suggests that it is a crocodile, but the other believes it to be a log. They throw a stick to see if there is a reaction, but there isn't. One gingerly sets foot on the object, then steps on. It is a rock."", ""importance"": ""5"", ""time"": 176307, ""tag"": ""prac_segB_desc""}","description"
"109","1021",1703951675080,"8","2","practice","1","2",12,33,"The wildebeest still disagree over whether its a log or crocodile.  The first wildebeest throws a stone at the log, nothing happens.  The first wildebeest then pokes the log with a stick, nothing happens.  The second wildebeest says 'it's a log'.  The first wildebeest jumps onto the log.",5,5,"prac_segB_desc","/static/video/Prac/wildebeest_part2.mp4","{""phase"": ""description"", ""counterbalance"": 2, ""vidpath"": ""/static/video/Prac/wildebeest_part2.mp4"", ""descstop"": 1, ""vidpair"": 2, ""offset"": ""33"", ""content"": ""The wildebeest still disagree over whether its a log or crocodile.  The first wildebeest throws a stone at the log, nothing happens.  The first wildebeest then pokes the log with a stick, nothing happens.  The second wildebeest says 'it's a log'.  The first wildebeest jumps onto the log."", ""importance"": ""5"", ""time"": 115038, ""tag"": ""prac_segB_desc""}","description"
"115","1022",1701964186589,"8","4","practice","1","2",12,33,"Two water buffaloes were considering crossing a river and to see if there was a log or a Nile croc hit it with a stone and stick then one of the buffaloes jumped on the \log\.",5,5,"prac_segB_desc","/static/video/Prac/wildebeest_part2.mp4","{""phase"": ""description"", ""counterbalance"": 4, ""vidpath"": ""/static/video/Prac/wildebeest_part2.mp4"", ""descstop"": 1, ""vidpair"": 2, ""offset"": ""33"", ""content"": ""Two water buffaloes were considering crossing a river and to see if there was a log or a Nile croc hit it with a stone and stick then one of the buffaloes jumped on the \""log\""."", ""importance"": ""5"", ""time"": 80062, ""tag"": ""prac_segB_desc""}","description"
"121","1023",1713190185733,"8","0","practice","1","2",12,33,"the buffalo were having an argument about whether it was a log or a crocodile in the river. One buffalo threw a stone at it, then hit it with a stick. It never moved so they climbed on top of it ",5,5,"prac_segB_desc","/static/video/Prac/wildebeest_part2.mp4","{""phase"": ""description"", ""counterbalance"": 0, ""vidpath"": ""/static/video/Prac/wildebeest_part2.mp4"", ""descstop"": 1, ""vidpair"": 2, ""offset"": ""33"", ""content"": ""the buffalo were having an argument about whether it was a log or a crocodile in the river. One buffalo threw a stone at it, then hit it with a stick. It never moved so they climbed on top of it "", ""importance"": ""5"", ""time"": 110181, ""tag"": ""prac_segB_desc""}","description"
"128","1024",1713359969445,"8","0","practice","1","2",12,33,"They continued arguing -- it's an alligator, no it's a log. The alligator proponent tossed a stone at it; nothing happened. He tapped it with a stick; nothing happened. He splashed water at it, and nothing happened. Then he stepped on it. ",4,4,"prac_segB_desc","/static/video/Prac/wildebeest_part2.mp4","{""phase"": ""description"", ""counterbalance"": 0, ""vidpath"": ""/static/video/Prac/wildebeest_part2.mp4"", ""descstop"": 1, ""vidpair"": 2, ""offset"": ""33"", ""content"": ""They continued arguing -- it's an alligator, no it's a log. The alligator proponent tossed a stone at it; nothing happened. He tapped it with a stick; nothing happened. He splashed water at it, and nothing happened. Then he stepped on it. "", ""importance"": ""4"", ""time"": 85648, ""tag"": ""prac_segB_desc""}","description"
"135","1025",1713369705432,"8","1","practice","1","2",12,33,"The two cows were at the side of the water, deciding how to test if the thing in the water was an alligator or a branch. The cow on the left poked it with a stick and fell into the water. ",6,6,"prac_segB_desc","/static/video/Prac/wildebeest_part2.mp4","{""phase"": ""description"", ""counterbalance"": 1, ""vidpath"": ""/static/video/Prac/wildebeest_part2.mp4"", ""descstop"": 1, ""vidpair"": 2, ""offset"": ""33"", ""content"": ""The two cows were at the side of the water, deciding how to test if the thing in the water was an alligator or a branch. The cow on the left poked it with a stick and fell into the water. "", ""importance"": ""6"", ""time"": 42747, ""tag"": ""prac_segB_desc""}","description"
"142","1026",1713190117248,"8","5","practice","1","2",12,33,"The two wilder beast are having a disagreement on whether the item floating on the water is a log, or a crocodile. One wilder beast throws a rock at it, nothing happens. The other wilder beast then pokes it with a stick, nothing happens. Finally the first wilder beast jumps on top of hte floating item, then the clip ends ",5,5,"prac_segB_desc","/static/video/Prac/wildebeest_part2.mp4","{""phase"": ""description"", ""counterbalance"": 5, ""vidpath"": ""/static/video/Prac/wildebeest_part2.mp4"", ""descstop"": 1, ""vidpair"": 2, ""offset"": ""33"", ""content"": ""The two wilder beast are having a disagreement on whether the item floating on the water is a log, or a crocodile. One wilder beast throws a rock at it, nothing happens. The other wilder beast then pokes it with a stick, nothing happens. Finally the first wilder beast jumps on top of hte floating item, then the clip ends "", ""importance"": ""5"", ""time"": 107055, ""tag"": ""prac_segB_desc""}","description"
"148","1027",1713359919490,"8","0","practice","1","2",12,33,"The two buffalo that were debating whether the identified object in the water is an alligator/crocodile or just a rock continue to argue. The one that thinks it is an animal pokes the object with a twig. It does not react and both buffalo state they still believe they are right. The buffalo that poked the object moves to stand on it.",5,5,"prac_segB_desc","/static/video/Prac/wildebeest_part2.mp4","{""phase"": ""description"", ""counterbalance"": 0, ""vidpath"": ""/static/video/Prac/wildebeest_part2.mp4"", ""descstop"": 1, ""vidpair"": 2, ""offset"": ""33"", ""content"": ""The two buffalo that were debating whether the identified object in the water is an alligator/crocodile or just a rock continue to argue. The one that thinks it is an animal pokes the object with a twig. It does not react and both buffalo state they still believe they are right. The buffalo that poked the object moves to stand on it."", ""importance"": ""5"", ""time"": 82580, ""tag"": ""prac_segB_desc""}","description"
"155","1028",1714490002459,"8","5","practice","1","2",12,33,"There are two cows standing by the water. They notice an alligator or a log. They don't know which one it is. They decide to throw a rock to see if its an alligator. They then poke it with a stick. Finally one jumps on its back. There was no response from any of the attempts.",6,6,"prac_segB_desc","/static/video/Prac/wildebeest_part2.mp4","{""phase"": ""description"", ""counterbalance"": 5, ""vidpath"": ""/static/video/Prac/wildebeest_part2.mp4"", ""descstop"": 1, ""vidpair"": 2, ""offset"": ""33"", ""content"": ""There are two cows standing by the water. They notice an alligator or a log. They don't know which one it is. They decide to throw a rock to see if its an alligator. They then poke it with a stick. Finally one jumps on its back. There was no response from any of the attempts."", ""importance"": ""6"", ""time"": 160177, ""tag"": ""prac_segB_desc""}","description"
"161","1030",1713371535830,"8","6","practice","1","2",12,33,"The two characters continued to argue over whether the object in the water was a crocodile or a log. The character who thinks the object is a crocodile threw a rock at it, then poked it with a stick, then splashed water on it. Nothing happens. The other character remained adamant that the object is a log. The first character then jumps on the object. ",5,5,"prac_segB_desc","/static/video/Prac/wildebeest_part2.mp4","{""phase"": ""description"", ""counterbalance"": 6, ""vidpath"": ""/static/video/Prac/wildebeest_part2.mp4"", ""descstop"": 1, ""vidpair"": 2, ""offset"": ""33"", ""content"": ""The two characters continued to argue over whether the object in the water was a crocodile or a log. The character who thinks the object is a crocodile threw a rock at it, then poked it with a stick, then splashed water on it. Nothing happens. The other character remained adamant that the object is a log. The first character then jumps on the object. "", ""importance"": ""5"", ""time"": 122945, ""tag"": ""prac_segB_desc""}","description"
"167","1031",1713190076808,"8","3","practice","1","2",12,33,"The two animals are still arguing if the object in the water is a crocodile or a log. The one who thinks it is a crocodile throws a rock at it but it does not move. The same animal then pokes it with a stick but it still does not move. The two continue to disagree over what it is. The one who thinks it is a crocodile splashes it with water and then stands on top of it",5,5,"prac_segB_desc","/static/video/Prac/wildebeest_part2.mp4","{""phase"": ""description"", ""counterbalance"": 3, ""vidpath"": ""/static/video/Prac/wildebeest_part2.mp4"", ""descstop"": 1, ""vidpair"": 2, ""offset"": ""33"", ""content"": ""The two animals are still arguing if the object in the water is a crocodile or a log. The one who thinks it is a crocodile throws a rock at it but it does not move. The same animal then pokes it with a stick but it still does not move. The two continue to disagree over what it is. The one who thinks it is a crocodile splashes it with water and then stands on top of it"", ""importance"": ""5"", ""time"": 58924, ""tag"": ""prac_segB_desc""}","description"
