"","ID","Timestamp","Trial","counterbalance","phase","description_stop","paired_vid","onset","offset","description_content","importance","time","tag","vidpath","Datastring","test_trial"
"843","1164",1713190170238,"8","4","practice","1","2",12,33,"The buffalo reach the shore and wonder how they can safely cross to the island when there are crocodiles around. they think about using a log as a boat but then prod the island with a stick to make sure its solid and not floating. Once satisfied they make the leap to the island safely.",5,5,"prac_segB_desc","/static/video/Prac/wildebeest_part2.mp4","{""phase"": ""description"", ""counterbalance"": 4, ""vidpath"": ""/static/video/Prac/wildebeest_part2.mp4"", ""descstop"": 1, ""vidpair"": 2, ""offset"": ""33"", ""content"": ""The buffalo reach the shore and wonder how they can safely cross to the island when there are crocodiles around. they think about using a log as a boat but then prod the island with a stick to make sure its solid and not floating. Once satisfied they make the leap to the island safely."", ""importance"": ""5"", ""time"": 114018, ""tag"": ""prac_segB_desc""}","description"
"849","1165",1712758878992,"8","8","practice","1","2",12,33,"The two wildebeest keep \arguing\ about whether or not the thing in the water is a crocodile or a log. One of the wildebeest throws a rock to prove its a crocodile, nothing happens. So then they try to poke at the unknown object with a stick, nothing happens. After that one of the wildebeest jumps on top of the unknown object.",6,6,"prac_segB_desc","/static/video/Prac/wildebeest_part2.mp4","{""phase"": ""description"", ""counterbalance"": 8, ""vidpath"": ""/static/video/Prac/wildebeest_part2.mp4"", ""descstop"": 1, ""vidpair"": 2, ""offset"": ""33"", ""content"": ""The two wildebeest keep \""arguing\"" about whether or not the thing in the water is a crocodile or a log. One of the wildebeest throws a rock to prove its a crocodile, nothing happens. So then they try to poke at the unknown object with a stick, nothing happens. After that one of the wildebeest jumps on top of the unknown object."", ""importance"": ""6"", ""time"": 160885, ""tag"": ""prac_segB_desc""}","description"
"855","1166",1712674330304,"8","5","practice","1","2",12,33,"Two buffalo are standing at the edge of some water.  There is a shape in the water, and the buffalo are disagreeing whether it is a log or an alligator.  They throw a rock at it, but it doesn't move.  Next, they throw a stick at it.  Still no movement.  Finally, one of the buffalo steps on top of it.  No movement, then the clip ends.",6,6,"prac_segB_desc","/static/video/Prac/wildebeest_part2.mp4","{""phase"": ""description"", ""counterbalance"": 5, ""vidpath"": ""/static/video/Prac/wildebeest_part2.mp4"", ""descstop"": 1, ""vidpair"": 2, ""offset"": ""33"", ""content"": ""Two buffalo are standing at the edge of some water.  There is a shape in the water, and the buffalo are disagreeing whether it is a log or an alligator.  They throw a rock at it, but it doesn't move.  Next, they throw a stick at it.  Still no movement.  Finally, one of the buffalo steps on top of it.  No movement, then the clip ends."", ""importance"": ""6"", ""time"": 71626, ""tag"": ""prac_segB_desc""}","description"
"861","1168",1714406558286,"12","4","practice","1","2",12,33,"There were two buffalos standing next to the edge of water, debating on what they were seeing in the water. One thought it was a crocodile and the other thought it was a log. The one who thought it was a crocodile kept trying to entice it in order to prove to the other buffalo that it was in fact a crocodile. The thing in the water did not move despite the buffalos attempts which had the other buffalo even more convinced that it was indeed a log. Eventually the one who thought it was a crocodile climbed onto the thing in the water. ",6,6,"prac_segB_desc","/static/video/Prac/wildebeest_part2.mp4","{""phase"": ""description"", ""counterbalance"": 4, ""vidpath"": ""/static/video/Prac/wildebeest_part2.mp4"", ""descstop"": 1, ""vidpair"": 2, ""offset"": ""33"", ""content"": ""There were two buffalos standing next to the edge of water, debating on what they were seeing in the water. One thought it was a crocodile and the other thought it was a log. The one who thought it was a crocodile kept trying to entice it in order to prove to the other buffalo that it was in fact a crocodile. The thing in the water did not move despite the buffalos attempts which had the other buffalo even more convinced that it was indeed a log. Eventually the one who thought it was a crocodile climbed onto the thing in the water. "", ""importance"": ""6"", ""time"": 280759, ""tag"": ""prac_segB_desc""}","description"
"867","1169",1712672596675,"8","2","practice","1","2",12,33,"The cows keep arguing about whether it is a log or a crocodile. The cow on the left pokes and prods the object with a stone and then a stick. Then it climbed on top of it, which is where it is standing now.",6,6,"prac_segB_desc","/static/video/Prac/wildebeest_part2.mp4","{""phase"": ""description"", ""counterbalance"": 2, ""vidpath"": ""/static/video/Prac/wildebeest_part2.mp4"", ""descstop"": 1, ""vidpair"": 2, ""offset"": ""33"", ""content"": ""The cows keep arguing about whether it is a log or a crocodile. The cow on the left pokes and prods the object with a stone and then a stick. Then it climbed on top of it, which is where it is standing now."", ""importance"": ""6"", ""time"": 56934, ""tag"": ""prac_segB_desc""}","description"
"873","1170",1701961438596,"8","0","practice","1","2",12,33,"The animals continued to argue over if it was a log or a croc, one of them then proceeded to hit it with a rock,  poke it with a stick, spalsh water on it until it decided to jump onto whatever the object was ",5,5,"prac_segB_desc","/static/video/Prac/wildebeest_part2.mp4","{""phase"": ""description"", ""counterbalance"": 0, ""vidpath"": ""/static/video/Prac/wildebeest_part2.mp4"", ""descstop"": 1, ""vidpair"": 2, ""offset"": ""33"", ""content"": ""The animals continued to argue over if it was a log or a croc, one of them then proceeded to hit it with a rock,  poke it with a stick, spalsh water on it until it decided to jump onto whatever the object was "", ""importance"": ""5"", ""time"": 69264, ""tag"": ""prac_segB_desc""}","description"
"880","1171",1713190555902,"8","5","practice","1","2",12,33,"the animal on the left thought the thing in the water was a log but the animal on the right thought is was a crocodile. the one on the right poked it with a stick ,then splashed a little water on to it and nothing happened so the animal jumped onto the object and got eaten up ",7,7,"prac_segB_desc","/static/video/Prac/wildebeest_part2.mp4","{""phase"": ""description"", ""counterbalance"": 5, ""vidpath"": ""/static/video/Prac/wildebeest_part2.mp4"", ""descstop"": 1, ""vidpair"": 2, ""offset"": ""33"", ""content"": ""the animal on the left thought the thing in the water was a log but the animal on the right thought is was a crocodile. the one on the right poked it with a stick ,then splashed a little water on to it and nothing happened so the animal jumped onto the object and got eaten up "", ""importance"": ""7"", ""time"": 126590, ""tag"": ""prac_segB_desc""}","description"
"886","1172",1714406433816,"8","4","practice","1","2",12,33,"There are two cows on a river bank. They are trying to decide if the object in the river is a rock or a crocodile. The cow on the left thinks it's a crocodile and the one on the right things that it is a rock. The cow on the left pokes the object with a stick, splashes water on it, and then proceeds to jump onto it.",6,6,"prac_segB_desc","/static/video/Prac/wildebeest_part2.mp4","{""phase"": ""description"", ""counterbalance"": 4, ""vidpath"": ""/static/video/Prac/wildebeest_part2.mp4"", ""descstop"": 1, ""vidpair"": 2, ""offset"": ""33"", ""content"": ""There are two cows on a river bank. They are trying to decide if the object in the river is a rock or a crocodile. The cow on the left thinks it's a crocodile and the one on the right things that it is a rock. The cow on the left pokes the object with a stick, splashes water on it, and then proceeds to jump onto it."", ""importance"": ""6"", ""time"": 92096, ""tag"": ""prac_segB_desc""}","description"
"892","1174",1713797768365,"8","7","practice","1","2",12,33,"two wildebeest are trying to decide if something laying/floating in the water is either a log or a crocodile. The go back and forth between each other trying to decide. One pokes at it and splashes water on it, then finally jumps on top of it.",7,7,"prac_segB_desc","/static/video/Prac/wildebeest_part2.mp4","{""phase"": ""description"", ""counterbalance"": 7, ""vidpath"": ""/static/video/Prac/wildebeest_part2.mp4"", ""descstop"": 1, ""vidpair"": 2, ""offset"": ""33"", ""content"": ""two wildebeest are trying to decide if something laying/floating in the water is either a log or a crocodile. The go back and forth between each other trying to decide. One pokes at it and splashes water on it, then finally jumps on top of it."", ""importance"": ""7"", ""time"": 157972, ""tag"": ""prac_segB_desc""}","description"
"898","1175",1713364702323,"8","1","practice","1","2",12,33,"the two bulls are still staring at the object in the water. the one bull keeps thinking that its a log, the other bull keeps thinking that its an alligator. they go back and forth like this a few times. one of the bulls splashes water on the object and pokes it with a stick. nothing happens to the object. the bull then stands on the object that is in the water and nothing happens",6,6,"prac_segB_desc","/static/video/Prac/wildebeest_part2.mp4","{""phase"": ""description"", ""counterbalance"": 1, ""vidpath"": ""/static/video/Prac/wildebeest_part2.mp4"", ""descstop"": 1, ""vidpair"": 2, ""offset"": ""33"", ""content"": ""the two bulls are still staring at the object in the water. the one bull keeps thinking that its a log, the other bull keeps thinking that its an alligator. they go back and forth like this a few times. one of the bulls splashes water on the object and pokes it with a stick. nothing happens to the object. the bull then stands on the object that is in the water and nothing happens"", ""importance"": ""6"", ""time"": 121411, ""tag"": ""prac_segB_desc""}","description"
"905","1176",1714407071562,"8","4","practice","1","2",12,33,"There are two animals to the side on a island, that have horns. There's a thing in the nearby water. The two animals are debating if the thing in the water is an alligator or a log. One of the animals does multiple things to get the thing in the water, like throwing a rock, poking it with a stick and splashing water on it. The two animals go back and forth about what the thing is. Finally one of the animals, just gets on it after insisting its an alligator. ",6,6,"prac_segB_desc","/static/video/Prac/wildebeest_part2.mp4","{""phase"": ""description"", ""counterbalance"": 4, ""vidpath"": ""/static/video/Prac/wildebeest_part2.mp4"", ""descstop"": 1, ""vidpair"": 2, ""offset"": ""33"", ""content"": ""There are two animals to the side on a island, that have horns. There's a thing in the nearby water. The two animals are debating if the thing in the water is an alligator or a log. One of the animals does multiple things to get the thing in the water, like throwing a rock, poking it with a stick and splashing water on it. The two animals go back and forth about what the thing is. Finally one of the animals, just gets on it after insisting its an alligator. "", ""importance"": ""6"", ""time"": 201607, ""tag"": ""prac_segB_desc""}","description"
"911","1177",1713364996751,"8","1","practice","1","2",12,33,"The two bulls tried to be sure it was a crocodile, so they threw a rock at it, poked it with a stick, splashed some water on it and as they still got no reaction one of the bulls jumped on what they thought was a crocodile.",6,6,"prac_segB_desc","/static/video/Prac/wildebeest_part2.mp4","{""phase"": ""description"", ""counterbalance"": 1, ""vidpath"": ""/static/video/Prac/wildebeest_part2.mp4"", ""descstop"": 1, ""vidpair"": 2, ""offset"": ""33"", ""content"": ""The two bulls tried to be sure it was a crocodile, so they threw a rock at it, poked it with a stick, splashed some water on it and as they still got no reaction one of the bulls jumped on what they thought was a crocodile."", ""importance"": ""6"", ""time"": 79483, ""tag"": ""prac_segB_desc""}","description"
"918","1178",1713799072618,"8","7","practice","1","2",12,33,"The two animals argued over if the object was a gator or a branch. One decided to throw stones at it, then moved across and stood on it.",5,5,"prac_segB_desc","/static/video/Prac/wildebeest_part2.mp4","{""phase"": ""description"", ""counterbalance"": 7, ""vidpath"": ""/static/video/Prac/wildebeest_part2.mp4"", ""descstop"": 1, ""vidpair"": 2, ""offset"": ""33"", ""content"": ""The two animals argued over if the object was a gator or a branch. One decided to throw stones at it, then moved across and stood on it."", ""importance"": ""5"", ""time"": 32723, ""tag"": ""prac_segB_desc""}","description"
"924","1180",1713190388784,"8","3","practice","1","2",12,33,"Two bulls are trying to determine whether a submerged object is a log or a crocodile.One thinks it is a log and the other a crocodille.",6,6,"prac_segB_desc","/static/video/Prac/wildebeest_part2.mp4","{""phase"": ""description"", ""counterbalance"": 3, ""vidpath"": ""/static/video/Prac/wildebeest_part2.mp4"", ""descstop"": 1, ""vidpair"": 2, ""offset"": ""33"", ""content"": ""Two bulls are trying to determine whether a submerged object is a log or a crocodile.One thinks it is a log and the other a crocodille."", ""importance"": ""6"", ""time"": 63197, ""tag"": ""prac_segB_desc""}","description"
"930","1181",1713191142921,"8","5","practice","1","2",12,33,"There are two cow beside the river male and female, the male cow is triyng to explain the object in the water is a crocodile while the female cow insist it is a log of wood,the male did four experiment to show that the object in the river is a crocodile one by throwing a stone,two by touch with a stick,by splashing water and lastly by jumping on the crocodile.",7,7,"prac_segB_desc","/static/video/Prac/wildebeest_part2.mp4","{""phase"": ""description"", ""counterbalance"": 5, ""vidpath"": ""/static/video/Prac/wildebeest_part2.mp4"", ""descstop"": 1, ""vidpair"": 2, ""offset"": ""33"", ""content"": ""There are two cow beside the river male and female, the male cow is triyng to explain the object in the water is a crocodile while the female cow insist it is a log of wood,the male did four experiment to show that the object in the river is a crocodile one by throwing a stone,two by touch with a stick,by splashing water and lastly by jumping on the crocodile."", ""importance"": ""7"", ""time"": 259985, ""tag"": ""prac_segB_desc""}","description"
"936","1182",1713798462226,"8","7","practice","1","2",12,33,"2 water buffalo are standing by a body of water. One of the buffalos thinks that the lump in the water is a crocodile, but the other buffalo thinks it is just a log. They are talking to each other disagreeing about what it really is. One of the buffalos splashes water on the lump, then pokes it with a stick, and then jumps on the lump and nothing happens. ",6,6,"prac_segB_desc","/static/video/Prac/wildebeest_part2.mp4","{""phase"": ""description"", ""counterbalance"": 7, ""vidpath"": ""/static/video/Prac/wildebeest_part2.mp4"", ""descstop"": 1, ""vidpair"": 2, ""offset"": ""33"", ""content"": ""2 water buffalo are standing by a body of water. One of the buffalos thinks that the lump in the water is a crocodile, but the other buffalo thinks it is just a log. They are talking to each other disagreeing about what it really is. One of the buffalos splashes water on the lump, then pokes it with a stick, and then jumps on the lump and nothing happens. "", ""importance"": ""6"", ""time"": 121609, ""tag"": ""prac_segB_desc""}","description"
"942","1183",1713190705838,"8","6","practice","1","2",12,33,"The two ox are still arguing over whether they are looking at an alligator or a log in the water. The one who think's it's an alligator gets more emphatic and increasingly bored and frustrated that the other ox still believes it is a log. To try to prove his point he's thrown a rock at it, kicked water at it, and poked it with its hooves before finally jumping on top of it, desperate to prove a point even though that would prove a terrible risk to his life if he's right.",6,6,"prac_segB_desc","/static/video/Prac/wildebeest_part2.mp4","{""phase"": ""description"", ""counterbalance"": 6, ""vidpath"": ""/static/video/Prac/wildebeest_part2.mp4"", ""descstop"": 1, ""vidpair"": 2, ""offset"": ""33"", ""content"": ""The two ox are still arguing over whether they are looking at an alligator or a log in the water. The one who think's it's an alligator gets more emphatic and increasingly bored and frustrated that the other ox still believes it is a log. To try to prove his point he's thrown a rock at it, kicked water at it, and poked it with its hooves before finally jumping on top of it, desperate to prove a point even though that would prove a terrible risk to his life if he's right."", ""importance"": ""6"", ""time"": 272958, ""tag"": ""prac_segB_desc""}","description"
"948","1184",1701961477369,"8","6","practice","1","2",12,33,"One buffalo believes that there is a crocodile in the water while the other believes it is just a log. The one that thinks it is a crocodile throws a stone to see if the object moves. It doesn't. Then it pokes it with a stick and splashes water on it. It still doesn't move. Finally it jumps onto the object. ",5,5,"prac_segB_desc","/static/video/Prac/wildebeest_part2.mp4","{""phase"": ""description"", ""counterbalance"": 6, ""vidpath"": ""/static/video/Prac/wildebeest_part2.mp4"", ""descstop"": 1, ""vidpair"": 2, ""offset"": ""33"", ""content"": ""One buffalo believes that there is a crocodile in the water while the other believes it is just a log. The one that thinks it is a crocodile throws a stone to see if the object moves. It doesn't. Then it pokes it with a stick and splashes water on it. It still doesn't move. Finally it jumps onto the object. "", ""importance"": ""5"", ""time"": 120163, ""tag"": ""prac_segB_desc""}","description"
"954","1185",1701962693242,"8","2","practice","1","2",12,33,"There are two buffalos near the river, on tells the other that they think that is a crocodile in the water and the other says it's a log. The one throws a rock to see if it moves, it does not move. so it decides to poke it with a stick. the thing does not move. the buffalo then decides to jump on the floating object in the river.  ",5,5,"prac_segB_desc","/static/video/Prac/wildebeest_part2.mp4","{""phase"": ""description"", ""counterbalance"": 2, ""vidpath"": ""/static/video/Prac/wildebeest_part2.mp4"", ""descstop"": 1, ""vidpair"": 2, ""offset"": ""33"", ""content"": ""There are two buffalos near the river, on tells the other that they think that is a crocodile in the water and the other says it's a log. The one throws a rock to see if it moves, it does not move. so it decides to poke it with a stick. the thing does not move. the buffalo then decides to jump on the floating object in the river.  "", ""importance"": ""5"", ""time"": 133667, ""tag"": ""prac_segB_desc""}","description"
"960","1187",1702749295552,"8","4","practice","1","2",12,33,"The two bizons continue to argue if the object in the water is infact a alligator or a log. One of the bizons pokes the object with a stick and then continues the disagreement with the other bizon. The bizon then splashes the object with water from the river.",5,5,"prac_segB_desc","/static/video/Prac/wildebeest_part2.mp4","{""phase"": ""description"", ""counterbalance"": 4, ""vidpath"": ""/static/video/Prac/wildebeest_part2.mp4"", ""descstop"": 1, ""vidpair"": 2, ""offset"": ""33"", ""content"": ""The two bizons continue to argue if the object in the water is infact a alligator or a log. One of the bizons pokes the object with a stick and then continues the disagreement with the other bizon. The bizon then splashes the object with water from the river."", ""importance"": ""5"", ""time"": 119453, ""tag"": ""prac_segB_desc""}","description"
"966","1188",1698331909749,"8","6","practice","1","2",12,33,"Two bulls are standing by the waters edge. They see an onbject in the water and can't agree on what the object is. one bull thinks it is a log, the other bull thinks it is a crocodile. One bull throws a stone at the object, the object doesn't move. The same bull then pokes the object with a stick, again the object doesn't move. The bull then decides to jump on the object.",6,6,"prac_segB_desc","/static/video/Prac/wildebeest_part2.mp4","{""phase"": ""description"", ""counterbalance"": 6, ""vidpath"": ""/static/video/Prac/wildebeest_part2.mp4"", ""descstop"": 1, ""vidpair"": 2, ""offset"": ""33"", ""content"": ""Two bulls are standing by the waters edge. They see an onbject in the water and can't agree on what the object is. one bull thinks it is a log, the other bull thinks it is a crocodile. One bull throws a stone at the object, the object doesn't move. The same bull then pokes the object with a stick, again the object doesn't move. The bull then decides to jump on the object."", ""importance"": ""6"", ""time"": 122483, ""tag"": ""prac_segB_desc""}","description"
"972","1189",1698331811353,"8","8","practice","1","2",12,33,"The animal that's closer to the viewer said that the object in the water is a log. The further animal said that it's an alligator and threw a rock at it. The object didn't move. The closer animal said that it's a log. The further animal said that it's an alligator and poked it with a stick. The object bobbed but didn't move apart from that. The closer animal said that it's a log. The further animal said that it's an alligator and splashed the water in front of it with its hoof. When the object didn't move the further animal stood on top of it.",6,6,"prac_segB_desc","/static/video/Prac/wildebeest_part2.mp4","{""phase"": ""description"", ""counterbalance"": 8, ""vidpath"": ""/static/video/Prac/wildebeest_part2.mp4"", ""descstop"": 1, ""vidpair"": 2, ""offset"": ""33"", ""content"": ""The animal that's closer to the viewer said that the object in the water is a log. The further animal said that it's an alligator and threw a rock at it. The object didn't move. The closer animal said that it's a log. The further animal said that it's an alligator and poked it with a stick. The object bobbed but didn't move apart from that. The closer animal said that it's a log. The further animal said that it's an alligator and splashed the water in front of it with its hoof. When the object didn't move the further animal stood on top of it."", ""importance"": ""6"", ""time"": 148765, ""tag"": ""prac_segB_desc""}","description"
"978","1190",1698251618403,"8","2","practice","1","2",12,33,"Two buffalos are trying to cross a river. They see something in the river. One thinks it is a crocodile, while the other thinks it is a log. One throws stones at it to see if it is alive. He then pokes it with a stick and finally jumps on it to see if it is a crocodile or a log",5,5,"prac_segB_desc","/static/video/Prac/wildebeest_part2.mp4","{""phase"": ""description"", ""counterbalance"": 2, ""vidpath"": ""/static/video/Prac/wildebeest_part2.mp4"", ""descstop"": 1, ""vidpair"": 2, ""offset"": ""33"", ""content"": ""Two buffalos are trying to cross a river. They see something in the river. One thinks it is a crocodile, while the other thinks it is a log. One throws stones at it to see if it is alive. He then pokes it with a stick and finally jumps on it to see if it is a crocodile or a log"", ""importance"": ""5"", ""time"": 120566, ""tag"": ""prac_segB_desc""}","description"
"984","1191",1698251848459,"8","0","practice","1","2",12,33,"there was two buffalos that were arguing by the river bank about what was floating in the water. one said its crocodile while the other one was convinces it is just a log so to prove who is right the buffalo that said the thing floating is a crocodile decide to splash the water for a reaction and when he did not get one, he climbed on top of the object.",7,7,"prac_segB_desc","/static/video/Prac/wildebeest_part2.mp4","{""phase"": ""description"", ""counterbalance"": 0, ""vidpath"": ""/static/video/Prac/wildebeest_part2.mp4"", ""descstop"": 1, ""vidpair"": 2, ""offset"": ""33"", ""content"": ""there was two buffalos that were arguing by the river bank about what was floating in the water. one said its crocodile while the other one was convinces it is just a log so to prove who is right the buffalo that said the thing floating is a crocodile decide to splash the water for a reaction and when he did not get one, he climbed on top of the object."", ""importance"": ""7"", ""time"": 149217, ""tag"": ""prac_segB_desc""}","description"
